ApplicationID,ApplicationNumber,ApplicantType,SuppCount,ProductCount,CoverageCount,PrizeCount,ParticipatingInstitutionCount,WhitePaper,WhitePaperPath,PDFirstname,PDMiddlename,PDLastname,PDNameSuffix,CoPDFirstname,CoPDMiddlename,CoPDLastname,CoPDNameSuffix,Participants,GranteeDisplay,Institution,InstCity,InstState,InstPostalCode,InstCountry,CouncilDate,YearAwarded,ProjectTitle,PrimaryDiscipline,AllDisciplines,ProgramID,ProgramName,DivisionID,DivisionName,OfferedOutright,OfferedMatching,ApprovedOutright,ApprovedMatching,AwardOutright,AwardMatching,OriginalAmount,SupplementAmount,GrantPeriod,ProjectDesc,ToSupport
155162,GL-21708-02,1,0,0,0,0,0,0,,Helen,M.,Sheehy,,,,,,Helen M. Sheehy (Project Director: April 2001 to June 2002),"Penn State (University Park, PA 16802-1503)<br/>Helen M. Sheehy (Project Director: April 2001 to June 2002)</div>",Penn State,University Park,PA,16802-1503,USA,7/1/2001,2001,"Presidents, Politics and Power",U.S. History,U.S. History,7,Humanities Projects in Libraries and Archives,2,Public Programs,0,0,1000,0,1000,0,1000,0,8/1/2001 &ndash; 8/31/2002,"<p>Scholar-led film viewing, reading, and discussion programs for audiences at the community library about six twentieth-century U.S. presidents and their influence on American history.</p>",
153851,FT-45654-01,2,0,0,0,0,0,0,,Peter,,Dendle,,,,,,Peter Dendle (Project Director: October 2000 to March 2002),"Peter Dendle<br/>Pennsylvania State University, Mont Alto Campus (Mont Alto, PA 17237)","Pennsylvania State University, Mont Alto Campus",Mont Alto,PA,17237,USA,3/1/2001,2001,Demon Possession in Anglo-Saxon England,"History and Philosophy of Science, Technology, and Medicine","History and Philosophy of Science, Technology, and Medicine",3,Summer Stipends,6,Research Programs,0,0,4500,0,4500,0,4500,0,5/1/2001 &ndash; 9/30/2001,<p>No project description available</p>,
153952,FT-46259-01,2,0,1,0,0,0,0,,Linda,,Woodbridge,,,,,,Linda Woodbridge (Project Director: October 2000 to September 2001),"Linda Woodbridge<br/>Penn State (University Park, PA 16802-1503)",Penn State,University Park,PA,16802-1503,USA,3/1/2001,2001,Getting What One Deserves: The Economics of Revenge Tragedy in English Renaissance Drama,British Literature,British Literature,3,Summer Stipends,6,Research Programs,0,0,4500,0,4500,0,4500,0,5/1/2001 &ndash; 9/30/2001,<p>No project description available</p>,
161786,RZ-20747-01,1,0,0,0,0,0,0,,Thomas,A.,Hale,,,,,,Thomas A. Hale (Project Director: September 2000 to April 2008),"Penn State (University Park, PA 16802-1503)<br/>Thomas A. Hale (Project Director: September 2000 to April 2008)</div>",Penn State,University Park,PA,16802-1503,USA,3/1/2001,2001,Women's Voices from West Africa,African Literature,African Literature,5,Collaborative Research,6,Research Programs,150000,0,150000,0,150000,0,150000,0,6/1/2001 &ndash; 5/31/2007,"<p>To support the collection and analysis of praise songs, epics, and other poetic forms sung by women in the West African Sahel and Savanna regions to gain a better understanding of how this verbal tradition enables women to contribute to public and private discourse in West African society.</p>
<p>Ethics and gender stereotyping along with a lack of understanding of non-Western languages have contributed historically to a distorted view of women in societies outside the West, especially in Africa. In the Sahel and Savanna region of West Africa, Islam and colonialism have exacerbated the problem by muting women's voices. But recent research on women's songs from this region reveals that females have a powerful voice in songs performed in African languages and in a variety of contexts, public and private. The purpose here is to bring together fifteen researchers on women's songs in order to synthesize and diffuse information that will change our understanding of women in West Africa. The outcomes will contribute to a developing global awareness of how gender is often interpreted differently in societies outside the West.</p>",
142753,EH-22305-01,1,0,1,0,0,0,0,,Anne,H.,Hawkins,,,,,,Anne H. Hawkins (Project Director: March 2001 to September 2003),"Pennsylvania State University, Hershey Medical Center (Hershey, PA 17033-2360)<br/>Anne H. Hawkins (Project Director: March 2001 to September 2003)</div>","Pennsylvania State University, Hershey Medical Center",Hershey,PA,17033-2360,USA,7/1/2001,2001,"Medicine, Literature and Culture","Interdisciplinary Studies, General","Interdisciplinary Studies, General",13,Institutes for Higher Education Faculty,7,Education Programs,0,0,137500,0,137500,0,137500,0,10/1/2001 &ndash; 12/31/2002,<p>A four-week national institute for college and university teachers using literary and cultural analysis to study medical practice.</p>,
142736,EH-22263-00,1,0,0,0,0,0,0,,Daniel,,Beaver,,,,,,Daniel Beaver (Project Director: March 2000 to September 2003),"Penn State (University Park, PA 16802-1503)<br/>Daniel Beaver (Project Director: March 2000 to September 2003)</div>",Penn State,University Park,PA,16802-1503,USA,7/1/2000,2000,"Space and Society in the Past: Landscape, Power, and Identity in the Early Modern Atlantic World","Interdisciplinary Studies, General","Interdisciplinary Studies, General",13,Institutes for Higher Education Faculty,7,Education Programs,0,0,147247,0,147247,0,147247,0,10/1/2000 &ndash; 12/31/2002,<p>A five-week national institute for 25 college and university teachers to study evolving notions of identity in the Atlantic world. The institute is organized around themes illustrating the interdisciplinary nature of the field.</p>,
151630,FS-23230-00,1,0,0,0,0,0,0,,John,J.,Stuhr,,,,,,John J. Stuhr (Project Director: March 2000 to April 2003),"Penn State (University Park, PA 16802-1503)<br/>John J. Stuhr (Project Director: March 2000 to April 2003)</div>",Penn State,University Park,PA,16802-1503,USA,7/1/2000,2000,American Pragmatism and Culture: Art and Society,History of Philosophy,History of Philosophy,23,Seminars for Higher Education Faculty,7,Education Programs,0,0,96387,0,96387,0,96387,0,10/1/2000 &ndash; 9/30/2001,<p>No project description available</p>,
153758,FT-45031-00,2,0,0,0,0,0,0,,Cheryl,J.,Glenn,,,,,,Cheryl J. Glenn (Project Director: October 1999 to April 2001),"Cheryl J. Glenn<br/>Penn State (University Park, PA 16802-1503)",Penn State,University Park,PA,16802-1503,USA,3/1/2000,2000,Unspoken: A Rhetoric of Silence,Composition and Rhetoric,Composition and Rhetoric,3,Summer Stipends,6,Research Programs,0,0,4000,0,4000,0,4000,0,5/1/2000 &ndash; 9/30/2000,<p>No project description available</p>,
153577,FT-43932-99,2,0,0,0,0,0,0,,Sandra,H.,Petrulionis,,,,,,Sandra H. Petrulionis (Project Director: October 1998 to October 1999),"Sandra H. Petrulionis<br/>Pennsylvania State University, Altoona Campus (Altoona, PA 16601-3777)","Pennsylvania State University, Altoona Campus",Altoona,PA,16601-3777,USA,3/1/1999,1999,The Abolitionist Career of Henry David Thoreau,American Literature,American Literature,3,Summer Stipends,6,Research Programs,0,0,4000,0,4000,0,4000,0,5/1/1999 &ndash; 9/30/1999,<p>No project description available</p>,
151609,FS-23178-99,1,0,1,0,0,0,0,,Robert,Roy,Edwards,,,,,,Robert Roy Edwards (Project Director: March 1999 to March 2001),"Penn State (University Park, PA 16802-1503)<br/>Robert Roy Edwards (Project Director: March 1999 to March 2001)</div>",Penn State,University Park,PA,16802-1503,USA,7/1/1999,1999,Chaucer Ancient and Modern,British Literature,British Literature,23,Seminars for Higher Education Faculty,7,Education Programs,0,0,99111,0,88836.98,0,88836.98,0,10/1/1999 &ndash; 9/30/2000,<p>No project description available</p>,
153453,FT-43043-98,2,0,0,0,0,0,0,,Anthony,,Cutler,,,,,,Anthony Cutler (Project Director: October 1997 to June 2002),"Anthony Cutler<br/>Penn State (University Park, PA 16802-1503)",Penn State,University Park,PA,16802-1503,USA,3/1/1998,1998,Gift Exchange Between Christians and Moslems in the Medieval Mediterranean,"Interdisciplinary Studies, General","Interdisciplinary Studies, General",3,Summer Stipends,6,Research Programs,0,0,4000,0,0,0,0,0,5/1/1998 &ndash; 9/30/1998,<p>No project description available</p>,
145034,FA-34921-98,2,0,0,0,0,0,0,,James L. W.,,West III,,,,,,James L. W. West III (Project Director: May 1997 to September 1999),"James L. W. West III<br/>Penn State (University Park, PA 16802-1503)",Penn State,University Park,PA,16802-1503,USA,11/1/1997,1998,F. Scott Fitzgerald's TRIMALCHIO: (Ur-Version of THE GREAT GATSBY),American Literature,American Literature,1,Fellowships for University Teachers,6,Research Programs,0,0,30000,0,30000,0,30000,0,8/1/1998 &ndash; 5/31/1999,<p>No project description available</p>,
145049,FA-34989-98,2,0,0,0,0,0,0,,Paul Lawrence,,Rose,,,,,,Paul Lawrence Rose (Project Director: May 1997 to November 1999),"Paul Lawrence Rose<br/>Penn State (University Park, PA 16802-1503)",Penn State,University Park,PA,16802-1503,USA,11/1/1997,1998,The Image of the Talmud in the History of Antisemitism,European History,European History,1,Fellowships for University Teachers,6,Research Programs,0,0,30000,0,30000,0,30000,0,7/1/1998 &ndash; 6/30/1999,<p>No project description available</p>,
146721,FB-35130-98,2,0,0,0,0,0,0,,Roy,Raymond,Robson,,,,,,Roy Raymond Robson (Project Director: May 1997 to December 1999),"Roy Raymond Robson<br/>Pennsylvania State University, Altoona Campus (Fayetteville, NC 28301-4298)","Pennsylvania State University, Altoona Campus",Fayetteville,NC,28301-4298,USA,11/1/1997,1998,The Solovetskii Islands as a Window on Russian History,Russian History,Russian History,2,Fellowships for College Teachers and Independent Scholars,6,Research Programs,0,0,30000,0,30000,0,30000,0,7/1/1998 &ndash; 6/30/1999,<p>No project description available</p>,
144865,FA-33862-96,2,0,0,0,0,0,0,,Steven,,Heine,,,,,,Steven Heine (Project Director: May 1995 to present),"Steven Heine<br/>Penn State (University Park, PA 16802-1503)",Penn State,University Park,PA,16802-1503,USA,11/1/1995,1996,Philosophical and Popular Religious Traditions in Zen Buddhism,Nonwestern Religion,Nonwestern Religion,1,Fellowships for University Teachers,6,Research Programs,0,0,30000,0,30000,0,30000,0,6/1/1996 &ndash; 4/30/1997,<p>No project description available</p>,
153277,FT-41665-95,2,0,0,0,0,0,0,,Mary,F.,Linda,,,,,,Mary F. Linda (Project Director: October 1994 to February 1996),"Mary F. Linda<br/>Penn State (University Park, PA 16802-1503)",Penn State,University Park,PA,16802-1503,USA,2/1/1995,1995,Hindu Temple Sponsorship: A Reappraisal,Asian Studies,Asian Studies,3,Summer Stipends,6,Research Programs,0,0,4000,0,4000,0,4000,0,5/1/1995 &ndash; 9/30/1995,<p>No project description available</p>,
150620,FI-27683-95,2,0,0,0,0,0,0,,Mara,L.,Shimskey,,,,,,Mara L. Shimskey (Project Director: November 1994 to October 1995),"Mara L. Shimskey<br/>Penn State (University Park, PA 16802-1503)",Penn State,University Park,PA,16802-1503,USA,2/1/1995,1995,A Study of the Scribes in the Castleford Manuscript,Comparative Literature,Comparative Literature,56,"Younger Scholars, 2/86 - 2/95",9,Fellowships and Seminars,0,0,2500,0,2500,0,2500,0,6/1/1995 &ndash; 8/31/1995,<p>No project description available</p>,
151014,FJ-21713-95,2,0,0,0,0,0,0,,Tace,M.,Hedrick,,,,,,Tace M. Hedrick (Project Director: August 1994 to October 1995),"Tace M. Hedrick<br/>Pennsylvania State University, Harrisburg (Middletown, PA 17057-4846)","Pennsylvania State University, Harrisburg",Middletown,PA,17057-4846,USA,2/1/1995,1995,The Personal as Political: Latin American Women's Writing,Latin American Studies,Gender Studies; Latin American Studies,57,Study Grants for College Teachers,9,Fellowships and Seminars,0,0,3000,0,3000,0,3000,0,6/1/1995 &ndash; 7/31/1995,<p>No project description available</p>,
151015,FJ-21716-95,2,0,0,0,0,0,0,,Michael,B.,Kane,,,,,,Michael B. Kane (Project Director: August 1994 to November 1995),"Michael B. Kane<br/>Pennsylvania State University, Berks Campus (Reading, PA 19608)","Pennsylvania State University, Berks Campus",Reading,PA,19608,USA,2/1/1995,1995,The Impact of Blues and Jazz on Our National Identity,African American Studies,African American Studies,57,Study Grants for College Teachers,9,Fellowships and Seminars,0,0,3000,0,3000,0,3000,0,6/1/1995 &ndash; 7/31/1995,<p>No project description available</p>,
161109,RP-21888-95,1,0,0,0,0,0,0,,Sanford,G.,Thatcher,,,,,,Sanford G. Thatcher (Project Director: February 1995 to June 1997),"Penn State (University Park, PA 16802-1503)<br/>Sanford G. Thatcher (Project Director: February 1995 to June 1997)</div>",Penn State,University Park,PA,16802-1503,USA,7/1/1995,1995,"The Religion of Socrates, by Mark McPherran",History of Philosophy,History of Philosophy,64,Scholarly Publications,6,Research Programs,0,0,7000,0,7000,0,7000,0,9/1/1995 &ndash; 1/31/1997,<p>To support the publication of a comprehensive discussion of Socrates as a religious thinker.</p>,
161078,RP-21819-94,1,0,0,0,0,0,0,,Sanford,G.,Thatcher,,,,,,Sanford G. Thatcher (Project Director: March 1994 to June 1997),"Penn State (University Park, PA 16802-1503)<br/>Sanford G. Thatcher (Project Director: March 1994 to June 1997)</div>",Penn State,University Park,PA,16802-1503,USA,8/1/1994,1994,"Peasants, Lords, and Legislators: Seigneurial Rights and Revolution in France, 1788-1793, by John Markoff",East Asian History,East Asian History,64,Scholarly Publications,6,Research Programs,0,0,7000,0,7000,0,7000,0,10/1/1994 &ndash; 12/31/1996,<p>To support the publication of a study of the French Revolution based on an analysis of lists of grievances and records of peasant uprisings.</p>,
150922,FJ-21193-94,2,0,0,0,0,0,0,,Lois,E.,Rubin,,,,,,Lois E. Rubin (Project Director: August 1993 to August 1994),"Lois E. Rubin<br/>Pennsylvania State University, New Kensington (New Kensington, PA 15068-1765)","Pennsylvania State University, New Kensington",New Kensington,PA,15068-1765,USA,2/1/1994,1994,"Autobiography: A Window into Native American, Latino, and Asian American Cultures",Ethnic Studies,Ethnic Studies,57,Study Grants for College Teachers,9,Fellowships and Seminars,0,0,3000,0,3000,0,3000,0,6/1/1994 &ndash; 8/31/1994,<p>No project description available</p>,
144641,FA-32378-94,2,0,1,0,0,0,0,,Philip,H.,Baldi,,,,,,Philip H. Baldi (Project Director: May 1993 to November 1995),"Philip H. Baldi<br/>Penn State (University Park, PA 16802-1503)",Penn State,University Park,PA,16802-1503,USA,11/1/1993,1994,The Linguistic History of the Latin Language,Linguistics,Linguistics,1,Fellowships for University Teachers,6,Research Programs,0,0,30000,0,23124,0,23124,0,7/1/1994 &ndash; 6/30/1995,<p>No project description available</p>,
144704,FA-32817-94,2,0,1,0,0,0,0,,James L. W.,,West III,,,,,,James L. W. West III (Project Director: May 1993 to October 1995),"James L. W. West III<br/>Penn State (University Park, PA 16802-1503)",Penn State,University Park,PA,16802-1503,USA,11/1/1993,1994,William Styron: A Life,American Literature,American Literature,1,Fellowships for University Teachers,6,Research Programs,0,0,30000,0,30000,0,30000,0,6/1/1994 &ndash; 5/31/1995,<p>No project description available</p>,
144708,FA-32843-94,2,0,0,0,0,0,0,,Frederick,A.,De Armas,,,,,,Frederick A. De Armas (Project Director: May 1993 to January 1996),"Frederick A. De Armas<br/>Penn State (University Park, PA 16802-1503)",Penn State,University Park,PA,16802-1503,USA,11/1/1993,1994,A Theater of the Planetary Gods: Myth and History in the Spanish Golden Age,Spanish Literature,Spanish Literature,1,Fellowships for University Teachers,6,Research Programs,0,0,30000,0,30000,0,30000,0,1/1/1995 &ndash; 12/31/1995,<p>No project description available</p>,
147104,FD-20143-93,2,0,0,0,0,0,0,,Craig,E.,Bertolet,,,,,,Craig E. Bertolet (Project Director: November 1992 to August 1994),"Craig E. Bertolet<br/>Penn State (University Park, PA 16802-1503)",Penn State,University Park,PA,16802-1503,USA,5/1/1993,1993,"The Rise of London Literature: Chaucer, Gower, Langland, and the Poetics of the City in Late Medieval English Poetry",British Literature,British Literature,46,Dissertation Grants,9,Fellowships and Seminars,0,0,17500,0,17500,0,17500,0,8/1/1993 &ndash; 7/31/1994,<p>No project description available</p>,
150845,FJ-20897-93,2,0,0,0,0,0,0,,Todd,L.,Adams,,,,,,Todd L. Adams (Project Director: August 1992 to September 1993),"Todd L. Adams<br/>Pennsylvania State University, Worthington Scranton (Dunmore, PA 18512-1602)","Pennsylvania State University, Worthington Scranton",Dunmore,PA,18512-1602,USA,2/1/1993,1993,"James McCosh: Philosopher, Educator",History of Philosophy,History of Philosophy,57,Study Grants for College Teachers,9,Fellowships and Seminars,0,0,3000,0,3000,0,3000,0,5/1/1993 &ndash; 6/30/1993,<p>No project description available</p>,
150866,FJ-20963-93,2,0,0,0,0,0,0,,Eugene,W.,Miller,Jr,,,,,Eugene W. Miller (Project Director: August 1992 to November 1993),"Eugene W. Miller, Jr<br/>Pennsylvania State University, Hazleton Campus (Hazleton, PA 18201)","Pennsylvania State University, Hazleton Campus",Hazleton,PA,18201,USA,2/1/1993,1993,The Role of Women in the Western Tradition,European History,European History,57,Study Grants for College Teachers,9,Fellowships and Seminars,0,0,3000,0,3000,0,3000,0,7/1/1993 &ndash; 8/31/1993,<p>No project description available</p>,
149352,FE-27958-93,2,0,0,0,0,0,0,,William,B.,McCarthy,,,,,,William B. McCarthy (Project Director: July 1992 to August 1995),"William B. McCarthy<br/>Pennsylvania State University, Du Bois Campus (DuBois, PA 15801)","Pennsylvania State University, Du Bois Campus",DuBois,PA,15801,USA,11/1/1992,1992,The Tinker Balladeers of Scotland,Folklore and Folklife,Folklore and Folklife,70,"Travel to Collections, 11/85 - 2/95",9,Fellowships and Seminars,0,0,750,0,750,0,750,0,12/1/1992 &ndash; 11/30/1993,<p>No project description available</p>,
152747,FT-37771-93,2,0,0,0,0,0,0,,Robert,Roy,Edwards,,,,,,Robert Roy Edwards (Project Director: October 1992 to February 1994),"Robert Roy Edwards<br/>Penn State (University Park, PA 16802-1503)",Penn State,University Park,PA,16802-1503,USA,2/1/1993,1993,Source and Context in Chaucer's THE FRANKLIN'S TALE,British Literature,British Literature,3,Summer Stipends,6,Research Programs,0,0,4750,0,4750,0,4750,0,5/1/1993 &ndash; 9/30/1993,<p>No project description available</p>,
152770,FT-37898-93,2,0,0,0,0,0,0,,Daniel,J.,Gilman,,,,,,Daniel J. Gilman (Project Director: October 1992 to March 1994),"Daniel J. Gilman<br/>Pennsylvania State University, Hershey Medical Center (Hershey, PA 17033-2360)","Pennsylvania State University, Hershey Medical Center",Hershey,PA,17033-2360,USA,2/1/1993,1993,A Naturalist's Perspective on Pictorial Representation,"Philosophy, General","Philosophy, General",3,Summer Stipends,6,Research Programs,0,0,4000,0,4000,0,4000,0,5/1/1993 &ndash; 10/31/1993,<p>No project description available</p>,
152816,FT-38187-93,2,0,0,0,0,0,0,,Alison,D.,Hirsch,,,,,,Alison D. Hirsch (Project Director: October 1992 to May 1994),"Alison D. Hirsch<br/>Pennsylvania State University, Harrisburg (Middletown, PA 17057-4846)","Pennsylvania State University, Harrisburg",Middletown,PA,17057-4846,USA,2/1/1993,1993,The World of Hannah Penn: The Social and Economic Life of 18th-Century Women,U.S. History,U.S. History,3,Summer Stipends,6,Research Programs,0,0,4750,0,4750,0,4750,0,5/1/1993 &ndash; 9/30/1993,<p>No project description available</p>,
152901,FT-38768-93,2,0,0,0,0,0,0,,Phyllis,B.,Cole,,,,,,Phyllis B. Cole (Project Director: October 1992 to October 1993),"Phyllis B. Cole<br/>Pennsylvania State University, Brandywine (Media, PA 19063-5522)","Pennsylvania State University, Brandywine",Media,PA,19063-5522,USA,2/1/1993,1993,Mary Moody Emerson and Her Family,American Literature,American Literature,3,Summer Stipends,6,Research Programs,0,0,4750,0,4750,0,4750,0,5/1/1993 &ndash; 7/31/1993,<p>No project description available</p>,
142559,EH-21683-93,1,0,0,0,0,0,0,,Carl,,Mitcham,,,,,,Carl Mitcham (Project Director: October 1992 to July 1995),"Penn State (University Park, PA 16802-1503)<br/>Carl Mitcham (Project Director: October 1992 to July 1995)</div>",Penn State,University Park,PA,16802-1503,USA,2/1/1993,1993,Rethinking Technology: Philosophical Reflection on Technology Since World War II,"Philosophy, General","Philosophy, General",13,Institutes for Higher Education Faculty,7,Education Programs,0,0,165034,0,161906.72,0,161906.72,0,8/1/1993 &ndash; 10/31/1994,<p>To support a five-week summer institute for 25 college and university faculty members on the response of philosophy to technological developments since World War II.</p>,
142586,EH-21751-93,1,0,2,0,0,0,0,,Frederick,A.,De Armas,,,,,,Frederick A. De Armas (Project Director: April 1993 to July 1995),"Penn State (University Park, PA 16802-1503)<br/>Frederick A. De Armas (Project Director: April 1993 to July 1995)</div>",Penn State,University Park,PA,16802-1503,USA,8/1/1993,1993,"A Star-Crossed Golden Age: Myth, Empire, and the Spanish COMEDIA",Spanish Literature,Spanish Literature,13,Institutes for Higher Education Faculty,7,Education Programs,168948,0,168948,0,142333.34,0,142333.34,0,10/1/1993 &ndash; 9/30/1994,<p>To support a five-week institute for 25 college and university faculty members on Spanish Golden Age drama from 1588 to 1681.</p>,
161021,RP-21681-93,1,0,0,0,0,0,0,,Sanford,G.,Thatcher,,,,,,Sanford G. Thatcher (Project Director: March 1993 to July 1995),"Penn State (University Park, PA 16802-1503)<br/>Sanford G. Thatcher (Project Director: March 1993 to July 1995)</div>",Penn State,University Park,PA,16802-1503,USA,8/1/1993,1993,"Islamization and Native Religion in the Golden Horde, by Devin A. De Weese",History of Religion,History of Religion,64,Scholarly Publications,6,Research Programs,0,0,7000,0,7000,0,7000,0,10/1/1993 &ndash; 3/31/1995,"<p>To support the publication of a study of the Islamization of the Golden Horde in the 14th century, and its ramifications.</p>",
159589,RE-21132-93,1,0,0,0,0,0,0,,Alan,,Knight,,,,,,Alan Knight (Project Director: June 1992 to January 1996),"Penn State (University Park, PA 16802-1503)<br/>Alan Knight (Project Director: June 1992 to January 1996)</div>",Penn State,University Park,PA,16802-1503,USA,2/1/1993,1993,A Critical Edition of the Pageant Plays of Lille,French Literature,French Literature,47,Editions,6,Research Programs,95000,0,95000,0,90135.43,0,90135.43,0,7/1/1993 &ndash; 6/30/1995,<p>To support the preparation of a critical edition of 15th-century pageant plays of Lille.</p>,
160627,RO-22620-93,1,0,0,0,0,0,0,,Joseph,G.,Price,,,,,,Joseph G. Price (Project Director: October 1992 to July 1997),"Penn State (University Park, PA 16802-1503)<br/>Joseph G. Price (Project Director: October 1992 to July 1997)</div>",Penn State,University Park,PA,16802-1503,USA,5/1/1993,1993,"Shakespeare in the World of Communism, 1920-90",Comparative Literature,Comparative Literature,40,Basic Research,6,Research Programs,100000,15000,100000,15000,98157.45,0,98157.45,0,7/1/1993 &ndash; 6/30/1996,"<p>To support a comprehensive study of how works of Shakespeare were adapted, reconstructed, and absorbed into Communist ideology in order to advance and reinforce Marxist concepts of proletarian rule.</p>",
160592,RO-22443-92,1,0,1,0,0,0,0,,George,R.,Milner,,,,,,George R. Milner (Project Director: October 1991 to April 1996),"Penn State (University Park, PA 16802-1503)<br/>George R. Milner (Project Director: October 1991 to April 1996)</div>",Penn State,University Park,PA,16802-1503,USA,5/1/1992,1992,Ancient Chiefdoms in the Eastern Woodlands: The View from Cahokia,Archaeology,Archaeology,40,Basic Research,6,Research Programs,0,12442,44327,12442,43412.1,5000,48412.1,0,7/1/1992 &ndash; 6/30/1995,"<p>To support research and writing of a volume on archaeological sites of the Mississippian period, A.D. 1000-1400, dominated by the Cahokia mounds and social system in Illinois, in its time the most complex polity north of Mexico.</p>",
159695,RG-20028-92,1,2,0,0,0,0,0,,Richard,,Frautschi,,,,,,Richard Frautschi (Project Director: September 1993 to June 1995),"Penn State (University Park, PA 16802-1503)<br/>Richard Frautschi (Project Director: September 1993 to June 1995)</div>",Penn State,University Park,PA,16802-1503,USA,5/1/1992,1992,Completion of a Bibliography of French Prose Fiction 1700-1800: North American Holdings,French Language,French Language,49,Reference Materials - Guides,1,Preservation and Access,0,0,84500,0,84166.37,0,80000,4500,6/1/1992 &ndash; 12/31/1994,"<p>To support the production of 3,200 descriptions of French prose holdings from 1778 to 1800 in North American libraries, which will be contributed to the international Bibliography of French Prose Fiction.</p>",
152546,FT-36276-92,2,0,0,0,0,0,0,,Alegria,,Bendelac,,,,,,Alegria Bendelac (Project Director: October 1991 to February 1993),"Alegria Bendelac<br/>Pennsylvania State University, Schuylkill Campus (Schuylkill, PA 17972)","Pennsylvania State University, Schuylkill Campus",Schuylkill,PA,17972,USA,2/1/1992,1992,A Dictionary of Jaquetia-Spanish/Spanish-Jaquetia,Spanish Language,Spanish Language,3,Summer Stipends,6,Research Programs,0,0,4000,0,4000,0,4000,0,5/1/1992 &ndash; 9/30/1992,<p>No project description available</p>,
152557,FT-36340-92,2,0,0,0,0,0,0,,Sharon,,Dale,,,,,,Sharon Dale (Project Director: October 1991 to October 1992),"Sharon Dale<br/>Pennsylvania State University, Erie-Behrend College (Erie, PA 16563-0001)","Pennsylvania State University, Erie-Behrend College",Erie,PA,16563-0001,USA,2/1/1992,1992,"The Arca di Sant'Agostino in Pavia: A Historic, Theological, and Iconographic Study",Art History and Criticism,Art History and Criticism,3,Summer Stipends,6,Research Programs,0,0,4000,0,4000,0,4000,0,5/1/1992 &ndash; 9/30/1992,<p>No project description available</p>,
