ApplicationID,ApplicationNumber,ApplicantType,SuppCount,ProductCount,CoverageCount,PrizeCount,ParticipatingInstitutionCount,WhitePaper,WhitePaperPath,PDFirstname,PDMiddlename,PDLastname,PDNameSuffix,CoPDFirstname,CoPDMiddlename,CoPDLastname,CoPDNameSuffix,Participants,GranteeDisplay,Institution,InstCity,InstState,InstPostalCode,InstCountry,CouncilDate,YearAwarded,ProjectTitle,PrimaryDiscipline,AllDisciplines,ProgramID,ProgramName,DivisionID,DivisionName,OfferedOutright,OfferedMatching,ApprovedOutright,ApprovedMatching,AwardOutright,AwardMatching,OriginalAmount,SupplementAmount,GrantPeriod,ProjectDesc,ToSupport
211469,FB-56300-12,2,0,0,0,0,0,0,,Gonzalo,,Rubio,,,,,,Gonzalo Rubio (Project Director: May 2011 to October 2013),"Gonzalo Rubio<br/>Penn State (University Park, PA 16802-1503)",Penn State,University Park,PA,16802-1503,USA,11/1/2011,2011,The Earliest Semitic Literature: Ebla and Early Dynastic Mesopotamia,Ancient Literature,Ancient Literature,2,Fellowships for College Teachers and Independent Scholars,6,Research Programs,0,0,50400,0,50400,0,50400,0,8/1/2012 &ndash; 7/31/2013,"<p>The aim of this project is to produce a book containing a detailed study, editions, and translations of the complete corpus of the earliest literary compositions in any Semitic language. This literature is attested in cuneiform clay tablets from Ancient Syria and Mesopotamia and dates to the mid third millennium BCE (the Early Dynastic period). The sites that have yielded these texts are Ebla (northern Syria), Abu Salabikh (southern Iraq), and, to a lesser extent, Mari (on the Syrian border with Iraq). The tablets from Ebla, discovered in 1975, constitute the lion's share of the project. To date, this whole corpus is available mostly in copies and photographs, only a handful of which have been the object of very preliminary studies or translations. Thus, this literature is currently the exclusive territory of a minute group of scholars. This project will finally make these compositions available, in a more definitive and comprehensive fashion, to a much wider audience.</p>",
214557,RQ-50682-12,1,0,2,77,1,0,0,,Sandra,W.,Spanier,,,,,,Sandra W. Spanier (Project Director: December 2011 to June 2016),"Penn State (University Park, PA 16802-1503)<br/>Sandra W. Spanier (Project Director: December 2011 to June 2016)</div>",Penn State,University Park,PA,16802-1503,USA,7/1/2012,2012,The Letters of Ernest Hemingway,American Literature,American Literature,193,Scholarly Editions and Translations,6,Research Programs,225000,0,225000,0,225000,0,225000,0,10/1/2012 &ndash; 9/30/2015,"<p>The preparation for print publication of volumes 2-4 of a projected 16-volume edition of American author Ernest Hemingway's complete letters. (36 months)</p>
<p>This project will result in the publication by Cambridge University Press of a comprehensive scholarly edition of the some 6,000 surviving letters of Ernest Hemingway (1899-1961), about 85% previously unpublished. Winner of the 1954 Nobel Prize for Literature, Hemingway made a profound impact on modern prose. His life and work still command enormous popular as well as scholarly interest worldwide. Besides providing new biographical and artistic insights into the achievement of this most influential American writer, the letters constitute a running eyewitness account and cultural history of much of the twentieth century. The Cambridge Edition of The Letters of Ernest Hemingway will be published in 16 volumes over approximately the next twenty years. Volume 1 (1907-1922) was published in September 2011. The Project is requesting 3-year funding (October 2012-September 2015) to complete and publish volumes 2, 3, and 4, encompassing Hemingway's letters from 1923 through 1932.</p>",
209993,EH-50287-11,1,3,0,0,0,0,0,,Lovalerie,,King,,,,,,Lovalerie King (Project Director: March 2011 to June 2013),"Penn State (University Park, PA 16802-1503)<br/>Lovalerie King (Project Director: March 2011 to June 2013)</div>",Penn State,University Park,PA,16802-1503,USA,7/1/2011,2011,Contemporary African American Literature,Literary Criticism,Literary Criticism,13,Institutes for Higher Education Faculty,7,Education Programs,0,0,178839,0,166556.13,0,173839,5000,10/1/2011 &ndash; 12/31/2012,"<p>A three-week institute for twenty-five college and university faculty members to engage in critical debates on contemporary African-American literature.</p>
<p>“Contemporary African American Literature” is intended for college and university teachers and advanced graduate students who desire to stay abreast of the latest developments in African American literary studies. It aims to facilitate an intensive and collaborative engagement with, and a deeper understanding of, current debates in African American literary studies. Participants will also develop critical tools that may be used in examining and teaching the most widely read and commercially successful contemporary African American literature, including urban literature and graphic novels. </p>",
197897,CH-50685-10,1,0,0,0,0,0,0,,Patrick,H.,Alexander,,,,,,Sanford G. Thatcher (Project Director: May 2009 to December 2009)<br/>Patrick H. Alexander (Project Director: December 2009 to October 2011),"Penn State (University Park, PA 16802-1503)<br/>Sanford G. Thatcher (Project Director: May 2009 to December 2009)<br/>Patrick H. Alexander (Project Director: December 2009 to October 2011)</div>",Penn State,University Park,PA,16802-1503,USA,11/1/2009,2009,Pursuing Penn State's Dream for Excellence in the Humanities Through Publishing,"Interdisciplinary Studies, General","Interdisciplinary Studies, General",18,Challenge Grants,4,Challenge Programs,0,300000,0,300000,0,50000,50000,0,12/1/2008 &ndash; 7/31/2013,"<p>Endowment for publications in fifteen humanities series published by Penn State University Press and making use of varied digital formats.</p>
<p>The Penn State University Press proposes to use an NEH Challenge Grant, together with matching funds, to establish a permanent endowment whose income will provide annually up to $60,000 for support of 15 series in the humanities, spanning fields from art and architecture to colonial Latin American history and Jewish literature. Some of these series will be published online through the Office of Digital Scholarly Publishing, operated jointly by the Libraries and Press at Penn State, and almost all will be able to take advantage of the ODSP to create ""hybrid"" print/online publications.</p>",
199369,FB-55119-10,2,0,0,0,0,0,0,,Nancy,Elizabeth,Locke,,,,,,Nancy Elizabeth Locke (Project Director: May 2009 to September 2011),"Nancy Elizabeth Locke<br/>Penn State (University Park, PA 16802-1503)",Penn State,University Park,PA,16802-1503,USA,11/1/2009,2009,Cezanne's Shadows,Art History and Criticism,Art History and Criticism,2,Fellowships for College Teachers and Independent Scholars,6,Research Programs,0,0,50400,0,50400,0,50400,0,7/1/2010 &ndash; 6/30/2011,"<p>""Cézanne's Shadows,"" which will be my second book, explores the importance of Cézanne's ongoing involvement with the art of the past. In essays devoted to artists such as Poussin, Rubens, Watteau, Chardin, and Delacroix, I argue that Cézanne's art cannot be understood without an investigation into what Cézanne made of these earlier models, and how they continued to haunt even his mature work. The book will become a study of artistic ambitions as well as an analysis of the nineteenth-century art writing that Cézanne encountered. Its main evidence will be close formal readings of Cézanne paintings. Having received grants to do research in France, I will be using the Fellowship primarily for writing.</p>",
202001,FT-58155-10,2,0,0,0,0,0,0,,Jennifer,A.,Boittin,,,,,,Jennifer A. Boittin (Project Director: October 2009 to October 2010),"Jennifer A. Boittin<br/>Penn State (University Park, PA 16802-1503)",Penn State,University Park,PA,16802-1503,USA,2/1/2010,2010,"Feminist Colonizers? French Women in West Africa, Indochina and Martinique, 1900-1939","History, General","History, General",3,Summer Stipends,6,Research Programs,0,0,6000,0,6000,0,6000,0,5/1/2010 &ndash; 9/30/2010,"<p>In the early twentieth century French women and colonized men and women had in common that they were denied rights such as the vote by the French Third Republic. This project investigates how French feminists in French West Africa, Indochina and Martinique who demanded either suffrage and/or a range of other civil rights engaged with French imperialism. Their experiences were set against a backdrop of the colonized's vocal and violent discontent. This project is the first to consider how specific places in an Empire influenced women's political and social understandings of how and where their own searches for rights collided with those of imperial subjects and citizens. It argues for grounding transnational colonial systems in local studies of human interactions. Its diverse sources, comparative nature and many captivating stories will appeal to a broad readership in the humanities. With the NEH summer stipend, I would complete archival research in Dakar, Senegal and France.</p>",
202376,HD-50932-10,1,0,5,0,0,0,1,20091006-HD\GRANT10434355\Reports\13-99055.pdf,Jacqueline,,Reid-Walsh,,,,,,Jacqueline Reid-Walsh (Project Director: October 2009 to April 2014),"Penn State (University Park, PA 16802-1503)<br/>Jacqueline Reid-Walsh (Project Director: October 2009 to April 2014)</div>",Penn State,University Park,PA,16802-1503,USA,2/1/2010,2010,"Learning as Playing: An Animated, Interactive Archive of 17th-19th Century Narrative Media For and By Children","Interdisciplinary Studies, General","Interdisciplinary Studies, General",247,Digital Humanities Start-Up Grants,12,Digital Humanities,0,0,48672,0,45653.22,0,45653.22,0,7/1/2010 &ndash; 12/31/2013,"<p>Development of an animated, interactive, web-based archive of selected 17th -19th century moveable flap books by and for children on the theme of transformation.</p>
<p>""Learning as Playing"" is a digital planning/discovery project proposed by The Pennsylvania State University (Curriculum & Instruction, Art Education, University Libraries, and Information Technology Services/ITS) and the Cotsen Children's Library, Princeton University. The goal is to develop an animated, interactive, web-based archive of selected 17th-19th century movable books by and for children on the theme of transformation, with a start-up project on flap books. These rare, fragile, little documented artifacts combine aspects of book, print and toy, and contain movable parts. The digital innovation will enable a viewer to simulate the experience of playing with these texts by ""virtual touch,"" preserving the originals. This project will change how the history of children's literature is understood to move from ""instruction to delight"" by showing how texts ""of play"" have been produced since the earliest manufacture. It will be a scholarly and teaching resource.</p>",
202716,RQ-50462-10,1,0,3,0,0,0,0,,Sandra,H.,Petrulionis,,,,,,Sandra H. Petrulionis (Project Director: November 2009 to November 2014),"Penn State (University Park, PA 16802-1503)<br/>Sandra H. Petrulionis (Project Director: November 2009 to November 2014)</div>",Penn State,University Park,PA,16802-1503,USA,5/1/2010,2010,The Almanacks of Mary Moody Emerson: A Scholarly Digital Edition,American Literature,American Literature,193,Scholarly Editions and Translations,6,Research Programs,230000,0,230000,0,230000,0,230000,0,9/1/2010 &ndash; 8/31/2013,"<p>Preparation for publication of a scholarly, annotated, digital edition of the complete Almanacks of Mary Moody Emerson. (36 months)</p>
<p>Born in Concord, Massachusetts on the eve of the American Revolution, Mary Moody Emerson (1774-1863) was a self-educated scholar, theologian, and author whose intellectual production bridges the 18th and 19th centuries. Most widely known as the brilliant aunt of Ralph Waldo Emerson, Mary Emerson influenced her nephew's work and published her own pseudonymous essays; her most significant accomplishment is a series of unpublished manuscripts she called ""Almanacks"" (c. 1804-1855). Spanning over fifty years and one thousand pages, these documents feature characteristics of the spiritual diary, philosophical commonplace book, and epistolary essay and demonstrate the ways in which early American women adapted traditionally ""masculine"" genres and subject matter. The editors are collaborating with the director and staff of the Brown University Women Writers Project to publish a scholarly digital edition of the complete Almanacks in their subscription database, Women Writers Online.</p>",
203622,BH-50400-10,1,0,0,0,0,0,0,,George,W.,Boudreau,PhD,,,,,George W. Boudreau (Project Director: March 2010 to November 2014),"Penn State (University Park, PA 16802-1503)<br/>George W. Boudreau (Project Director: March 2010 to November 2014)</div>",Penn State,University Park,PA,16802-1503,USA,7/1/2010,2010,A Rising People: Benjamin Franklin and the Americans,U.S. History,U.S. History,197,Landmarks of American History and Culture,7,Education Programs,0,0,180000,0,179128.21,0,179128.21,0,10/1/2010 &ndash; 6/30/2012,"<p>Two one-week Landmarks workshops for eighty school teachers to explore Benjamin Franklin's influence on the American people through the sites and environs of eighteenth-century Philadelphia.</p>
<p>Hosted by the School of Humanities at Penn State Harrisburg in partnership with a coalition of historic sites and organization in Philadelphia, this grant will sponsor two one-week workshops for K-12 teachers, to be held in the summer of 2011. Teachers will be chosen from a national competition, and will be exposed to cutting-edge interdisciplinary humanities scholarship as well as unparalleled access to some of the most significant sites in American History.</p>",
193645,FA-54912-09,2,0,0,0,0,0,0,,Anthony,Edward,Kaye,,,,,,Anthony Edward Kaye (Project Director: May 2008 to November 2011),"Anthony Edward Kaye<br/>Penn State (University Park, PA 16802-1503)",Penn State,University Park,PA,16802-1503,USA,11/1/2008,2008,Reinterpreting Nat Turner's Rebellion,U.S. History,U.S. History,1,Fellowships for University Teachers,6,Research Programs,0,0,50400,0,50400,0,50400,0,9/1/2009 &ndash; 8/31/2010,"<p>This is a proposal to write a book reinterpreting Nat Turner's rebellion from the standpoint of neighborhoods. A generation of superb revisionist scholarship has trained us to think about slaves in terms of ""the slave community,"" yet slaves thought about their society in terms of ""neighborhoods."" This was the terrain where slaves courted and formed families, worked, worshipped, socialized, and struggled. In a recent book, I described slave neighborhoods at length in Mississippi, where the neighborhood terrain comprised adjoining places, and sketched neighborhoods across the South. In Nat Turner's Confessions, one of the most widely read slave narratives, Turner described the rebellion he led as a neighborhood enterprise. Yet historians have yet to elaborate on the neighborhood leitmotif in the Confessions. This book aims to use the famous Turner insurrection to present neighborhoods as a new angle of vision on slavery for a general audience.</p>",
196068,FW-50076-09,2,0,0,0,0,0,0,,Roy,Raymond,Robson,,,,,,Roy Raymond Robson (Project Director: October 2008 to May 2010),"Roy Raymond Robson<br/>Pennsylvania State University, Altoona Campus (Altoona, PA 16601-3777)","Pennsylvania State University, Altoona Campus",Altoona,PA,16601-3777,USA,2/1/2009,2009,Intellectual Heritage--Time,"Interdisciplinary Studies, General","Interdisciplinary Studies, General",266,Teaching Development Fellowships,6,Research Programs,0,0,21000,0,21000,0,21000,0,6/1/2009 &ndash; 10/31/2009,"<p>""Intellectual Heritage--Time"" is a fifteen-week undergraduate course dedicated to the intellectual history of Time. I am applying for an NEH fellowship to revise this course to include deeper analysis of non-western religious traditions and contemporary philosophy of science. I have taught this topic for five years with over 100 students per year. At present, I am the only professor offering this course, which makes up two-thirds of my annual teaching portfolio. I request five months support from June-October 2009. With outside support, I have the opportunity to reduce my teaching load, allowing me to fulfill the terms of the Fellowship by teaching a single class during the first semester of the 2009-10 academic year. Trained as a historian with strengths in Europe, Russia, and religion, I have expanded my research and teaching to include both ""Intellectual Heritage--Time"" and ""Views of The Cosmos,"" which I team-teach with a theoretical physicist.</p>",
197513,BH-50329-09,1,0,0,0,0,0,0,,George,W.,Boudreau,PhD,,,,,George W. Boudreau (Project Director: March 2009 to November 2014),"Penn State (University Park, PA 16802-1503)<br/>George W. Boudreau (Project Director: March 2009 to November 2014)</div>",Penn State,University Park,PA,16802-1503,USA,7/1/2009,2009,A Rising People: Benjamin Franklin and the Americans,U.S. History,U.S. History,197,Landmarks of American History and Culture,7,Education Programs,0,0,168012,0,168012,0,168012,0,10/1/2009 &ndash; 12/31/2010,"<p>Two Landmarks workshops for eighty teachers on Benjamin Franklin's life and social environment in eighteenth-century Philadelphia.</p>
<p>Hosted by the School of Humanities at Penn State Harrisburg in partnership with a coalition of historic sites and organization in Philadelphia, this grant will sponsor two one-week workshops for K-12 teachers, to be held in the summer of 2010. Teachers will be chosen from a national competition, and will be exposed to cutting-edge interdisciplinary humanities scholarship as well as unparalleled access to come of the most significant sites in American History.</p>",
191304,PJ-50034-08,1,3,0,0,0,0,0,,Lydia,Suzanne,Kellerman,,,,,,Lydia Suzanne Kellerman (Project Director: November 2007 to January 2015),"Penn State (University Park, PA 16802-1503)<br/>Lydia Suzanne Kellerman (Project Director: November 2007 to January 2015)</div>",Penn State,University Park,PA,16802-1503,USA,5/1/2008,2008,"Pennsylvania Digital Newspaper Project, Phase One",American Studies,American Studies,208,National Digital Newspaper Program,1,Preservation and Access,0,0,1108665,0,1108665,0,393650,715015,7/1/2008 &ndash; 8/31/2014,"<p>Digitization of 100,000 pages of Pennsylvania newspapers, dating from 1880 to 1922, as part of the state's participation in the National Digital Newspaper Program (NDNP).</p>
<p>On behalf of the Commonwealth of Pennsylvania, the Pennsylvania State University Libraries requests funding in the amount of $393,650 to support its participation in the National Endowment for the Humanities? National Digital Newspaper Program coordinated by the Library of Congress. In addition to the amount requested from NEH, the Pennsylvania State University Libraries will provide $150,146 in cost-share support for the project. </p>",
191460,RQ-50342-08,1,0,1,99,0,0,0,,Sandra,W.,Spanier,,,,,,Sandra W. Spanier (Project Director: November 2007 to February 2012),"Penn State (University Park, PA 16802-1503)<br/>Sandra W. Spanier (Project Director: November 2007 to February 2012)</div>",Penn State,University Park,PA,16802-1503,USA,5/1/2008,2008,The Letters of Ernest Hemingway,American Literature,American Literature,193,Scholarly Editions and Translations,6,Research Programs,200000,0,200000,0,200000,0,200000,0,7/1/2008 &ndash; 6/30/2011,"<p>Work on the first four volumes (encompassing the years 1908-39) of a twelve-volume scholarly edition of Hemingway's letters. (36 months)</p>
<p>This project will result in the publication by Cambridge University Press of a comprehensive scholarly edition of the estimated 6,000-7,000 letters of Ernest Hemingway, only about ten percent of them ever published. Hemingway's pioneering contributions to American literature made a profound and lasting impact on modern English-language prose style, and his life and work still command enormous popular as well as scholarly interest worldwide. Besides providing new biographical and artistic insights into the achievement of this most influential American writer, the letters constitute a running eyewitness account and cultural history of much of the twentieth century. This edition will be published in twelve volumes over the next fifteen years. We are requesting a three-year funding to see into print volumes 1 and 2, to complete and submit volume 3, and to continue volume 4, together encompassing Hemingway's letters through 1939.</p>",
192102,BH-50291-08,1,0,0,0,0,0,0,,George,W.,Boudreau,PhD,,,,,George W. Boudreau (Project Director: March 2008 to November 2014),"Penn State (University Park, PA 16802-1503)<br/>George W. Boudreau (Project Director: March 2008 to November 2014)</div>",Penn State,University Park,PA,16802-1503,USA,7/1/2008,2008,A Rising People: Benjamin Franklin and the Americans,U.S. History,U.S. History,197,Landmarks of American History and Culture,7,Education Programs,0,0,175000,0,174009.97,0,174009.97,0,10/1/2008 &ndash; 12/31/2010,"<p>Sponsored by the School of Humanities at Penn State Harrisburg, this grant will sponsor three one-week institutes for K-12 teachers, to be held in the summer of 2009. Teachers will be chosen from a national competition, and will be exposed to cutting-edge interdisciplinary humanities scholarship as well as unparalleled access to come of the most significant sites in American History.</p>",
192374,LT-50040-08,1,0,0,0,0,0,0,,Gregory,A.,Crawford,,,,,,Gregory A. Crawford (Project Director: April 2008 to present),"Penn State (University Park, PA 16802-1503)<br/>Gregory A. Crawford (Project Director: April 2008 to present)</div>",Penn State,University Park,PA,16802-1503,USA,7/1/2008,2008,Pride and Passion: The African American Baseball Experience - A Traveling Exhibition to Libraries,U.S. History,U.S. History,262,Small Grants to Libraries: Pride and Passion,2,Public Programs,0,0,2500,0,2500,0,2500,0,9/1/2008 &ndash; 12/31/2012,"<p>The 1,000-square-foot panel exhibition examines baseball as a reflection of race relations in the United States, asking how baseball has shaped, and been shaped by, national identity and culture. Photographs, broadsides, team rosters, scorecards, and other baseball memorabilia would tell the story of black participation in baseball, from the integrated amateur leagues of the nineteenth century and the creation of segregated Negro Leagues in the Jim Crow era to Jackie Robinson's now-famous breaking of the color barrier in 1947.</p>",
182277,BH-50182-07,1,0,0,0,0,0,0,,George,W.,Boudreau,PhD,,,,,George W. Boudreau (Project Director: March 2006 to September 2008),"Penn State (University Park, PA 16802-1503)<br/>George W. Boudreau (Project Director: March 2006 to September 2008)</div>",Penn State,University Park,PA,16802-1503,USA,7/1/2006,2006,A Rising People: Benjamin Franklin and the Americans,U.S. History,U.S. History,197,Landmarks of American History and Culture,7,Education Programs,210000,0,210000,0,210000,0,210000,0,10/1/2006 &ndash; 9/30/2007,"<p>Three one-week summer workshops for 120 school teachers on Benjamin Franklin's life, ideas, and legacy, utilizing important historical sites in Philadelphia.</p>
<p>Sponsored by the School of Humanities at Penn State Harrisburg, this grant will sponsor three one-week institutes for K-12 teachers, to be held in Philadelphia in the summer of 2007. Teachers will be chosen from a national competition, and will be exposed to cutting-edge interdisciplinary humanities scholarship as well as unparalleled access to some of the most significant sites in American history.</p>",
176786,CZ-50145-06,1,0,0,0,0,0,0,,William,A.,Blair,,,,,,William A. Blair (Project Director: February 2005 to October 2010),"Penn State (University Park, PA 16802-1503)<br/>William A. Blair (Project Director: February 2005 to October 2010)</div>",Penn State,University Park,PA,16802-1503,USA,7/1/2005,2005,The Richards Civil War Era Center: Interpreting the Struggle for Freedom,U.S. History,U.S. History,146,Special Initiatives,4,Challenge Programs,0,1000000,0,1000000,0,1000000,1000000,0,9/1/2004 &ndash; 7/31/2010,"<p>Endowment for faculty and postdoctoral fellowships, summer institutes for school teachers and emerging scholars, conferences, and programs in a center devoted to the study of the Civil War era.</p>
<p>The Richards Civil War Era Center seeks a $1 million NEH Challenge grant to strengthen the study, teaching, and understanding of the Civil War era and the struggles for freedom and citizenship that defined America. Coupled with the Richards Center's current resources, the endowment of $4 million realized from the NEH Challenge Grant will create new humanities programming, building on current efforts to illuminate the history of freedom and citizenship from the establishment of the Constitution through the Civil Rights Movement. An NEH We the People grant will enable the Richards Center to enhance links between the university and the public by stimulating faculty research, training public school teachers, developing curriculum, sponsoring public symposia, and encouraging collaboration between Civil War era historians, public historians, educators, and members of the public. Specifically, the proposal requests support for the following initiatives: a faculty fellowship, a postdoctoral fellowship, workshops with visiting scholars, biennial summer institutes for public school teachers and emerging scholars, undergraduate internships at historic sites, library and web-based instructional materials, and inter-institutional collaboration between Penn State University and public history institutions in the mid-Atlantic region.</p>",
