ApplicationID,ApplicationNumber,ApplicantType,SuppCount,ProductCount,CoverageCount,PrizeCount,ParticipatingInstitutionCount,WhitePaper,WhitePaperPath,PDFirstname,PDMiddlename,PDLastname,PDNameSuffix,CoPDFirstname,CoPDMiddlename,CoPDLastname,CoPDNameSuffix,Participants,GranteeDisplay,Institution,InstCity,InstState,InstPostalCode,InstCountry,CouncilDate,YearAwarded,ProjectTitle,PrimaryDiscipline,AllDisciplines,ProgramID,ProgramName,DivisionID,DivisionName,OfferedOutright,OfferedMatching,ApprovedOutright,ApprovedMatching,AwardOutright,AwardMatching,OriginalAmount,SupplementAmount,GrantPeriod,ProjectDesc,ToSupport
148083,FE-23937-89,2,0,0,0,0,0,0,,Robert,N.,Hudspeth,,,,,,Robert N. Hudspeth (Project Director: February 1989 to August 1989),"Robert N. Hudspeth<br/>Penn State (University Park, PA 16802-1503)",Penn State,University Park,PA,16802-1503,USA,5/1/1989,1989,The Letters of Margaret Fuller,American Literature,American Literature,70,"Travel to Collections, 11/85 - 2/95",9,Fellowships and Seminars,0,0,750,0,750,0,750,0,6/1/1989 &ndash; 11/30/1989,<p>No project description available</p>,
152016,FT-32677-89,2,0,0,0,0,0,0,,Caroline,D.,Eckhardt,,,,,,Caroline D. Eckhardt (Project Director: October 1988 to January 1990),"Caroline D. Eckhardt<br/>Penn State (University Park, PA 16802-1503)",Penn State,University Park,PA,16802-1503,USA,2/1/1989,1989,The Middle English Poem CASTLEFORD'S CHRONICLE: An Edition,British Literature,British Literature,3,Summer Stipends,6,Research Programs,0,0,3500,0,3500,0,3500,0,5/1/1989 &ndash; 9/30/1989,<p>No project description available</p>,
152043,FT-32876-89,2,0,0,0,0,0,0,,Laura,L.,Knoppers,,,,,,Laura L. Knoppers (Project Director: October 1988 to February 1990),"Laura L. Knoppers<br/>Penn State (University Park, PA 16802-1503)",Penn State,University Park,PA,16802-1503,USA,2/1/1989,1989,The Constructs of Covenant: John Milton and Puritan Discipline,British Literature,British Literature,3,Summer Stipends,6,Research Programs,0,0,3500,0,3500,0,3500,0,5/1/1989 &ndash; 9/30/1989,<p>No project description available</p>,
142175,EG-20068-89,1,0,0,0,0,0,0,,William,T.,Sanders,,,,,,William T. Sanders (Project Director: October 1986 to July 1993),"Penn State (University Park, PA 16802-1503)<br/>William T. Sanders (Project Director: October 1986 to July 1993)</div>",Penn State,University Park,PA,16802-1503,USA,2/1/1987,1989,NEW DIRECTIONS IN ARCHAEOLOGY (Telecourse Instructional Materials),Archaeology,Archaeology,62,Humanities Programs for Nontraditional Learners,7,Education Programs,142400,0,142400,0,141438.87,0,141438.87,0,4/1/1989 &ndash; 2/28/1993,"<p>To support the production of instructional materials to complement a one-semester television course on archaeology, which will focus on how this discipline examines ancient societies.</p>",
149503,FI-21679-88,2,0,0,0,0,0,0,,Marjorie,G.,Feasler,,,,,,Marjorie G. Feasler (Project Director: November 1987 to October 1988),"Marjorie G. Feasler<br/>Pennsylvania State University, Du Bois Campus (DuBois, PA 15801)","Pennsylvania State University, Du Bois Campus",DuBois,PA,15801,USA,2/1/1988,1988,The Catholic Motif of THE GREAT GATSBY,American Literature,American Literature,56,"Younger Scholars, 2/86 - 2/95",9,Fellowships and Seminars,0,0,2200,0,2200,0,2200,0,6/1/1988 &ndash; 8/31/1988,<p>No project description available</p>,
151665,FT-30498-88,2,0,0,0,0,0,0,,Garry,L.,Hagberg,,,,,,Garry L. Hagberg (Project Director: October 1987 to September 1989),"Garry L. Hagberg<br/>Pennsylvania State University, Harrisburg (Middletown, PA 17057-4846)","Pennsylvania State University, Harrisburg",Middletown,PA,17057-4846,USA,2/1/1988,1988,"Art as Language: Wittgenstein, Meaning, and Aesthetic Theory",Aesthetics,Aesthetics,3,Summer Stipends,6,Research Programs,0,0,3500,0,3500,0,3500,0,5/1/1988 &ndash; 2/28/1989,<p>No project description available</p>,
151817,FT-31426-88,2,0,0,0,0,0,0,,Angelita,d.,Reyes,,,,,,Angelita d. Reyes (Project Director: October 1987 to January 1989),"Angelita d. Reyes<br/>Penn State (University Park, PA 16802-1503)",Penn State,University Park,PA,16802-1503,USA,2/1/1988,1988,A Literary and Historical Study of the Images of Women in Caribbean and Afro-American Literature,Comparative Literature,Comparative Literature,3,Summer Stipends,6,Research Programs,0,0,3500,0,3500,0,3500,0,5/1/1988 &ndash; 9/30/1988,<p>No project description available</p>,
145623,FB-25581-88,2,0,1,0,0,0,0,,Carol,F.,Kessler,,,,,,Carol F. Kessler (Project Director: June 1987 to November 1989),"Carol F. Kessler<br/>Pennsylvania State University, Brandywine (Media, PA 19063-5522)","Pennsylvania State University, Brandywine",Media,PA,19063-5522,USA,11/1/1987,1988,"New Lives, New Worlds: Utopian Novels by American Women, 1836 to the Present",American Literature,American Literature,2,Fellowships for College Teachers and Independent Scholars,6,Research Programs,0,0,26753,0,26753,0,26753,0,7/1/1988 &ndash; 6/30/1989,<p>No project description available</p>,
147309,FE-21819-88,2,0,0,0,0,0,0,,Claire,,Hirshfield,,,,,,Claire Hirshfield (Project Director: July 1986 to June 1988),"Claire Hirshfield<br/>Pennsylvania State University, Abington Campus (Abington, PA 19001-3918)","Pennsylvania State University, Abington Campus",Abington,PA,19001-3918,USA,11/1/1987,1987,Women's Political Auxiliaries in Late Victorian and Edwardian England,British History,British History,70,"Travel to Collections, 11/85 - 2/95",9,Fellowships and Seminars,0,0,750,0,750,0,750,0,12/1/1987 &ndash; 5/31/1988,<p>No project description available</p>,
147320,FE-21842-88,2,0,0,0,0,0,0,,Troy,M.,Thomas,,,,,,Troy M. Thomas (Project Director: July 1987 to April 1989),"Troy M. Thomas<br/>Pennsylvania State University, Harrisburg (Middletown, PA 17057-4846)","Pennsylvania State University, Harrisburg",Middletown,PA,17057-4846,USA,11/1/1987,1987,Caravaggio and the Counter-Reformation,Art History and Criticism,Art History and Criticism,70,"Travel to Collections, 11/85 - 2/95",9,Fellowships and Seminars,0,0,750,0,750,0,750,0,12/1/1987 &ndash; 5/31/1988,<p>No project description available</p>,
147346,FE-21891-88,2,0,0,0,0,0,0,,Carol,F.,Kessler,,,,,,Carol F. Kessler (Project Director: July 1987 to June 2002),"Carol F. Kessler<br/>Pennsylvania State University, Mont Alto Campus (Mont Alto, PA 17237)","Pennsylvania State University, Mont Alto Campus",Mont Alto,PA,17237,USA,11/1/1987,1987,"New Lives, New Worlds: Utopian Novels by Women of the United States, 1836 to the Present",Gender Studies,Gender Studies,70,"Travel to Collections, 11/85 - 2/95",9,Fellowships and Seminars,0,0,750,0,0,0,0,0,12/1/1987 &ndash; 5/31/1988,<p>No project description available</p>,
147388,FE-22025-88,2,0,0,0,0,0,0,,Gary,S.,Cross,,,,,,Gary S. Cross (Project Director: January 1988 to March 1989),"Gary S. Cross<br/>Penn State (University Park, PA 16802-1503)",Penn State,University Park,PA,16802-1503,USA,5/1/1988,1988,Worktown: Labor and Leisure in Depression-Era Britain,British History,British History,70,"Travel to Collections, 11/85 - 2/95",9,Fellowships and Seminars,0,0,750,0,750,0,750,0,6/1/1988 &ndash; 11/30/1988,<p>No project description available</p>,
147423,FE-22124-88,2,0,0,0,0,0,0,,Stephen,H.,Browne,,,,,,Stephen H. Browne (Project Director: January 1988 to January 1989),"Stephen H. Browne<br/>Penn State (University Park, PA 16802-1503)",Penn State,University Park,PA,16802-1503,USA,5/1/1988,1988,"Southern Democrats and the Rhetoric of Resistance, 1877-96",Communications,Communications; Communications,70,"Travel to Collections, 11/85 - 2/95",9,Fellowships and Seminars,0,0,750,0,750,0,750,0,6/1/1988 &ndash; 11/30/1988,<p>No project description available</p>,
147540,FE-22429-88,2,0,0,0,0,0,0,,Carl,,Hausman,,,,,,Carl Hausman (Project Director: January 1988 to December 1988),"Carl Hausman<br/>Pennsylvania State University Press (University Park, PA 16802-3801)",Pennsylvania State University Press,University Park,PA,16802-3801,USA,5/1/1988,1988,Charles S. Peirce and His View of Cosmic Evolution,History of Philosophy,History of Philosophy,70,"Travel to Collections, 11/85 - 2/95",9,Fellowships and Seminars,0,0,750,0,750,0,750,0,6/1/1988 &ndash; 11/30/1988,<p>No project description available</p>,
147629,FE-22682-88,2,0,0,0,0,0,0,,Richard,,Frautschi,,,,,,Richard Frautschi (Project Director: February 1988 to April 1989),"Richard Frautschi<br/>Penn State (University Park, PA 16802-1503)",Penn State,University Park,PA,16802-1503,USA,5/1/1988,1988,"A Bibliography of 18th-Century French Fiction: Collections in Augsburg and Paderborn, West Germany",French Literature,French Literature,70,"Travel to Collections, 11/85 - 2/95",9,Fellowships and Seminars,0,0,750,0,750,0,750,0,6/1/1988 &ndash; 11/30/1988,<p>No project description available</p>,
159186,RC-21505-88,1,0,0,0,0,0,0,,Peter,,Gottlieb,,,,,,Peter Gottlieb (Project Director: November 1987 to March 1991),"Penn State (University Park, PA 16802-1503)<br/>Peter Gottlieb (Project Director: November 1987 to March 1991)</div>",Penn State,University Park,PA,16802-1503,USA,5/1/1988,1988,United Steelworkers of America Archive,Labor Relations,Labor Relations,39,Reference Materials - Access,1,Preservation and Access,0,15000,48697,15000,48697,14598.3,63295.3,0,10/1/1988 &ndash; 9/30/1990,<p>To support the arrangement and description of the archives of the United Steelworkers of America.</p>,
159370,RE-20634-87,1,0,0,0,0,0,0,,Gerard,J.,Brault,,,,,,Gerard J. Brault (Project Director: June 1986 to January 1990),"Penn State (University Park, PA 16802-1503)<br/>Gerard J. Brault (Project Director: June 1986 to January 1990)</div>",Penn State,University Park,PA,16802-1503,USA,2/1/1987,1987,A Critical Edition of the Rolls of Arms of Edward I (1272-1307),Medieval Studies,Medieval Studies,47,Editions,6,Research Programs,0,0,80000,0,79757.25,0,79757.25,0,7/1/1987 &ndash; 8/31/1989,<p>To support the preparation of a critical edition of the lists of coats of arms used during the reign of Edward I (1272-1307).</p>,
159378,RE-20654-87,1,0,0,0,0,0,0,,Alan,,Knight,,,,,,Alan Knight (Project Director: June 1986 to February 1989),"Penn State (University Park, PA 16802-1503)<br/>Alan Knight (Project Director: June 1986 to February 1989)</div>",Penn State,University Park,PA,16802-1503,USA,2/1/1987,1987,A Critical Edition of the Pageant Plays of Lille,French Literature,French Literature,47,Editions,6,Research Programs,0,0,36000,0,35809.73,0,35809.73,0,7/1/1987 &ndash; 8/31/1988,"<p>To support preparation of a two-volume critical edition of the pageant plays of Lille, a collection of 15th-century French dramas from the Herzog August Bibliothek in Wolfenbuttel, West Germany.</p>",
160770,RP-21075-87,1,0,0,0,0,0,0,,Philip,,Winsor,,,,,,Philip Winsor (Project Director: April 1987 to March 1989),"Pennsylvania State University Press (University Park, PA 16802-3801)<br/>Philip Winsor (Project Director: April 1987 to March 1989)</div>",Pennsylvania State University Press,University Park,PA,16802-3801,USA,8/1/1987,1987,"Fasciclus Morum: Latin Text and English Translation, edited and translated by Siegfried Wenzel",British Literature,British Literature; History of Religion,64,Scholarly Publications,6,Research Programs,0,0,7450,0,7450,0,7450,0,10/1/1987 &ndash; 9/30/1988,"<p>To support the publication of an English translation of a 14th-century Latin handbook for preachers that includes moralizing fabulae, exegeses, and poems tobe used in sermons.</p>",
160771,RP-21078-87,1,0,0,0,0,0,0,,Philip,,Winsor,,,,,,Philip Winsor (Project Director: April 1987 to March 1989),"Pennsylvania State University Press (University Park, PA 16802-3801)<br/>Philip Winsor (Project Director: April 1987 to March 1989)</div>",Pennsylvania State University Press,University Park,PA,16802-3801,USA,8/1/1987,1987,"Aegean Painting in the Bronze Age, by Sara A. Immerwahr",Art History and Criticism,Art History and Criticism,64,Scholarly Publications,6,Research Programs,0,0,5000,0,5000,0,5000,0,10/1/1987 &ndash; 9/30/1988,<p>To support the publication of a synoptic work on Aegean painting in the Bronze Age.</p>,
147267,FE-21548-87,2,0,0,0,0,0,0,,Kathleen,Lorraine,Lodwick,,,,,,Kathleen Lorraine Lodwick (Project Director: January 1987 to November 1987),"Kathleen Lorraine Lodwick<br/>Penn State (University Park, PA 16802-1503)",Penn State,University Park,PA,16802-1503,USA,5/1/1987,1987,Overseas Americans at the Presbyterian Mission on Hainan,U.S. History,U.S. History,70,"Travel to Collections, 11/85 - 2/95",9,Fellowships and Seminars,0,0,750,0,750,0,750,0,6/1/1987 &ndash; 12/31/1987,<p>No project description available</p>,
128080,FE-21037-87,2,0,0,0,0,0,0,,Rodger,C.,Henderson,,,,,,Rodger C. Henderson (Project Director: July 1986 to October 1990),"Rodger C. Henderson<br/>Pennsylvania State University, Fayette Campus (Uniontown, PA 15401-0519)","Pennsylvania State University, Fayette Campus",Uniontown,PA,15401-0519,USA,11/1/1986,1986,"Ideology, Politics, and Society in Fayette County, PA, During Struggle Over Ratification of the Constitution, 1787",U.S. History,U.S. History,70,"Travel to Collections, 11/85 - 2/95",9,Fellowships and Seminars,0,0,750,0,750,0,750,0,12/1/1986 &ndash; 5/31/1987,<p>No project description available</p>,
128083,FE-21048-87,2,0,0,0,0,0,0,,Nancy,M.,Tischler,,,,,,Nancy M. Tischler (Project Director: July 1986 to October 1990),"Nancy M. Tischler<br/>Penn State (University Park, PA 16802-1503)",Penn State,University Park,PA,16802-1503,USA,11/1/1986,1986,Literary Study of Tennessee Williams,American Literature,American Literature,70,"Travel to Collections, 11/85 - 2/95",9,Fellowships and Seminars,0,0,750,0,750,0,750,0,1/1/1987 &ndash; 3/31/1987,<p>No project description available</p>,
128194,FE-21470-87,2,0,0,0,0,0,0,,Nan,,Woodruff,,,,,,Nan Woodruff (Project Director: January 1987 to October 1990),"Nan Woodruff<br/>Penn State (University Park, PA 16802-1503)",Penn State,University Park,PA,16802-1503,USA,5/1/1987,1987,Southern Farm Workers and the Disintegration of Share Cropping,U.S. History,U.S. History,70,"Travel to Collections, 11/85 - 2/95",9,Fellowships and Seminars,0,0,750,0,750,0,750,0,6/1/1987 &ndash; 7/31/1987,<p>No project description available</p>,
131644,FT-29073-87,2,0,0,0,0,0,0,,Thomas,R.,Liszka,,,,,,Thomas R. Liszka (Project Director: October 1986 to October 1990),"Thomas R. Liszka<br/>Pennsylvania State University, Altoona Campus (Altoona, PA 16601-3777)","Pennsylvania State University, Altoona Campus",Altoona,PA,16601-3777,USA,2/1/1987,1987,The SOUTH ENGLISH LEGENDARY: An Edition,"Literature, General","Literature, General",3,Summer Stipends,6,Research Programs,0,0,3500,0,3500,0,3500,0,5/1/1987 &ndash; 9/30/1987,<p>No project description available</p>,
131664,FT-29194-87,2,0,0,0,0,0,0,,Carol,F.,Kessler,,,,,,Carol F. Kessler (Project Director: October 1986 to October 1990),"Carol F. Kessler<br/>Pennsylvania State University, Brandywine (Media, PA 19063-5522)","Pennsylvania State University, Brandywine",Media,PA,19063-5522,USA,2/1/1987,1987,"Utopian Writing by Women of the United States, 1836 to the Present",American Literature,American Literature,3,Summer Stipends,6,Research Programs,0,0,3500,0,3500,0,3500,0,5/1/1987 &ndash; 9/30/1987,<p>No project description available</p>,
131715,FT-29483-87,2,0,0,0,0,0,0,,Diana,H.,George,,,,,,Diana H. George (Project Director: October 1986 to October 1990),"Diana H. George<br/>Pennsylvania State University, Erie-Behrend College (Erie, PA 16563-0001)","Pennsylvania State University, Erie-Behrend College",Erie,PA,16563-0001,USA,2/1/1987,1987,The Selected Poems of Anne Sexton: An Edition,American Literature,American Literature,3,Summer Stipends,6,Research Programs,0,0,3500,0,3500,0,3500,0,5/1/1987 &ndash; 9/30/1987,<p>No project description available</p>,
128377,FI-20493-86,2,0,0,0,0,0,0,,Andrew,E.,McInerney,,,,,,Andrew E. McInerney (Project Director: November 1985 to October 1990),"Andrew E. McInerney<br/>Penn State (University Park, PA 16802-1503)",Penn State,University Park,PA,16802-1503,USA,2/1/1986,1986,"Existential Psychoanalysis, A Theoretical and Practical Approach","Philosophy, General","Philosophy, General",56,"Younger Scholars, 2/86 - 2/95",9,Fellowships and Seminars,0,0,2200,0,2200,0,2200,0,6/1/1986 &ndash; 8/31/1986,<p>No project description available</p>,
127925,FE-20663-86,2,0,1,0,0,0,0,,Thomas,R.,Smith,,,,,,Thomas R. Smith (Project Director: January 1986 to October 1990),"Thomas R. Smith<br/>Pennsylvania State University, Schuylkill Campus (Schuylkill, PA 17972)","Pennsylvania State University, Schuylkill Campus",Schuylkill,PA,17972,USA,5/1/1986,1986,Stability and Change in Late 19th and Early 20th Century Literary Autobiography,British Literature,British Literature,70,"Travel to Collections, 11/85 - 2/95",9,Fellowships and Seminars,0,0,500,0,500,0,500,0,6/1/1986 &ndash; 6/30/1986,<p>No project description available</p>,
127968,FE-20760-86,2,0,1,0,0,0,0,,Kathleen,Lorraine,Lodwick,,,,,,Kathleen Lorraine Lodwick (Project Director: January 1986 to October 1990),"Kathleen Lorraine Lodwick<br/>Penn State (University Park, PA 16802-1503)",Penn State,University Park,PA,16802-1503,USA,5/1/1986,1986,American Presbyterian Women Missionary Journalists in China,East Asian History,East Asian History,70,"Travel to Collections, 11/85 - 2/95",9,Fellowships and Seminars,0,0,500,0,500,0,500,0,6/1/1986 &ndash; 12/31/1986,<p>No project description available</p>,
127996,FE-20818-86,2,0,0,0,0,0,0,,Dean,R.,Baldwin,,,,,,Dean R. Baldwin (Project Director: January 1986 to October 1990),"Dean R. Baldwin<br/>Pennsylvania State University, Erie-Behrend College (Erie, PA 16563-0001)","Pennsylvania State University, Erie-Behrend College",Erie,PA,16563-0001,USA,5/1/1986,1986,The British Short Story 1915-1940,British Literature,British Literature,70,"Travel to Collections, 11/85 - 2/95",9,Fellowships and Seminars,0,0,500,0,500,0,500,0,6/1/1986 &ndash; 6/30/1986,<p>No project description available</p>,
141664,CU-20127-86,1,0,0,0,0,0,0,,Joseph,W.,Michels,,,,,,Joseph W. Michels (Project Director: May 1985 to March 1991),"Penn State (University Park, PA 16802-1503)<br/>Joseph W. Michels (Project Director: May 1985 to March 1991)</div>",Penn State,University Park,PA,16802-1503,USA,11/1/1985,1986,Challenge Grant,"Literature, General","Literature, General",69,Challenge Grants for Universities,4,Challenge Programs,0,1000000,0,1000000,0,1000000,1000000,0,12/1/1985 &ndash; 7/31/1990,"<p>To establish an endowment for the College of Liberal Arts to support faculty chairs in Literary Theory and Comparative Literature, Anglo-German Literary Relations, and Ethics; a humanities faculty fellows program; and a faculty development program for scholarly research and curriculum development.</p>",
159328,RE-20539-86,1,0,0,0,0,0,0,,James,R.,Sweeney,,,,,,James R. Sweeney (Project Director: September 1985 to September 1988),"Penn State (University Park, PA 16802-1503)<br/>James R. Sweeney (Project Director: September 1985 to September 1988)</div>",Penn State,University Park,PA,16802-1503,USA,5/1/1986,1986,HUNGARIA PONTIFICIA Complete Edition of Hungarian Papal Letters,"History, General","History of Religion; History, General; Medieval Studies",47,Editions,6,Research Programs,0,0,65000,0,64761.9,0,64761.9,0,6/1/1986 &ndash; 5/31/1988,<p>To support the completion of a comprehensive edition of all known papal lettersconcerning medieval Hungary to A.D. l198.</p>,
140589,RY-21202-85,2,0,0,0,0,0,0,,Nan,,Woodruff,,,,,,Nan Woodruff (Project Director: September 1984 to October 1990),"Nan Woodruff<br/>Penn State (University Park, PA 16802-1503)",Penn State,University Park,PA,16802-1503,USA,11/1/1984,1984,"Transformation in Southern Agriculture, 1930-1960","History, General","History, General",52,"Travel to Collections, 11/83 - 5/85",6,Research Programs,0,0,500,0,500,0,500,0,12/1/1984 &ndash; 4/30/1985,"<p>To support research on the transformation in southern agriculture, 1930-60.</p>",
140606,RY-21236-85,2,0,0,0,0,0,0,,John,T.,Harwood,,,,,,John T. Harwood (Project Director: December 1984 to October 1990),"John T. Harwood<br/>Penn State (University Park, PA 16802-1503)",Penn State,University Park,PA,16802-1503,USA,5/1/1985,1985,The Ethical Elements of Robert Boyle (1627-1691),"History and Philosophy of Science, Technology, and Medicine","History and Philosophy of Science, Technology, and Medicine",52,"Travel to Collections, 11/83 - 5/85",6,Research Programs,0,0,500,0,500,0,500,0,6/15/1985 &ndash; 8/15/1985,<p>To support research on the ethical elements of Robert Boyle (1627-91).</p>,
140743,RY-21476-85,2,0,0,0,0,0,0,,Charles,R.,Hackenberry,,,,,,Charles R. Hackenberry (Project Director: January 1985 to October 1990),"Charles R. Hackenberry<br/>Penn State (University Park, PA 16802-1503)",Penn State,University Park,PA,16802-1503,USA,8/1/1985,1985,ry2150085f the Journals and Letters of Charles W. Chesnutt Relating to the Composition of MANDY OXENDINE,American Literature,American Literature,52,"Travel to Collections, 11/83 - 5/85",6,Research Programs,0,0,500,0,500,0,500,0,6/1/1985 &ndash; 8/31/1985,<p>To support research for a study of the journals and letters of Charles W. Chesnutt relating to the composition of MANDY OXENDINE.</p>,
139919,RX-20616-85,1,0,0,0,0,0,0,,Joseph,J.,Kockelmans,,,,,,Joseph J. Kockelmans (Project Director: September 1984 to October 1990),"Penn State (University Park, PA 16802-1503)<br/>Joseph J. Kockelmans (Project Director: September 1984 to October 1990)</div>",Penn State,University Park,PA,16802-1503,USA,2/1/1985,1985,Sixth International Kant Congress 1985,"Philosophy, General","Philosophy, General",68,Conferences,6,Research Programs,0,0,10000,0,10000,0,10000,0,4/1/1985 &ndash; 3/31/1986,"<p>To support the meeting of the Sixth International Kant Congress in September 1985. Kant specialists from North America, Europe, Latin America, and Asia focused on the influence of Kant's thought on the development of American philosophy.</p>",
137233,RE-20337-85,1,0,0,0,0,0,0,,Robert,N.,Hudspeth,,,,,,Robert N. Hudspeth (Project Director: October 1983 to October 1990),"Penn State (University Park, PA 16802-1503)<br/>Robert N. Hudspeth (Project Director: October 1983 to October 1990)</div>",Penn State,University Park,PA,16802-1503,USA,5/1/1985,1985,The Letters of Margaret Fuller,American Literature,American Literature,47,Editions,6,Research Programs,0,0,58000,0,58000,0,58000,0,7/1/1985 &ndash; 6/30/1987,<p>To support preparation of the edition of the letters of the American writer Margaret Fuller.</p>,
137261,RE-20451-85,1,0,1,0,0,0,0,,Alan,,Knight,,,,,,Alan Knight (Project Director: October 1984 to October 1990),"Penn State (University Park, PA 16802-1503)<br/>Alan Knight (Project Director: October 1984 to October 1990)</div>",Penn State,University Park,PA,16802-1503,USA,5/1/1985,1985,A Critical Edition of the Pageant Plays of Lille,French Literature,French Literature,47,Editions,6,Research Programs,0,0,75000,0,75000,0,75000,0,7/1/1985 &ndash; 8/31/1987,<p>To support the preparation of a critical edition of a recently discovered manuscript collection of 15th-century pageant plays of northern France.</p>,
131400,FT-27480-85,2,0,0,0,0,0,0,,John,L.,Bryant,,,,,,John L. Bryant (Project Director: October 1984 to October 1990),"John L. Bryant<br/>Pennsylvania State University, Shenango Campus (Sharon, PA 16146)","Pennsylvania State University, Shenango Campus",Sharon,PA,16146,USA,2/1/1985,1985,Melville and the Rhetoric of Lying,American Literature,American Literature,3,Summer Stipends,6,Research Programs,0,0,3000,0,3000,0,3000,0,5/1/1985 &ndash; 9/30/1985,<p>No project description available</p>,
131012,FT-24745-84,2,0,0,0,0,0,0,,Martin,J.,Schultz,,,,,,Martin J. Schultz (Project Director: October 1983 to October 1990),"Martin J. Schultz<br/>Pennsylvania State University, Shenango Campus (Sharon, PA 16146)","Pennsylvania State University, Shenango Campus",Sharon,PA,16146,USA,2/1/1984,1984,Divorce in the Early Republic: Evidence from State Supreme Court Records,Sociology,Sociology,3,Summer Stipends,6,Research Programs,0,0,3000,0,3000,0,3000,0,5/1/1984 &ndash; 9/30/1984,<p>No project description available</p>,
131029,FT-24877-84,2,0,0,0,0,0,0,,Gary,S.,Cross,,,,,,Gary S. Cross (Project Director: October 1983 to October 1990),"Gary S. Cross<br/>Penn State (University Park, PA 16802-1503)",Penn State,University Park,PA,16802-1503,USA,2/1/1984,1984,"Changing Patterns of Work, Family, and Leisure Time in Britain and France, 1880-1930",European History,European History,3,Summer Stipends,6,Research Programs,0,0,3000,0,3000,0,3000,0,5/1/1984 &ndash; 9/30/1984,<p>No project description available</p>,
131030,FT-24880-84,2,0,0,0,0,0,0,,John,T.,Harwood,,,,,,John T. Harwood (Project Director: October 1983 to October 1990),"John T. Harwood<br/>Penn State (University Park, PA 16802-1503)",Penn State,University Park,PA,16802-1503,USA,2/1/1984,1984,The Rhetorical World of Restoration Science,"History and Philosophy of Science, Technology, and Medicine","History and Philosophy of Science, Technology, and Medicine",3,Summer Stipends,6,Research Programs,0,0,3000,0,3000,0,3000,0,5/1/1984 &ndash; 9/30/1984,<p>No project description available</p>,
139973,RY-20001-84,2,0,0,0,0,0,0,,William,I.,Roberts,III,,,,,William I. Roberts (Project Director: September 1983 to October 1990),"William I. Roberts III<br/>Pennsylvania State University, Abington Campus (Abington, PA 19001-3918)","Pennsylvania State University, Abington Campus",Abington,PA,19001-3918,USA,11/1/1983,1983,History of the American Potash Industry,U.S. History,U.S. History,52,"Travel to Collections, 11/83 - 5/85",6,Research Programs,0,0,500,0,500,0,500,0,1/1/1984 &ndash; 1/31/1984,<p>To support research on the history of the American potash industry.</p>,
