ApplicationID,ApplicationNumber,ApplicantType,SuppCount,ProductCount,CoverageCount,PrizeCount,ParticipatingInstitutionCount,WhitePaper,WhitePaperPath,PDFirstname,PDMiddlename,PDLastname,PDNameSuffix,CoPDFirstname,CoPDMiddlename,CoPDLastname,CoPDNameSuffix,Participants,GranteeDisplay,Institution,InstCity,InstState,InstPostalCode,InstCountry,CouncilDate,YearAwarded,ProjectTitle,PrimaryDiscipline,AllDisciplines,ProgramID,ProgramName,DivisionID,DivisionName,OfferedOutright,OfferedMatching,ApprovedOutright,ApprovedMatching,AwardOutright,AwardMatching,OriginalAmount,SupplementAmount,GrantPeriod,ProjectDesc,ToSupport
231824,HT-231824-15,1,0,0,0,0,0,1,20150310-HT-HT2015\GRANT11861252\Reports\13-116556.pdf,Kim,,Gallon,,Angel,David,Nieves,,Kim Gallon (Project Director: March 2015 to present)<br/>Angel David Nieves (Co Project Director: July 2015 to present),"Purdue University (West Lafayette, IN 47907-2040)<br/>Kim Gallon (Project Director: March 2015 to present)<br/>Angel David Nieves (Co Project Director: July 2015 to present)</div>",Purdue University,West Lafayette,IN,47907-2040,USA,7/1/2015,2015,"Space and Place in Africana/Black Studies: An Institute on Spatial Humanities, Theories, Methods and Practice",African American History,African American History; African American Studies,260,Institutes for Advanced Topics in the Digital Humanities,12,Digital Humanities,0,0,245299,0,245299,0,245299,0,10/1/2015 &ndash; 9/30/2017,"<p>A three-week summer institute and a follow-up workshop for 20 participants to explore spatial approaches to Africana Studies.&nbsp; The institute would be hosted by Purdue University and the follow-up workshop would be held at Hamilton College.</p>
<p>Hosted by the African American Studies &amp; Research Center (AARC) at Purdue University, this two-year long institute beginning the summer of 2016 is designed to advance knowledge in Africana/Black Studies by affording 20 early and mid-career Africana/Black Studies scholars, graduate students and librarians an opportunity to think critically about the relationship and intersections between Africana Studies and the spatial humanities. To that end, the Institute is concerned with helping participants to think spatially, to internalize the concept of space, and to develop spatial literacies. The Institute will also advance digital and spatial humanities approaches among Africana/Black Studies scholars. Participants will explore key topics in spatial humanities and will be introduced to a breadth of geospatial technologies. The web-based platform, BlackDH.org (www.blackdh.org) will serve as a clearinghouse and portal for scholarly discussions that will grow out of the Institute.</p>",
216236,FA-57286-13,2,0,1,0,0,0,0,,Marcia,Carol,Stephenson,,,,,,Marcia Carol Stephenson (Project Director: May 2012 to May 2015),"Marcia Carol Stephenson<br/>Purdue University (West Lafayette, IN 47907-2040)",Purdue University,West Lafayette,IN,47907-2040,USA,11/1/2012,2012,"The Global Role of Andean Camelids (Llamas, Alpacas, Vicunas, and Guanacos) in Intercultural Exchange, 1568-1970",Latin American Studies,Latin American Studies,1,Fellowships for University Teachers,6,Research Programs,0,0,50400,0,50284.85,0,50284.85,0,1/1/2014 &ndash; 12/31/2014,"<p>My proposed book project examines the unprecedented role played by Andean camelids (llamas, alpacas, vicunas, and guanacos) as a historical juncture or contact zone of conflicting scientific, commercial, and cultural interests for Europeans and Indian shepherds, in the Andes and in the camelid diaspora of Europe, Australia, and the United States. Integrating a medical-scientific and cultural approach to understanding camelid contact zones, my project is of significance to the humanities because it will demonstrate that camelid contact zones are novel mechanisms through which we can assess the convergence of European and indigenous knowledge and interests. It will show how the interdisciplinary model of analysis (advancing novel dialogues among the sciences and the humanities) elucidates the role played by indigenous pastoral peoples as key protagonists in the intercultural exchange of ideas in transatlantic and transpacific arenas.</p>",
211138,FA-56955-12,2,0,0,0,0,0,0,,Thomas,Francis,Broden,,,,,,Thomas Francis Broden (Project Director: May 2011 to September 2014),"Thomas Francis Broden<br/>Purdue University (West Lafayette, IN 47907-2040)",Purdue University,West Lafayette,IN,47907-2040,USA,11/1/2011,2011,An Intellectual Biography of Language Theorist A. J. Greimas (1917-1992),French Literature,French Literature,1,Fellowships for University Teachers,6,Research Programs,0,0,50400,0,50400,0,50400,0,6/1/2013 &ndash; 5/31/2014,"<p>This intellectual biography will be the first to examine critically the entire span of French-language scholar A. J. Greimas’s (1917-92) methods for studying language, culture, narrative, and visual images. It identifies three stages in the unfolding of his ideas and devotes special attention to the third, ""Paris semiotics."" The theories form integral components of linguistic and textual analysis taught and practiced throughout the Romance-language world. The study provides a window onto critical transformations in textual studies and indeed the human sciences over the last century. Greimas collaborated closely with some of the best-known intellectuals of his day, including Lévi-Strauss, Barthes, de Certeau, Ricoeur, and Eco. By attracting attention to this central but neglected figure, and by drawing comparisons with English-language research, the monograph revises our postwar history of ideas in France and reframes the relations between English- and Romance-language traditions.</p>",
213791,FT-59903-12,2,0,0,0,0,0,0,,Darren,,Dochuk,,,,,,Darren Dochuk (Project Director: October 2011 to September 2012),"Darren Dochuk<br/>Purdue University (West Lafayette, IN 47907-2040)",Purdue University,West Lafayette,IN,47907-2040,USA,3/1/2012,2012,God and Black Gold in Modern America: Evangelical Entrepreneurs and the American Oil Industry,U.S. History,U.S. History,3,Summer Stipends,6,Research Programs,0,0,6000,0,6000,0,6000,0,5/1/2012 &ndash; 6/30/2012,"<p>My project traces historic ties between evangelicalism and oil. It argues that oil-patch evangelicals have long considered petroleum their special providence, a divine gift to advance His Kingdom. Driven by sacred notions of production and dominion, they have found an ally in the oil business, which has grafted these ideals onto an ideology of wildcat capitalism. This marriage has had profound impact. While money accrued through oil has helped evangelical clerics build imposing ministries, evangelical businessmen have used their religious commitments to advance oil's interests at home and abroad. This relationship has produced as much angst as hope for evangelicals, yet the trade-off has always been understood as the price of one's chose-ness in a fallen world. Whether praying in their pews for oil's bounty or for deliverance from its excesses, evangelicals have viewed their place in this sector as special and created a powerful subculture that at once honors God and black gold.</p>",
201362,FT-57624-10,2,0,0,0,0,0,0,,Troy,J.,Bassett,,,,,,Troy J. Bassett (Project Director: October 2009 to November 2010),"Troy J. Bassett<br/>Indiana University, Purdue University at Fort Wayne (Fort Wayne, IN 46805-1445)","Indiana University, Purdue University at Fort Wayne",Fort Wayne,IN,46805-1445,USA,2/1/2010,2010,"At the Circulating Library: A Database of Victorian Fiction, 1837-1901",British Literature,British Literature,3,Summer Stipends,6,Research Programs,0,0,6000,0,6000,0,6000,0,5/1/2010 &ndash; 9/30/2010,"<p>At the Circulating Library: A Database of Victorian Fiction, 1837-1901 (accessible at http://www.victorianresearch.org/atcl) offers an on-line biographical and bibliographical database of nineteenth-century British fiction. Currently, the database accounts for all 5300 three-volume novels written during the period, and includes entries on over 1700 authors and 140 publishers, and serialization information for over 900 novels. I plan to expand the database beyond three-volume novels to include all Victorian novels, beginning with two- and four-volume novels. However, the database is more than an enumerative bibliography: it enables larger statistical analyses, such as annual rates of production, the sociology of authorship, and the rates of serialization. Answers to these and other questions of book production broaden the context for the understanding of individual authors and texts and their relationship to the larger cultural sphere.</p>",
188807,FA-54005-08,2,0,0,0,0,0,0,,Christopher,John,Pincock,,,,,,Christopher John Pincock (Project Director: May 2007 to February 2010),"Christopher John Pincock<br/>Purdue University (West Lafayette, IN 47907-2040)",Purdue University,West Lafayette,IN,47907-2040,USA,11/1/2007,2007,The Value of Mathematics for Scientific Representation and Knowledge,"Philosophy, General","Philosophy, General",1,Fellowships for University Teachers,6,Research Programs,0,0,50400,0,50400,0,50400,0,1/1/2009 &ndash; 12/31/2009,"<p>My project will provide the first systematic overview of the philosophical options for accounting for the role of mathematics in science and then argue for my preferred proposal. Briefly put, the value of mathematics for scientific representation is epistemic. That is, by appealing to mathematical concepts and theorems, scientists are able to formulate theories that can be highly confirmed by the available evidence. Without mathematics, scientific theories would still be possible, but they would be less well confirmed. I reach these conclusions through a careful consideration of the different ways in which mathematics can be useful in science and by reviewing the main alternative accounts of how mathematics is applied. After articulating my epistemic proposal, I test it using an extended case study from the history of meteorology. My project concludes by exploring the consequences of this view of applied mathematics for the metaphysics and epistemology of pure mathematics.</p>",
190278,FT-55614-08,2,0,0,0,0,0,0,,Erik,S.,Ohlander,,,,,,Erik S. Ohlander (Project Director: October 2007 to September 2008),"Erik S. Ohlander<br/>Purdue University (West Lafayette, IN 47907-2040)",Purdue University,West Lafayette,IN,47907-2040,USA,2/1/2008,2008,The Sufis of Mecca: Mysticism and Transregionality in the Later Medieval Islamic World,History of Religion,History of Religion,3,Summer Stipends,6,Research Programs,0,0,6000,0,6000,0,6000,0,6/1/2008 &ndash; 7/31/2008,"<p>In recent years, the descriptive, theoretical, and critical concept of ""networks"" has been used to great effect by scholars of religion working on a wide range of religious groups and movements situated across a diverse range of geo-historical settings. This project seeks to deploy this concept to answer lingering questions concerning the diffusion, spread, and popularization of what came to be a particularly popular form of Muslim mystical religiosity between the 12th and 15th centuries: Sufism. Arguing for the significance of transregionality and city-node centers as a major factor in the expansion of Sufism during this period, this book project will focus on the sacred city of Mecca and its heretofore underestimated role in the development of Sufi networks during what remains an under-researched period of its history. As such, this study looks to make an original contribution to the academic study of religion, and by extension, to the humanities at large.</p>",
186978,LS-50077-07,1,0,0,0,0,0,0,,Valerie,Jean,Yazza,,,,,,Valerie Jean Yazza (Project Director: February 2007 to present),"Purdue University (West Lafayette, IN 47907-2040)<br/>Valerie Jean Yazza (Project Director: February 2007 to present)</div>",Purdue University,West Lafayette,IN,47907-2040,USA,5/1/2007,2007,Lewis and Clark and the Indian Country: A Traveling Exhibition for Libraries,American Literature,American Literature,245,Small Grants to Libraries: John Adams Unbound,2,Public Programs,0,0,1000,0,1000,0,1000,0,9/1/2007 &ndash; 9/30/2009,<p>No project description available</p>,
180855,FT-54703-06,2,0,0,0,0,0,0,,Rachel,Lynn,Einwohner,,,,,,Rachel Lynn Einwohner (Project Director: October 2005 to October 2006),"Rachel Lynn Einwohner<br/>Purdue University (West Lafayette, IN 47907-2040)",Purdue University,West Lafayette,IN,47907-2040,USA,2/1/2006,2006,"Why DID They Resist? A Sociological Analysis of Jewish Resistance in the Ghettos of Warsaw, Vilna, and Lodz",Sociology,Sociology,3,Summer Stipends,6,Research Programs,0,0,5000,0,5000,0,5000,0,6/1/2006 &ndash; 8/31/2006,"<p>Reacting to portrayals of Jews during the Holocaust as individuals who succumbed meekly to their fate, many people ask, ""Why didn’t they resist?"" Instead, this project asks, ""Why DID they resist?"" This question is particularly important to social movement scholars, whose theories would predict that Jews lacked the opportunity, resources, and efficacy needed to stage collective resistance. The study focuses on three Jewish ghettos (Warsaw, Vilna, and Lodz) and seeks to understand where and why resistance occurred. Data will come from primary and secondary sources, including diaries and memoirs written by ghetto residents, and the analysis will employ case-based methods of comparative historical research.</p>",
172389,PA-50973-05,1,0,0,0,0,0,0,,Sammie,Lynn,Morris,,,,,,Sammie Lynn Morris (Project Director: May 2004 to September 2006),"Purdue University (West Lafayette, IN 47907-2040)<br/>Sammie Lynn Morris (Project Director: May 2004 to September 2006)</div>",Purdue University,West Lafayette,IN,47907-2040,USA,11/1/2004,2004,Preservation Assessment of Special Collections,"Interdisciplinary Studies, General","Interdisciplinary Studies, General",19,Preservation/Access Projects,1,Preservation and Access,0,0,5000,0,5000,0,5000,0,1/1/2005 &ndash; 6/30/2006,"<p>A preservation assessment, a staff workshop, and the purchase of preservation supplies to rehouse archives and manuscript materials related to institutional and local history.</p>",
174971,FT-53214-05,2,0,0,0,0,0,0,,Christopher,John,Pincock,,,,,,Christopher John Pincock (Project Director: October 2004 to January 2006),"Christopher John Pincock<br/>Purdue University (West Lafayette, IN 47907-2040)",Purdue University,West Lafayette,IN,47907-2040,USA,2/1/2005,2005,Grasping El Niño: Philosophy of Mathematics and Science in the 19th and 20th Centuries,"History and Philosophy of Science, Technology, and Medicine","History and Philosophy of Science, Technology, and Medicine",3,Summer Stipends,6,Research Programs,0,0,5000,0,5000,0,5000,0,6/1/2005 &ndash; 8/31/2005,"<p>This project is a historical study of the early stages of the scientific investigation of the El Niño-Southern Oscillation (ENSO), emphasizing the criteria that were employed to evaluate mathematical models of this complex climactic phenomena. I focus mainly on the pioneering work of Sir J. Norman Lockyer (1836-1920), his son William Lockyer (1868-1934) and Sir Gilbert Walker (1868-1958) in the late nineteenth and early twentieth centuries. While many disparage these early models, I argue that there is considerable overlap between the criteria that the Lockyers and Walker used, and the criteria that we find in the work of contemporary climatologists.</p>",
175307,FT-53550-05,2,0,1,0,0,0,0,,Stephen,Edgar,Towne,,,,,,Stephen Edgar Towne (Project Director: October 2004 to August 2005),"Stephen Edgar Towne<br/>Indiana/Purdue University, Indianapolis (Indianapolis, IN 46202-5148)","Indiana/Purdue University, Indianapolis",Indianapolis,IN,46202-5148,USA,2/1/2005,2005,"Dissent, Disloyalty, and Subversion in the North during the American Civil War, 1861-1865",U.S. History,U.S. History,3,Summer Stipends,6,Research Programs,0,0,5000,0,5000,0,5000,0,6/1/2005 &ndash; 7/31/2005,"<p>I propose to undertake research in the National Archives and the Library of Congress in Washington, D.C., in federal records and manuscript collections to find documentation on activities of individuals and groups that opposed the actions and policies of the Lincoln administration during the Civil War. I project a monograph challenging the thesis developed by historian Frank L. Klement, who asserted that Democratic Party opponents to the Northern war effort were innocent of Republican charges of disloyalty, treason, and collusion with the Southern rebels.</p>",
166737,FA-50395-04,2,0,2,1,1,0,0,,Janet,,Afary,,,,,,Janet Afary (Project Director: May 2003 to March 2006),"Janet Afary<br/>Regents of the University of California, Santa Barbara (West Lafayette, IN 47907-2040)","Regents of the University of California, Santa Barbara",West Lafayette,IN,47907-2040,USA,11/1/2003,2003,"From Mullah to Goya: The Art and Politics of Mullah Nasreddin, 1906-1917",Near and Middle Eastern History,Near and Middle Eastern History,1,Fellowships for University Teachers,6,Research Programs,0,0,40000,0,40000,0,40000,0,9/1/2004 &ndash; 8/31/2005,"<p>The trickster figure Mullah Nasreddin is a popular folk character in the Middle East, Central Asia, the Caucasus, and the Balkans. In 1906, a glossy satirical newspaper called Mullah Nasreddin began publication in Tiblisi. Its editor, Jalil Mamed Qulizadeh, was a famous Muslim playwright. Under his direction, a cast of talented Muslim and Georgian Christian writers and artists adopted the trickster as a transgressive figure that commented on East-West political, cultural, and social differences and attempted to bridge the gap between the two societies. Mullah Nesreddin was the first newspaper in Iran and Central Eurasia to put forward a liberal discourse on Shi'ite Islam and to demand new rights for women. This monograph explores the graphic arts through which this message was articulated.</p>",
170040,FT-52661-04,2,0,0,0,0,0,0,,Richard,Huntington,Weiner,,,,,,Richard Huntington Weiner (Project Director: October 2003 to November 2004),"Richard Huntington Weiner<br/>Indiana University, Purdue University at Fort Wayne (Fort Wayne, IN 46805-1445)","Indiana University, Purdue University at Fort Wayne",Fort Wayne,IN,46805-1445,USA,2/1/2004,2004,Narratives of Wealth and Poverty: A Cultural History of the Mexican Economy,Latin American History,Latin American History,3,Summer Stipends,6,Research Programs,0,0,5000,0,5000,0,5000,0,6/1/2004 &ndash; 8/31/2004,"<p>Mexico’s economic history from the age of conquest until today has been akin to a roller coaster ride, for it has been marked by peaks and valleys. Europeans viewed New Spain as the most valuable colony in the New World and after independence tales of the fledgling nation’s legendary riches inspired repeated foreign military interventions, but in the twentieth century Mexico became part of the ""Third World."" In sharp contrast to the New Economic History with its dedication to quantitative analysis, I explore this volatile history from the vantage point of economic culture. By infusing culture into economic history I counter the current insular trend in economic scholarship and thus provide novel insights into the bumpy road of Mexican development.</p>",
170794,RQ-50108-04,1,0,0,0,0,0,0,,Marianne,S.,Wokeck,,,,,,Marianne S. Wokeck (Project Director: November 2003 to April 2008),"Indiana/Purdue University, Indianapolis (Indianapolis, IN 46202-5148)<br/>Marianne S. Wokeck (Project Director: November 2003 to April 2008)</div>","Indiana/Purdue University, Indianapolis",Indianapolis,IN,46202-5148,USA,5/1/2004,2004,Critical Edition of Santayana's The Life of Reason and Three Philosophical Poets,"Philosophy, General","Philosophy, General",193,Scholarly Editions and Translations,6,Research Programs,0,48247,100000,50000,100000,12685,112685,0,8/1/2004 &ndash; 7/31/2007,"<p>Preparation for publication of the five books that make up George Santayana's The Life of Reason and the one-book volume of literary criticism, Three Philosophical Poets.</p>
<p>The critical edition of The Works of George Santayana makes the complete oeuvre of a preeminent twentieth-century thinker and writer accurately available to a diverse and international audience. The multi-book volume of The Life of Reason is vital for the groundwork it provides for all the volumes that conclude the series. Three Philosophical Poets follows this publication chronologically and will be edited under the same guidelines as previously published philosophical works. The Edition is asking for support to complete preparations for publication of the five books of The Life of Reason (Reason in Common Sense, Reason in Society, Reason in Religion, Reason in Art, and Reason in Science), as well as initial preparation for Three Philosophical Poets. All books will be published within one year following the grant period and added to the Past Masters CD-ROM.</p>",
164015,FT-51815-03,2,0,1,0,0,0,0,,Ana,,Gomez-Bravo,,,,,,Ana Gomez-Bravo (Project Director: October 2002 to November 2003),"Ana Gomez-Bravo<br/>Purdue University (West Lafayette, IN 47907-2040)",Purdue University,West Lafayette,IN,47907-2040,USA,2/1/2003,2003,"Literacy, Space, and Cultural Production in Late Medieval Iberia",Medieval Studies,Medieval Studies,3,Summer Stipends,6,Research Programs,0,0,5000,0,5000,0,5000,0,6/1/2003 &ndash; 7/31/2003,"<p>My project studies some key aspects of the cultural context that facilitates a thriving literary activity in late-medieval Iberia. It takes into consideration the intersections of politics and society, and their relationship with developments in literacy, reading and writing modes, book production, and the practices of authorship. A central argument for this study is my contention that literary and cultural activities were tightly dependent on the differentiation and diversification of a public and private space at the end of the Middle Ages. This fostered and was fostered by a growth in literacy and a shift in the spatialization of the court that responded to social and political changes.</p>",
153989,FT-46489-02,2,0,0,0,0,0,0,,Steven,A.,Carr,,,,,,Steven A. Carr (Project Director: October 2001 to March 2003),"Steven A. Carr<br/>Indiana University, Purdue University at Fort Wayne (Fort Wayne, IN 46805-1445)","Indiana University, Purdue University at Fort Wayne",Fort Wayne,IN,46805-1445,USA,3/1/2002,2002,Hollywood and the Holocaust from World War II to 1965,Film History and Criticism,Film History and Criticism; Jewish Studies,3,Summer Stipends,6,Research Programs,0,0,5000,0,5000,0,5000,0,5/1/2002 &ndash; 9/30/2002,<p>No project description available</p>,
154046,FT-46874-02,2,0,0,0,0,0,0,,Kristina,,Bross,,,,,,Kristina Bross (Project Director: October 2001 to September 2002),"Kristina Bross<br/>Purdue University (West Lafayette, IN 47907-2040)",Purdue University,West Lafayette,IN,47907-2040,USA,3/1/2002,2002,A Critical Edition of the Eliot Tracts (1647-1685): Encounters Between Puritan Missionaries and Native Americans,American Studies,American Studies,3,Summer Stipends,6,Research Programs,0,0,5000,0,5000,0,5000,0,5/1/2002 &ndash; 9/30/2002,<p>No project description available</p>,
94647,ED-22374-02,1,0,0,0,0,0,0,,Kristina,,Bross,,,,,,Kristina Bross (Project Director: April 2002 to March 2005),"Purdue University (West Lafayette, IN 47907-2040)<br/>Kristina Bross (Project Director: April 2002 to March 2005)</div>",Purdue University,West Lafayette,IN,47907-2040,USA,7/1/2002,2002,Making History: Partnerships in Archival Preservation and Pe dagogy,American Studies,American Studies,12,Education Development and Demonstration,7,Education Programs,0,0,23313,0,23313,0,23313,0,9/1/2002 &ndash; 8/31/2004,<p>A project to develop a collaboration between Purdue University and the Tippecanoe County Historical Association to create of an undergraduate curriculum in archival research.</p>,
122563,RZ-20862-02,1,0,0,0,0,0,0,,Marianne,S.,Wokeck,,,,,,Herman J. Saatkamp (Project Director: September 2001 to October 2003)<br/>Marianne S. Wokeck (Project Director: October 2003 to April 2005),"Indiana/Purdue University, Indianapolis (Indianapolis, IN 46202-5148)<br/>Herman J. Saatkamp (Project Director: September 2001 to October 2003)<br/>Marianne S. Wokeck (Project Director: October 2003 to April 2005)</div>","Indiana/Purdue University, Indianapolis",Indianapolis,IN,46202-5148,USA,3/1/2002,2002,The Letters of George Santayana and the Life of Reason,"Philosophy, General","Philosophy, General",5,Collaborative Research,6,Research Programs,20000,60000,20000,60000,20000,23975.78,43975.78,0,8/1/2002 &ndash; 9/30/2004,"<p>To support work on two volumes of letters and on the LIFE OF REASON, volumes in an edition of the works of George Santayana.</p>",
145335,FA-36790-01,2,0,0,0,0,0,0,,Patricia,K.,Curd,,,,,,Patricia K. Curd (Project Director: May 2000 to February 2003),"Patricia K. Curd<br/>Purdue University (West Lafayette, IN 47907-2040)",Purdue University,West Lafayette,IN,47907-2040,USA,11/1/2000,2001,Anaxagoras of Clazomenae: Fragments (5th century BCE). A Text and Translation with Introduction and Commentary,History of Philosophy,History of Philosophy,1,Fellowships for University Teachers,6,Research Programs,0,0,35000,0,35000,0,35000,0,1/1/2002 &ndash; 12/31/2002,<p>No project description available</p>,
146999,FB-37472-01,2,0,0,0,0,0,0,,Gabrielle,S.,Bersier,,,,,,Gabrielle S. Bersier (Project Director: May 2000 to December 2002),"Gabrielle S. Bersier<br/>Indiana/Purdue University, Indianapolis (Indianapolis, IN 46202-5148)","Indiana/Purdue University, Indianapolis",Indianapolis,IN,46202-5148,USA,11/1/2000,2001,Goethe's Physiological Autobiography and the Organic Discourse of German Romanticism,German Literature,German Literature,2,Fellowships for College Teachers and Independent Scholars,6,Research Programs,0,0,35000,0,35000,0,35000,0,8/1/2001 &ndash; 7/31/2002,<p>No project description available</p>,
