ApplicationID,ApplicationNumber,ApplicantType,SuppCount,ProductCount,CoverageCount,PrizeCount,ParticipatingInstitutionCount,WhitePaper,WhitePaperPath,PDFirstname,PDMiddlename,PDLastname,PDNameSuffix,CoPDFirstname,CoPDMiddlename,CoPDLastname,CoPDNameSuffix,Participants,GranteeDisplay,Institution,InstCity,InstState,InstPostalCode,InstCountry,CouncilDate,YearAwarded,ProjectTitle,PrimaryDiscipline,AllDisciplines,ProgramID,ProgramName,DivisionID,DivisionName,OfferedOutright,OfferedMatching,ApprovedOutright,ApprovedMatching,AwardOutright,AwardMatching,OriginalAmount,SupplementAmount,GrantPeriod,ProjectDesc,ToSupport
161789,RZ-20754-01,1,0,0,0,0,0,0,,Kevin,,Anderson,,,,,,Kevin Anderson (Project Director: September 2000 to February 2009),"Purdue University (West Lafayette, IN 47907-2040)<br/>Kevin Anderson (Project Director: September 2000 to February 2009)</div>",Purdue University,West Lafayette,IN,47907-2040,USA,3/1/2001,2001,Marx's Late Writings on Non-Western and Pre-Capitalist Societies,Sociology,Sociology,5,Collaborative Research,6,Research Programs,0,0,190000,0,190000,0,190000,0,8/1/2001 &ndash; 8/31/2007,<p>To support an edition of the late writings of Karl Marx on non-western and pre-capitalist societies.</p>,
153584,FT-43956-99,2,0,0,0,0,0,0,,Charles,W.,Ingrao,,,,,,Charles W. Ingrao (Project Director: October 1998 to August 1999),"Charles W. Ingrao<br/>Purdue University (West Lafayette, IN 47907-2040)",Purdue University,West Lafayette,IN,47907-2040,USA,3/1/1999,1999,"The Decline and Fall of the Multinational Empire, 1815-2000",European History,European History,3,Summer Stipends,6,Research Programs,0,0,4000,0,4000,0,4000,0,5/1/1999 &ndash; 9/30/1999,<p>No project description available</p>,
153353,FT-42278-97,2,0,1,0,0,0,0,,Jay,J.,Rosellini,,,,,,Jay J. Rosellini (Project Director: October 1996 to December 1997),"Jay J. Rosellini<br/>Purdue University (West Lafayette, IN 47907-2040)",Purdue University,West Lafayette,IN,47907-2040,USA,3/1/1997,1997,Literary Elitism and Conservative Nationalism: Botho Strauss and a German Paradigm,German Literature,German Literature,3,Summer Stipends,6,Research Programs,0,0,4000,0,4000,0,4000,0,5/1/1997 &ndash; 9/30/1997,<p>No project description available</p>,
153361,FT-42323-97,2,0,0,0,0,0,0,,Mariselle,,Melendez,,,,,,Mariselle Melendez (Project Director: October 1996 to October 1997),"Mariselle Melendez<br/>Board of Trustees of the University of Illinois (West Lafayette, IN 47907-2040)",Board of Trustees of the University of Illinois,West Lafayette,IN,47907-2040,USA,3/1/1997,1997,"Hybridity, Race and Gender in an 18th-Century South American Travel Narrative",Arabic Literature,Arabic Literature,3,Summer Stipends,6,Research Programs,0,0,4000,0,4000,0,4000,0,5/1/1997 &ndash; 9/30/1997,<p>No project description available</p>,
146505,FB-33438-96,2,0,1,0,0,0,0,,Scott,J.,Seregny,,,,,,Scott J. Seregny (Project Director: May 1995 to November 1997),"Scott J. Seregny<br/>Indiana/Purdue University, Indianapolis (Indianapolis, IN 46202-5148)","Indiana/Purdue University, Indianapolis",Indianapolis,IN,46202-5148,USA,11/1/1995,1996,"The Politics of Popular Education in Rural Russia, 1907-1918",Russian History,Russian History,2,Fellowships for College Teachers and Independent Scholars,6,Research Programs,0,0,30000,0,30000,0,30000,0,8/1/1996 &ndash; 7/31/1997,<p>No project description available</p>,
150729,FI-28411-95,2,0,0,0,0,0,0,,Susan,A.,Sholeff,,,,,,Susan A. Sholeff (Project Director: November 1994 to February 1996),"Susan A. Sholeff<br/>Indiana/Purdue University, Indianapolis (Indianapolis, IN 46202-5148)","Indiana/Purdue University, Indianapolis",Indianapolis,IN,46202-5148,USA,2/1/1995,1995,"Ethnicity and Politics: Greek Policy in Macedonia, 1912-49","History, General","History, General",56,"Younger Scholars, 2/86 - 2/95",9,Fellowships and Seminars,0,0,2500,0,2500,0,2500,0,6/1/1995 &ndash; 8/31/1995,<p>No project description available</p>,
151064,FJ-21986-95,2,0,0,0,0,0,0,,Ed,,Moritz,,,,,,Ed Moritz (Project Director: August 1994 to February 1996),"Ed Moritz<br/>Indiana University, Purdue University at Fort Wayne (Fort Wayne, IN 46805-1445)","Indiana University, Purdue University at Fort Wayne",Fort Wayne,IN,46805-1445,USA,2/1/1995,1995,Toward a Unified Theory of Composition,Composition and Rhetoric,Composition and Rhetoric,57,Study Grants for College Teachers,9,Fellowships and Seminars,0,0,3000,0,3000,0,3000,0,5/1/1995 &ndash; 6/30/1995,<p>No project description available</p>,
144625,FA-32233-94,2,0,2,0,0,0,0,,Patricia,K.,Curd,,,,,,Patricia K. Curd (Project Director: May 1993 to September 1995),"Patricia K. Curd<br/>Purdue University (West Lafayette, IN 47907-2040)",Purdue University,West Lafayette,IN,47907-2040,USA,11/1/1993,1994,The Legacy of Parmenides: The Influence of Eleatic Monism on Later Pre-Socratic Thought,History of Philosophy,History of Philosophy,1,Fellowships for University Teachers,6,Research Programs,0,0,30000,0,19905,0,19905,0,1/1/1995 &ndash; 7/31/1995,<p>No project description available</p>,
153098,FT-40341-94,2,0,0,0,0,0,0,,Janet,,Afary,,,,,,Janet Afary (Project Director: October 1993 to September 1994),"Janet Afary<br/>Regents of the University of California, Santa Barbara (West Lafayette, IN 47907-2040)","Regents of the University of California, Santa Barbara",West Lafayette,IN,47907-2040,USA,2/1/1994,1994,"Political Culture and the Emergence of Democracy in Iran, 1906-11",Near and Middle Eastern History,Near and Middle Eastern History,3,Summer Stipends,6,Research Programs,0,0,4750,0,4750,0,4750,0,5/1/1994 &ndash; 9/30/1994,<p>No project description available</p>,
152834,FT-38309-93,2,0,0,0,0,0,0,,Edward,,Schiappa,,,,,,Edward Schiappa (Project Director: October 1992 to June 1994),"Edward Schiappa<br/>Purdue University (West Lafayette, IN 47907-2040)",Purdue University,West Lafayette,IN,47907-2040,USA,2/1/1993,1993,A Predisciplinary Account of the Rhetoric and Philosophy of Gorgias,Composition and Rhetoric,Composition and Rhetoric,3,Summer Stipends,6,Research Programs,0,0,4000,0,4000,0,4000,0,5/1/1993 &ndash; 9/30/1993,<p>No project description available</p>,
152578,FT-36491-92,2,0,0,0,0,0,0,,John,Lauritz,Larson,,,,,,John Lauritz Larson (Project Director: October 1991 to October 1992),"John Lauritz Larson<br/>Purdue University (West Lafayette, IN 47907-2040)",Purdue University,West Lafayette,IN,47907-2040,USA,2/1/1992,1992,"Improving the American Republic, 1776-1869",U.S. History,U.S. History,3,Summer Stipends,6,Research Programs,0,0,4000,0,4000,0,4000,0,5/1/1992 &ndash; 9/30/1992,<p>No project description available</p>,
152614,FT-36793-92,2,0,0,0,0,0,0,,Carol,B.,Gartner,,,,,,Carol B. Gartner (Project Director: October 1991 to October 1992),"Carol B. Gartner<br/>Purdue University Calumet Campus (Hammond, IN 46323-2068)",Purdue University Calumet Campus,Hammond,IN,46323-2068,USA,2/1/1992,1992,"Mary Putnam Jacobi, M.D., 1842-1906: ""Renaissance Woman"" of Science, Literature and Social Activism",American Studies,American Studies,3,Summer Stipends,6,Research Programs,0,0,4000,0,4000,0,4000,0,5/1/1992 &ndash; 9/30/1992,<p>No project description available</p>,
149068,FE-27079-92,2,0,0,0,0,0,0,,Becky,A.,Brown,,,,,,Becky A. Brown (Project Director: January 1992 to October 1992),"Becky A. Brown<br/>Purdue University (West Lafayette, IN 47907-2040)",Purdue University,West Lafayette,IN,47907-2040,USA,5/1/1992,1992,Linguistic Change and Variation in Louisiana French,Linguistics,Linguistics,70,"Travel to Collections, 11/85 - 2/95",9,Fellowships and Seminars,0,0,750,0,750,0,750,0,6/1/1992 &ndash; 5/31/1993,<p>No project description available</p>,
149193,FE-27474-92,2,0,0,0,0,0,0,,Patrick,J.,Hearden,,,,,,Patrick J. Hearden (Project Director: January 1992 to August 1992),"Patrick J. Hearden<br/>Purdue University (West Lafayette, IN 47907-2040)",Purdue University,West Lafayette,IN,47907-2040,USA,5/1/1992,1992,"Postwar Planning in the United States, 1941-1945",U.S. History,U.S. History,70,"Travel to Collections, 11/85 - 2/95",9,Fellowships and Seminars,0,0,750,0,750,0,750,0,6/1/1992 &ndash; 5/31/1993,<p>No project description available</p>,
143432,ES-22346-92,1,0,0,0,0,0,0,,Zenobia,,Mistri,,,,,,Zenobia Mistri (Project Director: December 1991 to April 1995),"Purdue University (West Lafayette, IN 47907-2040)<br/>Zenobia Mistri (Project Director: December 1991 to April 1995)</div>",Purdue University,West Lafayette,IN,47907-2040,USA,5/1/1992,1992,Stories of Awakening: New Perspectives on American Women Writers from Kate Chopin to Alice Walker,American Literature,American Literature,14,Institutes for K-12 Educators,7,Education Programs,127000,0,127000,0,124894.84,0,124894.84,0,7/1/1992 &ndash; 12/31/1994,<p>To support a three-week summer institute for 60 Illinois and Indiana high school teachers on the coming-of-age theme in works of fiction by American women writers.</p>,
144272,FA-29837-91,2,0,0,0,0,0,0,,Ann,Winifred,Astell,,,,,,Ann Winifred Astell (Project Director: May 1990 to July 1992),"Ann Winifred Astell<br/>Purdue University (West Lafayette, IN 47907-2040)",Purdue University,West Lafayette,IN,47907-2040,USA,11/1/1990,1991,The Book of Job and the Medieval Idea of Epic,Comparative Literature,Comparative Literature,1,Fellowships for University Teachers,6,Research Programs,0,0,30000,0,30000,0,30000,0,7/1/1991 &ndash; 6/30/1992,<p>No project description available</p>,
148557,FE-25453-91,2,0,0,0,0,0,0,,Peter,J.,Sehlinger,,,,,,Peter J. Sehlinger (Project Director: July 1990 to August 1991),"Peter J. Sehlinger<br/>Indiana/Purdue University, Indianapolis (Indianapolis, IN 46202-5148)","Indiana/Purdue University, Indianapolis",Indianapolis,IN,46202-5148,USA,11/1/1990,1990,"Ambassadorship of Claude G. Bowers to Chile, 1939-53",U.S. History,U.S. History,70,"Travel to Collections, 11/85 - 2/95",9,Fellowships and Seminars,0,0,750,0,750,0,750,0,12/1/1990 &ndash; 11/30/1991,<p>No project description available</p>,
152516,FT-36042-91,2,0,0,0,0,0,0,,James,R.,Farr,,,,,,James R. Farr (Project Director: October 1990 to September 1991),"James R. Farr<br/>Purdue University (West Lafayette, IN 47907-2040)",Purdue University,West Lafayette,IN,47907-2040,USA,2/1/1991,1991,"Law, Morality, and Religion in France, 1550-1730",European History,European History,3,Summer Stipends,6,Research Programs,0,0,3750,0,3750,0,3750,0,5/1/1991 &ndash; 9/30/1991,<p>No project description available</p>,
152517,FT-36044-91,2,0,0,0,0,0,0,,Nancy,F.,Gabin,,,,,,Nancy F. Gabin (Project Director: October 1990 to January 1992),"Nancy F. Gabin<br/>Purdue University (West Lafayette, IN 47907-2040)",Purdue University,West Lafayette,IN,47907-2040,USA,2/1/1991,1991,Women's Work in Indiana: Farms and Factories since 1880,U.S. History,U.S. History,3,Summer Stipends,6,Research Programs,0,0,3750,0,3750,0,3750,0,5/31/1991 &ndash; 9/30/1991,<p>No project description available</p>,
152143,FT-33540-90,2,0,0,0,0,0,0,,Akiko,,Tsuchiya,,,,,,Akiko Tsuchiya (Project Director: October 1989 to August 1990),"Akiko Tsuchiya<br/>Washington University (West Lafayette, IN 47907-2040)",Washington University,West Lafayette,IN,47907-2040,USA,2/1/1990,1990,Literary Representation and Self-Reflection in Contemporary Spanish Women's Fiction,Spanish Literature,Spanish Literature,3,Summer Stipends,6,Research Programs,0,0,3500,0,3500,0,3500,0,5/1/1990 &ndash; 9/30/1990,<p>No project description available</p>,
149848,FI-23322-90,2,0,0,0,0,0,0,,Keith,E.,Smith,,,,,,Keith E. Smith (Project Director: November 1989 to September 1990),"Keith E. Smith<br/>Purdue University (West Lafayette, IN 47907-2040)",Purdue University,West Lafayette,IN,47907-2040,USA,2/1/1990,1990,Japanese Investment in the United States: A Local History,U.S. History,U.S. History,56,"Younger Scholars, 2/86 - 2/95",9,Fellowships and Seminars,0,0,2200,0,2200,0,2200,0,6/1/1990 &ndash; 8/31/1990,<p>No project description available</p>,
142399,EH-21187-90,1,0,0,0,0,0,0,,Thomas,P.,Adler,,,,,,Thomas P. Adler (Project Director: October 1989 to July 1991),"Purdue University (West Lafayette, IN 47907-2040)<br/>Thomas P. Adler (Project Director: October 1989 to July 1991)</div>",Purdue University,West Lafayette,IN,47907-2040,USA,2/1/1990,1990,"Curriculum ""2000"": A Planning Grant for Core Reform","Interdisciplinary Studies, General","Interdisciplinary Studies, General",13,Institutes for Higher Education Faculty,7,Education Programs,28861,0,28861,0,28861,0,28861,0,4/1/1990 &ndash; 3/31/1991,<p>To support a planning grant to reform the general education curriculum of the School of Liberal Arts.</p>,
145890,FB-27591-90,2,0,0,0,0,0,0,,Jane,E.,Schultz,,,,,,Jane E. Schultz (Project Director: June 1989 to September 1991),"Jane E. Schultz<br/>Indiana/Purdue University, Indianapolis (Indianapolis, IN 46202-5148)","Indiana/Purdue University, Indianapolis",Indianapolis,IN,46202-5148,USA,11/1/1989,1990,Women's Narratives of Civil War Life,American Studies,American Studies,2,Fellowships for College Teachers and Independent Scholars,6,Research Programs,0,0,27500,0,27500,0,27500,0,7/1/1990 &ndash; 6/30/1991,<p>No project description available</p>,
148297,FE-24682-90,2,0,0,0,0,0,0,,Keith,M.,Dickson,,,,,,Keith M. Dickson (Project Director: January 1990 to June 1993),"Keith M. Dickson<br/>Purdue University (West Lafayette, IN 47907-2040)",Purdue University,West Lafayette,IN,47907-2040,USA,5/1/1990,1990,The Agnellus Commentaries on Galen,"History and Philosophy of Science, Technology, and Medicine","History and Philosophy of Science, Technology, and Medicine",70,"Travel to Collections, 11/85 - 2/95",9,Fellowships and Seminars,0,0,750,0,750,0,750,0,6/1/1990 &ndash; 5/31/1992,<p>No project description available</p>,
148394,FE-24956-90,2,0,0,0,0,0,0,,Thomas,Francis,Broden,,,,,,Thomas Francis Broden (Project Director: January 1990 to December 1991),"Thomas Francis Broden<br/>Purdue University (West Lafayette, IN 47907-2040)",Purdue University,West Lafayette,IN,47907-2040,USA,5/1/1990,1990,A. J. Greimas and French Romantic Fashions,French Literature,French Literature,70,"Travel to Collections, 11/85 - 2/95",9,Fellowships and Seminars,0,0,750,0,750,0,750,0,6/1/1990 &ndash; 5/31/1991,<p>No project description available</p>,
147677,FE-22843-89,2,0,0,0,0,0,0,,William,L.,Rowe,,,,,,William L. Rowe (Project Director: July 1988 to October 1989),"William L. Rowe<br/>Purdue University (West Lafayette, IN 47907-2040)",Purdue University,West Lafayette,IN,47907-2040,USA,11/1/1988,1988,Thomas Reid's Theory of Human Freedom,Metaphysics,Metaphysics,70,"Travel to Collections, 11/85 - 2/95",9,Fellowships and Seminars,0,0,750,0,750,0,750,0,12/1/1988 &ndash; 5/31/1989,<p>No project description available</p>,
147828,FE-23244-89,2,0,0,0,0,0,0,,Jane,E.,Schultz,,,,,,Jane E. Schultz (Project Director: January 1989 to August 1989),"Jane E. Schultz<br/>Indiana/Purdue University, Indianapolis (Indianapolis, IN 46202-5148)","Indiana/Purdue University, Indianapolis",Indianapolis,IN,46202-5148,USA,5/1/1989,1989,Class and Race in Women's Diaries of the 1860s,American Studies,American Studies,70,"Travel to Collections, 11/85 - 2/95",9,Fellowships and Seminars,0,0,750,0,750,0,750,0,6/1/1989 &ndash; 11/30/1989,<p>No project description available</p>,
148003,FE-23726-89,2,0,0,0,0,0,0,,James,J.,Cruise,,,,,,James J. Cruise (Project Director: January 1989 to October 1989),"James J. Cruise<br/>Purdue University (West Lafayette, IN 47907-2040)",Purdue University,West Lafayette,IN,47907-2040,USA,5/1/1989,1989,Commercialism and Its Influence on the 18th-Century Novel,"Literature, General","Literature, General",70,"Travel to Collections, 11/85 - 2/95",9,Fellowships and Seminars,0,0,750,0,750,0,750,0,6/1/1989 &ndash; 11/30/1989,<p>No project description available</p>,
148055,FE-23878-89,2,0,0,0,0,0,0,,Scott,J.,Seregny,,,,,,Scott J. Seregny (Project Director: February 1989 to February 1990),"Scott J. Seregny<br/>Indiana/Purdue University, Indianapolis (Indianapolis, IN 46202-5148)","Indiana/Purdue University, Indianapolis",Indianapolis,IN,46202-5148,USA,5/1/1989,1989,"The Russian Rural Intelligentsia, 1905-17",Russian History,Russian History,70,"Travel to Collections, 11/85 - 2/95",9,Fellowships and Seminars,0,0,750,0,750,0,750,0,6/1/1989 &ndash; 11/30/1989,<p>No project description available</p>,
149544,FI-21916-88,2,0,0,0,0,0,0,,Shawn,D.,Kimmel,,,,,,Shawn D. Kimmel (Project Director: November 1987 to November 1988),"Shawn D. Kimmel<br/>Indiana/Purdue University, Indianapolis (Indianapolis, IN 46202-5148)","Indiana/Purdue University, Indianapolis",Indianapolis,IN,46202-5148,USA,2/1/1988,1988,A Comparative Study of Human Nature in Melville's THE CONFIDENCE MAN and G.W. Harris's SUT LOVINGOOD'S YARNS,American Literature,American Literature,56,"Younger Scholars, 2/86 - 2/95",9,Fellowships and Seminars,0,0,2200,0,2200,0,2200,0,6/1/1988 &ndash; 8/31/1988,<p>No project description available</p>,
151779,FT-31191-88,2,0,0,0,0,0,0,,Charles,W.,Ingrao,,,,,,Charles W. Ingrao (Project Director: October 1987 to February 1989),"Charles W. Ingrao<br/>Purdue University (West Lafayette, IN 47907-2040)",Purdue University,West Lafayette,IN,47907-2040,USA,2/1/1988,1988,"Entrenching the STATUS QUO: The Legitimization of Ideas and Institutions through Political Culture, 1775-1825",European History,European History,3,Summer Stipends,6,Research Programs,0,0,3500,0,3500,0,3500,0,5/1/1988 &ndash; 9/30/1988,<p>No project description available</p>,
151781,FT-31193-88,2,0,0,0,0,0,0,,Manfred,,Kuehn,,,,,,Manfred Kuehn (Project Director: October 1987 to February 1989),"Manfred Kuehn<br/>Purdue University (West Lafayette, IN 47907-2040)",Purdue University,West Lafayette,IN,47907-2040,USA,2/1/1988,1988,Kant's Relation to Hume,History of Philosophy,History of Philosophy,3,Summer Stipends,6,Research Programs,0,0,3500,0,3500,0,3500,0,5/1/1988 &ndash; 9/30/1988,<p>No project description available</p>,
147283,FE-21719-87,2,0,0,0,0,0,0,,Raymond Ephraim,,Dumett,,,,,,Raymond Ephraim Dumett (Project Director: February 1987 to July 1989),"Raymond Ephraim Dumett<br/>Purdue University (West Lafayette, IN 47907-2040)",Purdue University,West Lafayette,IN,47907-2040,USA,5/1/1987,1987,"Gold Mining, Railways, and Empire in the Gold Coast and Asante",Gender Studies,Gender Studies,70,"Travel to Collections, 11/85 - 2/95",9,Fellowships and Seminars,0,0,750,0,750,0,750,0,6/1/1987 &ndash; 8/31/1989,<p>No project description available</p>,
128078,FE-21033-87,2,0,0,0,0,0,0,,Gordon,R.,Mork,,,,,,Gordon R. Mork (Project Director: July 1986 to October 1990),"Gordon R. Mork<br/>Purdue University (West Lafayette, IN 47907-2040)",Purdue University,West Lafayette,IN,47907-2040,USA,11/1/1986,1986,The Gospel According to Oberammergau: The Passion Play and Modern Antisemitism in Historical Context,European History,European History,70,"Travel to Collections, 11/85 - 2/95",9,Fellowships and Seminars,0,0,750,0,750,0,750,0,5/1/1987 &ndash; 6/30/1987,<p>No project description available</p>,
128473,FI-21005-87,2,0,0,0,0,0,0,,Eric,L.,Anderson-Zych,,,,,,Eric L. Anderson-Zych (Project Director: November 1986 to October 1990),"Eric L. Anderson-Zych<br/>Purdue University (West Lafayette, IN 47907-2040)",Purdue University,West Lafayette,IN,47907-2040,USA,2/1/1987,1987,Grand Designs and Current Realities: Progressive Era Parks in the Midwest,American Studies,American Studies,56,"Younger Scholars, 2/86 - 2/95",9,Fellowships and Seminars,0,0,2200,0,2200,0,2200,0,6/1/1987 &ndash; 8/31/1987,<p>No project description available</p>,
131800,FT-30140-87,2,0,0,0,0,0,0,,Scott,J.,Seregny,,,,,,Scott J. Seregny (Project Director: October 1986 to October 1990),"Scott J. Seregny<br/>Indiana/Purdue University, Indianapolis (Indianapolis, IN 46202-5148)","Indiana/Purdue University, Indianapolis",Indianapolis,IN,46202-5148,USA,2/1/1987,1987,Peasant Unions in the Russian Revolution of 1905,Russian History,Russian History,3,Summer Stipends,6,Research Programs,0,0,3500,0,3500,0,3500,0,5/1/1987 &ndash; 9/30/1987,<p>No project description available</p>,
154111,FV-20756-87,1,0,0,0,0,0,0,,William,L.,McBride,,,,,,William L. McBride (Project Director: April 1987 to December 1988),"Purdue University (West Lafayette, IN 47907-2040)<br/>William L. McBride (Project Director: April 1987 to December 1988)</div>",Purdue University,West Lafayette,IN,47907-2040,USA,8/1/1987,1987,Jean-Paul Sartre as Philosopher-Writer: Four Genres,"Philosophy, General","French Literature; Philosophy, General",15,Seminars for K-12 Educators,7,Education Programs,0,0,55000,0,50346,0,50346,0,10/1/1987 &ndash; 9/30/1988,<p>No project description available</p>,
161442,RX-20824-86,1,0,0,0,0,0,0,,Edith,W.,Clowes,,,,,,Edith W. Clowes (Project Director: February 1986 to September 1989),"Purdue University (West Lafayette, IN 47907-2040)<br/>Edith W. Clowes (Project Director: February 1986 to September 1989)</div>",Purdue University,West Lafayette,IN,47907-2040,USA,8/1/1986,1986,"Russian Obshchestvennost': The Problem of Middle Class Identity in Tsarist Russia, 1890-1917",Russian History,Russian History,68,Conferences,6,Research Programs,0,4000,18000,4000,18000,3447.62,21447.62,0,9/1/1986 &ndash; 12/31/1988,"<p>To support a conference on Russian social history from 1890 to 1917. The conference will specificially focus on the issue of the development of a ""middle class.""</p>",
131409,FT-27547-86,2,0,0,0,0,0,0,,Timothy,,Hunt,,,,,,Timothy Hunt (Project Director: October 1985 to October 1990),"Timothy Hunt<br/>Indiana University, Purdue University at Fort Wayne (Fort Wayne, IN 46805-1445)","Indiana University, Purdue University at Fort Wayne",Fort Wayne,IN,46805-1445,USA,2/1/1986,1986,The Poems of Robinson Jeffers: An Edition,American Literature,American Literature,3,Summer Stipends,6,Research Programs,0,0,3000,0,3000,0,3000,0,5/1/1986 &ndash; 9/30/1986,<p>No project description available</p>,
131581,FT-28631-86,2,0,0,0,0,0,0,,John,Lauritz,Larson,,,,,,John Lauritz Larson (Project Director: October 1985 to October 1990),"John Lauritz Larson<br/>Purdue University (West Lafayette, IN 47907-2040)",Purdue University,West Lafayette,IN,47907-2040,USA,2/1/1986,1986,"Technology, Innovation, and Constitutional Legitimacy in the Early United States",U.S. History,U.S. History,3,Summer Stipends,6,Research Programs,0,0,3000,0,3000,0,3000,0,5/1/1986 &ndash; 9/30/1986,<p>No project description available</p>,
131618,FT-28900-86,2,0,0,0,0,0,0,,Joseph,G.,Turow,,,,,,Joseph G. Turow (Project Director: October 1985 to October 1990),"Joseph G. Turow<br/>Purdue University (West Lafayette, IN 47907-2040)",Purdue University,West Lafayette,IN,47907-2040,USA,2/1/1986,1986,Storytelling and Institutional Power as Exemplified by American Televison,Media Studies,Media Studies,3,Summer Stipends,6,Research Programs,0,0,3000,0,3000,0,3000,0,5/1/1986 &ndash; 9/30/1986,<p>No project description available</p>,
131379,FT-27399-85,2,0,0,0,0,0,0,,Nancy,F.,Gabin,,,,,,Nancy F. Gabin (Project Director: October 1984 to October 1990),"Nancy F. Gabin<br/>Purdue University (West Lafayette, IN 47907-2040)",Purdue University,West Lafayette,IN,47907-2040,USA,2/1/1985,1985,"A History of Women Auto Workers and the United Automobile Workers' Union, 1935-1970",U.S. History,U.S. History,3,Summer Stipends,6,Research Programs,0,0,3000,0,3000,0,3000,0,5/1/1985 &ndash; 9/30/1985,<p>No project description available</p>,
124417,EH-20539-85,1,0,0,0,0,0,0,,Calvin,,Schrag,,,,,,Calvin Schrag (Project Director: December 1984 to October 1990),"Purdue University (West Lafayette, IN 47907-2040)<br/>Calvin Schrag (Project Director: December 1984 to October 1990)</div>",Purdue University,West Lafayette,IN,47907-2040,USA,5/1/1985,1985,Selected Topics in Twentieth Century Continental Philosophy,"Philosophy, General","Philosophy, General",13,Institutes for Higher Education Faculty,7,Education Programs,0,0,94667,0,94667,0,94667,0,9/1/1985 &ndash; 9/30/1986,<p>To support an institute on selected topics in 20th-century continental philosophy for 25 college and university teachers.</p>,
140784,RY-21555-85,2,0,0,0,0,0,0,,Ruth,,Salvaggio,,,,,,Ruth Salvaggio (Project Director: January 1985 to October 1990),"Ruth Salvaggio<br/>Purdue University (West Lafayette, IN 47907-2040)",Purdue University,West Lafayette,IN,47907-2040,USA,8/1/1985,1985,An Edition of Edmond Malone's 1800 Biography of John Dryden,British Literature,British Literature,52,"Travel to Collections, 11/83 - 5/85",6,Research Programs,0,0,500,0,500,0,500,0,7/1/1985 &ndash; 8/30/1985,<p>To support research on an edition of Edmond Malone's 1800 biography of John Dryden.</p>,
126092,FA-24098-84,2,0,0,0,0,0,0,,Mark,U.,Edwards,Jr,,,,,Mark U. Edwards (Project Director: June 1983 to October 1990),"Mark U. Edwards, Jr<br/>Purdue University (West Lafayette, IN 47907-2040)",Purdue University,West Lafayette,IN,47907-2040,USA,11/1/1983,1984,The Use of the Printing Press for Official Propaganda in the German Reformation,European History,European History,1,Fellowships for University Teachers,6,Research Programs,0,0,25000,0,25000,0,25000,0,5/31/1985 &ndash; 7/31/1985,<p>No project description available</p>,
131167,FT-25855-84,2,0,0,0,0,0,0,,Leslie,,Field,,,,,,Leslie Field (Project Director: October 1983 to October 1990),"Leslie Field<br/>Purdue University (West Lafayette, IN 47907-2040)",Purdue University,West Lafayette,IN,47907-2040,USA,2/1/1984,1984,The Posthumous Publications of American Novelist Thomas Wolfe,American Literature,American Literature,3,Summer Stipends,6,Research Programs,0,0,3000,0,3000,0,3000,0,5/1/1984 &ndash; 9/30/1984,<p>No project description available</p>,
