ApplicationID,ApplicationNumber,ApplicantType,SuppCount,ProductCount,CoverageCount,PrizeCount,ParticipatingInstitutionCount,WhitePaper,WhitePaperPath,PDFirstname,PDMiddlename,PDLastname,PDNameSuffix,CoPDFirstname,CoPDMiddlename,CoPDLastname,CoPDNameSuffix,Participants,GranteeDisplay,Institution,InstCity,InstState,InstPostalCode,InstCountry,CouncilDate,YearAwarded,ProjectTitle,PrimaryDiscipline,AllDisciplines,ProgramID,ProgramName,DivisionID,DivisionName,OfferedOutright,OfferedMatching,ApprovedOutright,ApprovedMatching,AwardOutright,AwardMatching,OriginalAmount,SupplementAmount,GrantPeriod,ProjectDesc,ToSupport
194231,HH-50002-09,1,0,0,0,0,0,0,,Lev,,Manovich,,,,,,Lev Manovich (Project Director: July 2008 to September 2011),"Regents of the University of California, San Diego (La Jolla, CA 92093-0013)<br/>Lev Manovich (Project Director: July 2008 to September 2011)</div>","Regents of the University of California, San Diego",La Jolla,CA,92093-0013,USA,11/1/2008,2008,Visualizing Patterns in Databases of Cultural Images and Video,"Interdisciplinary Studies, General","Interdisciplinary Studies, General",261,NEH/DOE Humanities High Performance Computing Program,12,Digital Humanities,0,0,7969,0,7969,0,7969,0,1/1/2009 &ndash; 12/31/2010,"<p>Consultation with the staff of the National Energy Research Scientific Computing Center to consider uses of computational analysis on large-scale photo and video collections.</p>
<p>To the best of our knowledge, our proposed project will be the first to combine theoretical perspectives of the humanities and cultural criticism with the analytical and visualization approach in order to study large datasets of images and video. Another innovation of our approach, which we call Cultural Analytics, is the use of image processing and computer vision techniques to analyze form and content of visual cultural data. We plan to process all images and video selected for our study to extract various features and mathematical descriptions of the visual structure. Consequently, we will use variety of statistical techniques including multivariate statistics methods such as Factor analysis, Cluster analysis, and multidimensional scaling to analyze this new metadata. Finally, we will use the results of our statistical analysis and the original data sets to produce a number of visualizations showing patterns in the data.</p>",
196248,HD-50626-09,1,0,0,0,0,0,1,20081008-HD-INST\GRANT10084187\Reports\13-98502.pdf,Emily,,Roxworthy,,,,,,Emily Roxworthy (Project Director: October 2008 to December 2010),"Regents of the University of California, San Diego (La Jolla, CA 92093-0013)<br/>Emily Roxworthy (Project Director: October 2008 to December 2010)</div>","Regents of the University of California, San Diego",La Jolla,CA,92093-0013,USA,2/1/2009,2009,Drama in the Delta: Digitally Reenacting Civil Rights Performances at Arkansas' Wartime Camps for Japanese Americans,"Interdisciplinary Studies, General","Interdisciplinary Studies, General",247,Digital Humanities Start-Up Grants,12,Digital Humanities,0,0,24983,0,24983,0,24983,0,4/1/2009 &ndash; 8/31/2010,"<p>The development of a role-playing game focused on Japanese-American internment in Arkansas during World War II.</p>
<p>DRAMA IN THE DELTA will produce an interactive 3D model of key historic sites from the WWII Arkansas Delta in order to digitally simulate the systems of racial segregation that governed home-front life when black-white Jim Crow laws intersected with the policies of two local internment camps for Americans of Japanese descent. Rohwer and Jerome each imprisoned a peak wartime population of 8,500; these were the only War Relocation Authority (WRA) camps in the American South and the only to house Hawaiians of Japanese descent. The wartime internment in general has not entered most Americans' consciousness. The popularity of interactive role-playing games (RPGs) presents an effective pedagogical medium to capture public interest: by creating a historically accurate RPG reenacting 1944 Arkansas, DRAMA IN THE DELTA will engage the problem-solving behaviors of ""gamers,"" and use this active learning environment to teach about civil liberties--struggles that were eventually triumphant.</p>",
188401,FB-53968-08,2,0,1,0,1,0,0,,Manuel,,Vargas,,,,,,Manuel Vargas (Project Director: May 2007 to September 2010),"Manuel Vargas<br/>Regents of the University of California, San Diego (San Francisco, CA 94117-1050)","Regents of the University of California, San Diego",San Francisco,CA,94117-1050,USA,11/1/2007,2007,Beyond Atomism and Monism: A Revisionist View of Moral Responsibility,"Philosophy, General","Philosophy, General",2,Fellowships for College Teachers and Independent Scholars,6,Research Programs,0,0,50400,0,50400,0,50400,0,7/1/2009 &ndash; 6/30/2010,"<p>My aim is to answer recent philosophical and scientific puzzles about when, whether, and how we can be morally responsible. My account emphasizes three distinctive claims. First, I reject ATOMISM, or the view that the proper analysis of responsibility proceeds from analysis of the characteristics of agents, isolated from the social and physical contexts of action. I argue that responsible agency is partly constituted by social and psychological contexts. Second, I reject MONISM about free will, or the view that there is some single capacity or structure of agency that marks responsible agency. Instead, I argue that such agency is constituted by a varied set of capacities, picked out by our diverse practical interests in ascribing responsibility. Finally, I argue for REVISIONISM, the idea that an adequate theory of responsibility will depart from some parts of common sense. Together, these ideas provide a new framework for resolving ancient and recent problems of responsibility.</p>",
172819,FA-51472-05,2,0,1,0,0,0,0,,Alan,Craig,Houston,,,,,,Alan Craig Houston (Project Director: May 2004 to September 2006),"Alan Craig Houston<br/>Regents of the University of California, San Diego (La Jolla, CA 92093-0013)","Regents of the University of California, San Diego",La Jolla,CA,92093-0013,USA,11/1/2004,2004,Benjamin Franklin and the Politics of Improvement,"Political Science, General","Political Science, General",1,Fellowships for University Teachers,6,Research Programs,0,0,40000,0,40000,0,40000,0,9/1/2005 &ndash; 6/30/2006,"<p>According to popular and scholarly convention, Benjamin Franklin was the quintessential American. Against this convention, I argue that Franklin's political thought cannot be understood through the lens of ""the American character."" Throughout his life Franklin participated in cosmopolitan European debates over the modern commercial republic. Unlike most of his contemporaries, however, Franklin's interventions took the form of projects for reform, not abstract arguments. Improvement was a political project; it required organization, deliberation and mobilization. Franklin's unique contributions to the ideas and practices of the modern American republic can only be understood in this context.</p>",
167024,FB-50538-04,2,0,1,0,0,0,0,,Weijing,,Lu,,,,,,Weijing Lu (Project Director: May 2003 to October 2005),"Weijing Lu<br/>Regents of the University of California, San Diego (Fredericksburg, VA 22401-5300)","Regents of the University of California, San Diego",Fredericksburg,VA,22401-5300,USA,11/1/2003,2003,"Meanings of Marriage in China, 1650-1850",East Asian History,East Asian History,2,Fellowships for College Teachers and Independent Scholars,6,Research Programs,0,0,40000,0,40000,0,40000,0,10/1/2004 &ndash; 6/30/2005,"<p>In his path-breaking book, Marriage and Adoption in China, 1845-1945, Arthur P. Wolf points out that ""[o]ne of the major tasks facing students of the Chinese family is to map the distribution of marriage forms in late traditional times."" (A. Wolf. and Huang 1980). Two decades have passed, but little has been done to explore how marriage patterns diversified and took shape in late imperial history. My project will take up these issues, concentrating on highly differentiated marriage behavior and human interactions surrounding marriages. It will examine not only the diversity of marriage and complexity of social relationships but also the dynamics of gender relations and human emotions that shape the journey of marital life. The project will challenge the conventional marriage paradigm that makes broad assumptions about normative marriage behavior. I will detail various marriage patterns-uxorilocal marriage, little daughter-in-law marriage, cousin marriage, and spirit marriage--looking at how different forms of marriage functioned and how they were constructed and understood. Furthermore, I will question the assumption that in traditional China a woman was denied support from both her natal and marital families and that she enjoyed no conjugal affection and intimacy. I will explore marriage as a gendered personal experience, looking at how gender values and emotions intersected in marriage practices. Arguing that the modernist view of ""love marriage"" is not appropriate for analyzing marriage in late imperial China, I will explore cultural practices, such as the presentation of betrothal gifts, the making of dowries by girls themselves, the exchange of poems between husbands and wives, for contemporary understandings of conjugal love, among men and women.</p>",
163919,FT-51719-03,2,0,0,0,0,0,0,,Weijing,,Lu,,,,,,Weijing Lu (Project Director: September 2002 to November 2003),"Weijing Lu<br/>Regents of the University of California, San Diego (Fredericksburg, VA 22401-5300)","Regents of the University of California, San Diego",Fredericksburg,VA,22401-5300,USA,2/1/2003,2003,True to Their Word: The Faithful Maiden Cult in Late Imperial China,East Asian History,East Asian History,3,Summer Stipends,6,Research Programs,0,0,5000,0,5000,0,5000,0,6/1/2003 &ndash; 7/31/2003,"<p>This project explores the faithful maiden cult in late imperial China. During this period, an increasing number of young women responded to the death of a fiancé either by living as if they were widows, or by committing suicide to follow their fiancés to the grave. This research examines the tensions and controversy surrounding the cult. Focusing on the emotions, beliefs, psychology, and lives of the faithful maidens, it seeks to answer the questions of what shaped the gender identity of these young women and how honor, duty, love, and sexuality were perceived and expressed by them. A case study on young women, this project will challenge us to rethink the meanings of love, duty, and sexuality from a cross-cultural perspective.</p>",
153997,FT-46542-02,2,0,0,0,0,0,0,,Takashi,,Fujitani,,,,,,Takashi Fujitani (Project Director: October 2001 to February 2003),"Takashi Fujitani<br/>Regents of the University of California, San Diego (La Jolla, CA 92093-0013)","Regents of the University of California, San Diego",La Jolla,CA,92093-0013,USA,3/1/2002,2002,Ethnic and Colonial Soldiers: Korean Japanese and Japanese Americans During WWII,East Asian History,East Asian History; U.S. History,3,Summer Stipends,6,Research Programs,0,0,5000,0,5000,0,5000,0,5/1/2002 &ndash; 9/30/2002,<p>No project description available</p>,
145398,FA-37214-02,2,0,1,0,0,0,0,,Marta,E.,Hanson,,,,,,Marta E. Hanson (Project Director: May 2001 to April 2003),"Marta E. Hanson<br/>Regents of the University of California, San Diego (La Jolla, CA 92093-0013)","Regents of the University of California, San Diego",La Jolla,CA,92093-0013,USA,11/1/2001,2001,"Chinese Medical Geographies: Regional Cultures, Therapeutic Practices, and Imagined Bodies in Early Modern China","History and Philosophy of Science, Technology, and Medicine","East Asian History; History and Philosophy of Science, Technology, and Medicine",1,Fellowships for University Teachers,6,Research Programs,0,0,40000,0,40000,0,40000,0,1/1/2002 &ndash; 11/30/2002,<p>No project description available</p>,
145405,FA-37251-02,2,0,3,0,0,0,0,,David,O.,Brink,,,,,,David O. Brink (Project Director: May 2001 to August 2003),"David O. Brink<br/>Regents of the University of California, San Diego (La Jolla, CA 92093-0013)","Regents of the University of California, San Diego",La Jolla,CA,92093-0013,USA,11/1/2001,2002,Self and Others,Ethics,Ethics,1,Fellowships for University Teachers,6,Research Programs,0,0,40000,0,40000,0,40000,0,4/1/2002 &ndash; 3/31/2003,<p>No project description available</p>,
145283,FA-36430-01,2,0,0,0,0,0,0,,Todd,C.,Kontje,,,,,,Todd C. Kontje (Project Director: April 2000 to August 2002),"Todd C. Kontje<br/>Regents of the University of California, San Diego (La Jolla, CA 92093-0013)","Regents of the University of California, San Diego",La Jolla,CA,92093-0013,USA,11/1/2000,2001,German Orientalisms: National Identity and the Global Imagination,German Language,German Language,1,Fellowships for University Teachers,6,Research Programs,0,0,35000,0,35000,0,35000,0,7/1/2001 &ndash; 6/30/2002,<p>No project description available</p>,
145351,FA-36872-01,2,0,0,0,0,0,0,,Amy,Bridges,Kronick,,,,,,Amy Bridges Kronick (Project Director: May 2000 to February 2003),"Amy Bridges Kronick<br/>Regents of the University of California, San Diego (La Jolla, CA 92093-0013)","Regents of the University of California, San Diego",La Jolla,CA,92093-0013,USA,11/1/2000,2001,The Western State in the Progressive Era: Society and Politics,"Political Science, General","Political Science, General; U.S. History",1,Fellowships for University Teachers,6,Research Programs,0,0,35000,0,35000,0,35000,0,7/1/2001 &ndash; 6/30/2002,<p>No project description available</p>,
153867,FT-45728-01,2,0,0,0,0,0,0,,Elizabeth,Ann,Newsome,,,,,,Elizabeth Ann Newsome (Project Director: October 2000 to March 2002),"Elizabeth Ann Newsome<br/>Regents of the University of California, San Diego (La Jolla, CA 92093-0013)","Regents of the University of California, San Diego",La Jolla,CA,92093-0013,USA,3/1/2001,2001,The Classic Maya Stela Cult: A Study in the Ideology of Power,Art History and Criticism,Art History and Criticism,3,Summer Stipends,6,Research Programs,0,0,4500,0,4500,0,4500,0,5/1/2001 &ndash; 9/30/2001,<p>No project description available</p>,
153934,FT-46179-01,2,0,0,0,0,0,0,,Nicole,,Tonkovich,,,,,,Nicole Tonkovich (Project Director: October 2000 to January 2002),"Nicole Tonkovich<br/>Regents of the University of California, San Diego (La Jolla, CA 92093-0013)","Regents of the University of California, San Diego",La Jolla,CA,92093-0013,USA,3/1/2001,2001,"Archives and Nations: Jane Gay and Alice Fletcher among the Nez Perces, 1889-1892",American Studies,American Studies,3,Summer Stipends,6,Research Programs,0,0,4500,0,4500,0,4500,0,5/1/2001 &ndash; 9/30/2001,<p>No project description available</p>,
154727,FV-22381-00,1,0,0,0,0,0,0,,Stefan,,Tanaka,,,,,,Stefan Tanaka (Project Director: March 2000 to April 2003),"Regents of the University of California, San Diego (La Jolla, CA 92093-0013)<br/>Stefan Tanaka (Project Director: March 2000 to April 2003)</div>","Regents of the University of California, San Diego",La Jolla,CA,92093-0013,USA,7/1/2000,2000,Foreigners Perceived: Travellers and Meiji Japan,Asian Studies,Asian Studies,15,Seminars for K-12 Educators,7,Education Programs,0,0,99171,0,99171,0,99171,0,10/1/2000 &ndash; 9/30/2001,<p>No project description available</p>,
145158,FA-35689-99,2,0,0,0,0,0,0,,Jeffrey,M.,Haydu,,,,,,Jeffrey M. Haydu (Project Director: May 1998 to July 2000),"Jeffrey M. Haydu<br/>Regents of the University of California, San Diego (La Jolla, CA 92093-0013)","Regents of the University of California, San Diego",La Jolla,CA,92093-0013,USA,11/1/1998,1999,"Workplace Justice and the Reconstruction of ""Business Community"" in the U.S., 1865-1904",Sociology,Sociology,1,Fellowships for University Teachers,6,Research Programs,0,0,30000,0,30000,0,30000,0,7/1/1999 &ndash; 6/30/2000,<p>No project description available</p>,
154670,FV-22240-97,1,0,0,0,0,0,0,,Stefan,,Tanaka,,,,,,Stefan Tanaka (Project Director: March 1997 to March 1999),"Regents of the University of California, San Diego (La Jolla, CA 92093-0013)<br/>Stefan Tanaka (Project Director: March 1997 to March 1999)</div>","Regents of the University of California, San Diego",La Jolla,CA,92093-0013,USA,7/1/1997,1997,Foreigners Perceived: Travellers and Meiji Japan,Asian Studies,Asian Studies,15,Seminars for K-12 Educators,7,Education Programs,0,0,84455,0,78724,0,78724,0,10/1/1997 &ndash; 9/30/1998,<p>No project description available</p>,
151589,FS-23114-97,1,0,0,0,0,0,0,,Avrum,,Stroll,,,,,,Avrum Stroll (Project Director: March 1997 to January 1999),"Regents of the University of California, San Diego (La Jolla, CA 92093-0013)<br/>Avrum Stroll (Project Director: March 1997 to January 1999)</div>","Regents of the University of California, San Diego",La Jolla,CA,92093-0013,USA,7/1/1997,1997,Moore and Wittgenstein on Certainty,"Interdisciplinary Studies, General","Interdisciplinary Studies, General",23,Seminars for Higher Education Faculty,7,Education Programs,0,0,99213,0,93606,0,93606,0,10/1/1997 &ndash; 9/30/1998,<p>No project description available</p>,
144837,FA-33688-96,2,0,1,0,0,0,0,,David,R.,Ringrose,,,,,,David R. Ringrose (Project Director: May 1995 to April 1997),"David R. Ringrose<br/>Regents of the University of California, San Diego (La Jolla, CA 92093-0013)","Regents of the University of California, San Diego",La Jolla,CA,92093-0013,USA,11/1/1995,1996,"The Roots of the ""Spanish Miracle, 1900-75",European History,European History,1,Fellowships for University Teachers,6,Research Programs,0,0,30000,0,30000,0,30000,0,7/1/1996 &ndash; 12/31/1996,<p>No project description available</p>,
144916,FA-34337-96,2,0,0,0,0,0,0,,Kathryn,M.,Ringrose,,,,,,Kathryn M. Ringrose (Project Director: May 1995 to December 1997),"Kathryn M. Ringrose<br/>Regents of the University of California, San Diego (La Jolla, CA 92093-0013)","Regents of the University of California, San Diego",La Jolla,CA,92093-0013,USA,11/1/1995,1996,Eunuchs and Gender in Byzantium,Medieval Studies,Medieval Studies,1,Fellowships for University Teachers,6,Research Programs,0,0,30000,0,22750,0,22750,0,8/1/1996 &ndash; 7/31/1997,<p>No project description available</p>,
147198,FD-22712-95,2,0,0,0,0,0,0,,Jeffrey,G.,Snodgrass,,,,,,Jeffrey G. Snodgrass (Project Director: December 1994 to December 1996),"Jeffrey G. Snodgrass<br/>Regents of the University of California, San Diego (La Jolla, CA 92093-0013)","Regents of the University of California, San Diego",La Jolla,CA,92093-0013,USA,5/1/1995,1995,Poisonous Gifts and Wondrous Commodities: The Moral Evaluation of Capitalism in India,Anthropology,Anthropology,46,Dissertation Grants,9,Fellowships and Seminars,0,0,14000,0,14000,0,14000,0,7/1/1995 &ndash; 6/30/1996,<p>No project description available</p>,
159991,RK-20194-95,2,0,0,0,0,0,0,,Thomas,E.,Levy,,,,,,Thomas E. Levy (Project Director: October 1994 to February 1999),"Thomas E. Levy<br/>Regents of the University of California, San Diego (La Jolla, CA 92093-0013)","Regents of the University of California, San Diego",La Jolla,CA,92093-0013,USA,2/1/1995,1995,"Archaeological Investigations of Egyptian-Levantine Interaction at Nahal Tillah, Israel: ca.4000-3000 BC",Archaeology,Archaeology,73,Archaeology Projects,6,Research Programs,0,88184,35000,88194,35000,88184,123184,0,4/1/1995 &ndash; 12/31/1997,"<p>To support a team of archaeologists for two years of excavation and analysis at Nahal Tillah, Israel, the site of 3rd millennium B.C. Egyptian expansion into the Negev Desert of southern Israel.</p>",
153115,FT-40474-94,2,0,0,0,0,0,0,,James,,Holston,,,,,,James Holston (Project Director: October 1993 to February 1995),"James Holston<br/>Regents of the University of California, San Diego (La Jolla, CA 92093-0013)","Regents of the University of California, San Diego",La Jolla,CA,92093-0013,USA,2/1/1994,1994,"Law, Citizenship, and Judicial Reform in the Expansion of Brazilian Democracy",Anthropology,Anthropology,3,Summer Stipends,6,Research Programs,0,0,4750,0,4750,0,4750,0,5/1/1994 &ndash; 9/30/1994,<p>No project description available</p>,
151473,FS-22743-94,1,0,0,0,0,0,0,,Andrew,,Scull,,,,,,Andrew Scull (Project Director: March 1994 to February 1996),"Regents of the University of California, San Diego (La Jolla, CA 92093-0013)<br/>Andrew Scull (Project Director: March 1994 to February 1996)</div>","Regents of the University of California, San Diego",La Jolla,CA,92093-0013,USA,8/1/1994,1994,"Madness and Society in Britain and North America, 1600-1950","History and Philosophy of Science, Technology, and Medicine","History and Philosophy of Science, Technology, and Medicine",23,Seminars for Higher Education Faculty,7,Education Programs,0,0,100718,0,93472.62,0,93472.62,0,10/1/1994 &ndash; 9/30/1995,<p>No project description available</p>,
142595,EH-21777-94,1,0,0,0,0,0,0,,Avrum,,Stroll,,,,,,Avrum Stroll (Project Director: October 1993 to January 1997),"Regents of the University of California, San Diego (La Jolla, CA 92093-0013)<br/>Avrum Stroll (Project Director: October 1993 to January 1997)</div>","Regents of the University of California, San Diego",La Jolla,CA,92093-0013,USA,2/1/1994,1994,Modernity and Its Discontents,"Interdisciplinary Studies, General","Interdisciplinary Studies, General",13,Institutes for Higher Education Faculty,7,Education Programs,176477,0,176477,0,173736,0,173736,0,8/1/1994 &ndash; 5/31/1996,<p>To support a four-week national institute for 24 two-year and four-year collegefaculty members who will study major texts and topics related to the Enlighten-ment in Europe.</p>,
142540,EH-21638-93,1,0,0,0,0,0,0,,Avrum,,Stroll,,,,,,Avrum Stroll (Project Director: October 1992 to December 1995),"Regents of the University of California, San Diego (La Jolla, CA 92093-0013)<br/>Avrum Stroll (Project Director: October 1992 to December 1995)</div>","Regents of the University of California, San Diego",La Jolla,CA,92093-0013,USA,2/1/1993,1993,The Enlightenment and Counter Enlightenment,"Interdisciplinary Studies, General","Interdisciplinary Studies, General",13,Institutes for Higher Education Faculty,7,Education Programs,93250,0,93250,0,92338.78,0,92338.78,0,4/1/1993 &ndash; 3/31/1995,<p>To support a four-week project for 24 faculty members from community colleges in the San Diego area who will study major texts and topics related to the Enlightenment in Europe.</p>,
159939,RK-20007-93,1,0,0,0,0,0,0,,Guillermo,,Algaze,,,,,,Guillermo Algaze (Project Director: October 1992 to November 1996),"Regents of the University of California, San Diego (La Jolla, CA 92093-0013)<br/>Guillermo Algaze (Project Director: October 1992 to November 1996)</div>","Regents of the University of California, San Diego",La Jolla,CA,92093-0013,USA,2/1/1993,1993,Syro-Anatolian State Formation: Excavations at Titrish Hoyuk,Archaeology,Archaeology,73,Archaeology Projects,6,Research Programs,45000,57000,45000,57000,45000,57000,102000,0,5/1/1993 &ndash; 5/31/1996,"<p>To support three years of excavation and analysis at the 3rd millennium B.C. site of Titrish Hoyuk in Turkey. Building on prior multinational salvage excavations, this project will address state formation in Syro-Anatolia.</p>",
161336,RT-21347-92,1,2,0,0,0,0,0,,Leonard,,Newmark,,,,,,Leonard Newmark (Project Director: May 1993 to April 1996),"Regents of the University of California, San Diego (La Jolla, CA 92093-0013)<br/>Leonard Newmark (Project Director: May 1993 to April 1996)</div>","Regents of the University of California, San Diego",La Jolla,CA,92093-0013,USA,5/1/1992,1992,Albanian-English Dictionary,"Languages, General","Languages, General",58,Reference Materials - Tools,1,Preservation and Access,0,0,96987,0,96987,0,84387,12600,7/1/1992 &ndash; 6/30/1995,<p>To support the completion of a comprehensive Albanian-English dictionary.</p>,
143020,ER-21573-92,2,0,0,0,0,0,0,,Paul,J.,Otis,,,,,,Paul J. Otis (Project Director: May 1991 to July 1993),"Paul J. Otis<br/>Regents of the University of California, San Diego (La Jolla, CA 92093-0013)","Regents of the University of California, San Diego",La Jolla,CA,92093-0013,USA,11/1/1991,1992,Nostalgia and Tokugawa Japan,Asian Studies,Asian Studies,26,NEH Teacher-Scholar Program,7,Education Programs,0,0,30500,0,30500,0,30500,0,9/1/1992 &ndash; 6/30/1993,<p>No project description available</p>,
144434,FA-30958-92,2,0,2,0,0,0,0,,Benetta,,Jules-Rosette,,,,,,Benetta Jules-Rosette (Project Director: June 1991 to May 1993),"Benetta Jules-Rosette<br/>Regents of the University of California, San Diego (La Jolla, CA 92093-0013)","Regents of the University of California, San Diego",La Jolla,CA,92093-0013,USA,11/1/1991,1992,"A History of PRESENCE AFRICAINE, An African Intellectual Movement",Sociology,Sociology,1,Fellowships for University Teachers,6,Research Programs,0,0,30000,0,26930,0,26930,0,7/1/1992 &ndash; 12/31/1992,<p>No project description available</p>,
144315,FA-30158-91,2,0,0,0,0,0,0,,Stefan,,Tanaka,,,,,,Stefan Tanaka (Project Director: June 1990 to January 1993),"Stefan Tanaka<br/>Regents of the University of California, San Diego (Worcester, MA 01610-1477)","Regents of the University of California, San Diego",Worcester,MA,01610-1477,USA,11/1/1990,1991,Defining a Japanese Aesthetic Tradition,East Asian History,East Asian History,1,Fellowships for University Teachers,6,Research Programs,0,0,30000,0,20960,0,20960,0,1/1/1992 &ndash; 8/31/1992,<p>No project description available</p>,
