ApplicationID,ApplicationNumber,ApplicantType,SuppCount,ProductCount,CoverageCount,PrizeCount,ParticipatingInstitutionCount,WhitePaper,WhitePaperPath,PDFirstname,PDMiddlename,PDLastname,PDNameSuffix,CoPDFirstname,CoPDMiddlename,CoPDLastname,CoPDNameSuffix,Participants,GranteeDisplay,Institution,InstCity,InstState,InstPostalCode,InstCountry,CouncilDate,YearAwarded,ProjectTitle,PrimaryDiscipline,AllDisciplines,ProgramID,ProgramName,DivisionID,DivisionName,OfferedOutright,OfferedMatching,ApprovedOutright,ApprovedMatching,AwardOutright,AwardMatching,OriginalAmount,SupplementAmount,GrantPeriod,ProjectDesc,ToSupport
144358,FA-30497-91,2,0,0,0,0,0,0,,Kthryn,A.,Woolard,,,,,,Kthryn A. Woolard (Project Director: June 1990 to March 1993),"Kthryn A. Woolard<br/>Regents of the University of California, San Diego (La Jolla, CA 92093-0013)","Regents of the University of California, San Diego",La Jolla,CA,92093-0013,USA,11/1/1990,1991,"Multilingualism, Ideology, and the State in Spain and the New World",Anthropology,Anthropology,1,Fellowships for University Teachers,6,Research Programs,0,0,30000,0,30000,0,30000,0,9/1/1991 &ndash; 6/30/1992,<p>No project description available</p>,
160569,RO-22335-91,1,0,0,0,0,0,0,,Guillermo,,Algaze,,,,,,Guillermo Algaze (Project Director: November 1990 to September 1992),"Regents of the University of California, San Diego (La Jolla, CA 92093-0013)<br/>Guillermo Algaze (Project Director: November 1990 to September 1992)</div>","Regents of the University of California, San Diego",La Jolla,CA,92093-0013,USA,5/1/1991,1991,Syro-Anatolian State Formation: Excavations at Titris Hoyuk,Archaeology,Archaeology,40,Basic Research,6,Research Programs,0,30181,15000,33230,15000,14422,29422,0,5/1/1991 &ndash; 4/30/1992,"<p>To support archaeological excavation at Titris Hoyuk, an early Syro-Anatolian capital in the upper Euphrates basin in Turkey.</p>",
152515,FT-36035-91,2,0,0,0,0,0,0,,Louis,A.,Montrose,,,,,,Louis A. Montrose (Project Director: October 1990 to January 1992),"Louis A. Montrose<br/>Regents of the University of California, San Diego (La Jolla, CA 92093-0013)","Regents of the University of California, San Diego",La Jolla,CA,92093-0013,USA,2/1/1991,1991,Social Order and Social Mobility in Elizabethan and Jacobean England,British Literature,British Literature,3,Summer Stipends,6,Research Programs,0,0,3750,0,3750,0,3750,0,5/1/1991 &ndash; 9/30/1991,<p>No project description available</p>,
151371,FS-22451-91,1,3,0,0,0,0,0,,Eric,J.,Van Young,,,,,,Eric J. Van Young (Project Director: March 1993 to September 1993),"Regents of the University of California, San Diego (La Jolla, CA 92093-0013)<br/>Eric J. Van Young (Project Director: March 1993 to September 1993)</div>","Regents of the University of California, San Diego",La Jolla,CA,92093-0013,USA,8/1/1991,1991,"Resistance, Rebellion, and Adaptation in Rural Latin America, 1500-1900",Latin American History,Latin American History,23,Seminars for Higher Education Faculty,7,Education Programs,0,0,72133,0,70429.5,0,1000,2538,10/1/1991 &ndash; 9/30/1992,<p>No project description available</p>,
151207,FS-22004-89,1,2,0,0,0,0,0,,Stephen,,Stich,,,,,,Stephen Stich (Project Director: June 1989 to May 1990),"Regents of the University of California, San Diego (La Jolla, CA 92093-0013)<br/>Stephen Stich (Project Director: June 1989 to May 1990)</div>","Regents of the University of California, San Diego",La Jolla,CA,92093-0013,USA,8/1/1988,1988,The Philosophical Implications of Cognitive Science,"Philosophy, General","Philosophy, General",23,Seminars for Higher Education Faculty,7,Education Programs,0,0,85923.55,0,85923.55,0,0,2583.55,10/1/1988 &ndash; 9/30/1989,<p>No project description available</p>,
151890,FT-31978-89,2,0,0,0,0,0,0,,Michael,A.,Bernstein,,,,,,Michael A. Bernstein (Project Director: October 1988 to February 1990),"Michael A. Bernstein<br/>Regents of the University of California, San Diego (La Jolla, CA 92093-0013)","Regents of the University of California, San Diego",La Jolla,CA,92093-0013,USA,2/1/1989,1989,American Economics in the American Century: The State and Modern Economic Thought,U.S. History,U.S. History,3,Summer Stipends,6,Research Programs,0,0,3500,0,3500,0,3500,0,5/1/1989 &ndash; 9/30/1989,<p>No project description available</p>,
161271,RT-21061-89,1,0,0,0,0,0,0,,Leonard,,Newmark,,,,,,Leonard Newmark (Project Director: November 1988 to February 1993),"Regents of the University of California, San Diego (La Jolla, CA 92093-0013)<br/>Leonard Newmark (Project Director: November 1988 to February 1993)</div>","Regents of the University of California, San Diego",La Jolla,CA,92093-0013,USA,5/1/1989,1989,Albanian-English Dictionary,Linguistics,Linguistics,58,Reference Materials - Tools,1,Preservation and Access,0,10000,74301,10000,74301,10000,84301,0,9/1/1989 &ndash; 6/30/1992,"<p>To support phase two of a three-phase project to produce an Albanian-English dictionary of 75,000 entries.</p>",
144030,FA-28279-89,2,0,1,0,0,0,0,,Donald,F.,Tuzin,,,,,,Donald F. Tuzin (Project Director: June 1988 to June 1990),"Donald F. Tuzin<br/>Regents of the University of California, San Diego (La Jolla, CA 92093-0013)","Regents of the University of California, San Diego",La Jolla,CA,92093-0013,USA,11/1/1988,1989,"Gender, Religion, and Human Values in a New Guinea Society",Anthropology,Anthropology,1,Fellowships for University Teachers,6,Research Programs,0,0,21116,0,21116,0,21116,0,7/1/1989 &ndash; 1/28/1990,<p>No project description available</p>,
144034,FA-28285-89,2,0,0,0,0,0,0,,Daniel,E.,Bornstein,,,,,,Daniel E. Bornstein (Project Director: June 1988 to September 1990),"Daniel E. Bornstein<br/>Regents of the University of California, San Diego (La Jolla, CA 92093-0013)","Regents of the University of California, San Diego",La Jolla,CA,92093-0013,USA,11/1/1988,1989,A Social and Religious History of the Diocese of Cortona in the 14th and 15th Centuries,European History,European History,1,Fellowships for University Teachers,6,Research Programs,0,0,27500,0,27500,0,27500,0,8/1/1989 &ndash; 7/31/1990,<p>No project description available</p>,
144074,FA-28449-89,2,0,0,0,0,0,0,,Patricia,,Kitcher,,,,,,Patricia Kitcher (Project Director: June 1988 to October 1990),"Patricia Kitcher<br/>Regents of the University of California, San Diego (La Jolla, CA 92093-0013)","Regents of the University of California, San Diego",La Jolla,CA,92093-0013,USA,11/1/1988,1989,Freud's Dream: A Complete Interdisciplinary Theory of Mind,Epistemology,Epistemology,1,Fellowships for University Teachers,6,Research Programs,0,0,27500,0,27500,0,27500,0,7/1/1989 &ndash; 6/30/1990,<p>No project description available</p>,
144015,FA-28142-88,2,0,1,0,0,0,0,,Jann,C.,Pasler,,,,,,Jann C. Pasler (Project Director: June 1987 to April 1990),"Jann C. Pasler<br/>Regents of the University of California, San Diego (La Jolla, CA 92093-0013)","Regents of the University of California, San Diego",La Jolla,CA,92093-0013,USA,11/1/1987,1988,"The Apaches in Paris, 1902-13",Music History and Criticism,Music History and Criticism,1,Fellowships for University Teachers,6,Research Programs,0,0,27500,0,27500,0,27500,0,11/1/1988 &ndash; 10/31/1989,<p>No project description available</p>,
151192,FS-21963-88,1,0,0,0,0,0,0,,Michael,S.,Schudson,,,,,,Michael S. Schudson (Project Director: March 1988 to April 1990),"Regents of the University of California, San Diego (La Jolla, CA 92093-0013)<br/>Michael S. Schudson (Project Director: March 1988 to April 1990)</div>","Regents of the University of California, San Diego",La Jolla,CA,92093-0013,USA,8/1/1988,1988,American Journalism in Historical Perspective,Sociology,Sociology,23,Seminars for Higher Education Faculty,7,Education Programs,0,0,78548,0,75882.44,0,75882.44,0,10/1/1988 &ndash; 9/30/1989,<p>No project description available</p>,
141678,CU-20176-87,1,0,0,0,0,0,0,,Stanley,A.,Chodorow,,,,,,Stanley A. Chodorow (Project Director: May 1986 to February 1991),"Regents of the University of California, San Diego (La Jolla, CA 92093-0013)<br/>Stanley A. Chodorow (Project Director: May 1986 to February 1991)</div>","Regents of the University of California, San Diego",La Jolla,CA,92093-0013,USA,11/1/1986,1987,Challenge Grant,"Interdisciplinary Studies, General","Interdisciplinary Studies, General",69,Challenge Grants for Universities,4,Challenge Programs,0,875000,0,875000,0,875000,875000,0,12/1/1985 &ndash; 7/31/1990,"<p>To create an endowment for acquisitions in the humanities, which will increase the library's general holdings in the humanities and its special collections for Pacific Studies, Latin American Studies, and Contemporary Studies.</p>",
131819,FT-30300-87,2,0,0,0,0,0,0,,James,K.,Lyon,,,,,,James K. Lyon (Project Director: October 1986 to October 1990),"James K. Lyon<br/>Regents of the University of California, San Diego (La Jolla, CA 92093-0013)","Regents of the University of California, San Diego",La Jolla,CA,92093-0013,USA,2/1/1987,1987,The Poetry of Paul Celan,German Literature,German Literature,3,Summer Stipends,6,Research Programs,0,0,3500,0,2188,0,2188,0,8/1/1987 &ndash; 9/30/1987,<p>No project description available</p>,
129717,FS-21636-87,1,0,0,0,0,0,0,,Michael,S.,Schudson,,,,,,Michael S. Schudson (Project Director: January 1987 to October 1990),"Regents of the University of California, San Diego (La Jolla, CA 92093-0013)<br/>Michael S. Schudson (Project Director: January 1987 to October 1990)</div>","Regents of the University of California, San Diego",La Jolla,CA,92093-0013,USA,8/1/1986,1986,American Journalism in Historical Perspective,Sociology,Sociology,23,Seminars for Higher Education Faculty,7,Education Programs,0,0,65233,0,65233,0,65233,0,10/1/1986 &ndash; 9/30/1987,<p>No project description available</p>,
161203,RT-20755-87,1,0,1,0,0,0,0,,Leonard,,Newmark,,,,,,Leonard Newmark (Project Director: October 1986 to February 1990),"Regents of the University of California, San Diego (La Jolla, CA 92093-0013)<br/>Leonard Newmark (Project Director: October 1986 to February 1990)</div>","Regents of the University of California, San Diego",La Jolla,CA,92093-0013,USA,8/1/1987,1987,Albanian-English Dictionary,"Languages, General","Languages, General",58,Reference Materials - Tools,1,Preservation and Access,0,2500,50000,2500,50000,2400,52400,0,9/1/1987 &ndash; 8/31/1989,<p>To support the creation of a database consisting of all the words and idioms included in extant dictionaries of the Albanian language. The database will be used to produce a comprehensive Albanian/English dictionary.</p>,
154762,GB-20118-87,1,0,0,0,0,0,0,,Robert,C.,Ritchie,,,,,,Robert C. Ritchie (Project Director: March 1986 to October 1988),"Regents of the University of California, San Diego (La Jolla, CA 92093-0013)<br/>Robert C. Ritchie (Project Director: March 1986 to October 1988)</div>","Regents of the University of California, San Diego",La Jolla,CA,92093-0013,USA,8/1/1986,1986,Bicentennial Constitution Project,U.S. History,U.S. History,38,Bicentennial Projects,2,Public Programs,0,35000,50000,35000,49084.25,0,49084.25,0,10/1/1986 &ndash; 12/31/1987,"<p>To support, for secondary school teachers, a series of six lectures, a scholarly symposium, a major exhibit, and a workshop on the subject of constitutionalism and nation-building in the United States and Latin America.</p>",
126366,FA-26240-86,2,0,0,0,0,0,0,,Thomas,,Dublin,,,,,,Thomas Dublin (Project Director: June 1985 to October 1990),"Thomas Dublin<br/>Regents of the University of California, San Diego (La Jolla, CA 92093-0013)","Regents of the University of California, San Diego",La Jolla,CA,92093-0013,USA,11/1/1985,1985,Women's Careers in 19th-Century New England,U.S. History,U.S. History,1,Fellowships for University Teachers,6,Research Programs,0,0,27500,0,27367,0,27367,0,9/1/1986 &ndash; 6/30/1987,<p>No project description available</p>,
126426,FA-26690-86,2,0,1,0,0,0,0,,Jon,R.,Snyder,,,,,,Jon R. Snyder (Project Director: June 1985 to October 1990),"Jon R. Snyder<br/>Regents of the University of California, San Diego (La Jolla, CA 92093-0013)","Regents of the University of California, San Diego",La Jolla,CA,92093-0013,USA,11/1/1985,1985,"Italian Theories of the Dialogue, 1562-1646",Literary Criticism,Literary Criticism,1,Fellowships for University Teachers,6,Research Programs,0,0,27500,0,27500,0,27500,0,4/1/1986 &ndash; 3/31/1987,<p>No project description available</p>,
126176,FA-24827-85,2,0,1,0,0,0,0,,Henry,,Allison,,,,,,Henry Allison (Project Director: May 1984 to October 1990),"Henry Allison<br/>Regents of the University of California, San Diego (La Jolla, CA 92093-0013)","Regents of the University of California, San Diego",La Jolla,CA,92093-0013,USA,11/1/1984,1985,An Examination of Kant's Theory of Freedom,History of Philosophy,History of Philosophy,1,Fellowships for University Teachers,6,Research Programs,0,0,27500,0,27500,0,27500,0,8/1/1985 &ndash; 7/31/1986,<p>No project description available</p>,
126180,FA-24855-85,2,0,0,0,0,0,0,,Eric,J.,Van Young,,,,,,Eric J. Van Young (Project Director: May 1984 to October 1990),"Eric J. Van Young<br/>Regents of the University of California, San Diego (La Jolla, CA 92093-0013)","Regents of the University of California, San Diego",La Jolla,CA,92093-0013,USA,11/1/1984,1984,"A Social History of the Mexican Independence Movement, 1810-1817",Latin American History,Latin American History,1,Fellowships for University Teachers,6,Research Programs,0,0,25044,0,25044,0,25044,0,1/1/1986 &ndash; 12/31/1986,<p>No project description available</p>,
126195,FA-24947-85,2,0,0,0,0,0,0,,Kathryn,,Norberg,,,,,,Kathryn Norberg (Project Director: June 1984 to October 1990),"Kathryn Norberg<br/>Regents of the University of California, San Diego (La Jolla, CA 92093-0013)","Regents of the University of California, San Diego",La Jolla,CA,92093-0013,USA,11/1/1984,1985,The Political Economy of the Eighteenth-Century French Peasantry,European History,European History,1,Fellowships for University Teachers,6,Research Programs,0,0,27500,0,27500,0,27500,0,7/1/1985 &ndash; 6/30/1986,<p>No project description available</p>,
126216,FA-25106-85,2,0,0,0,0,0,0,,Allan,,Mitchell,,,,,,Allan Mitchell (Project Director: June 1984 to October 1990),"Allan Mitchell<br/>Regents of the University of California, San Diego (La Jolla, CA 92093-0013)","Regents of the University of California, San Diego",La Jolla,CA,92093-0013,USA,11/1/1984,1984,"A Comparative Social History of France and Germany, 1870-1918",European History,European History,1,Fellowships for University Teachers,6,Research Programs,0,0,27500,0,15217,0,15217,0,4/1/1985 &ndash; 12/31/1985,<p>No project description available</p>,
131390,FT-27447-85,2,0,0,0,0,0,0,,Jon,R.,Snyder,,,,,,Jon R. Snyder (Project Director: October 1984 to October 1990),"Jon R. Snyder<br/>Regents of the University of California, San Diego (La Jolla, CA 92093-0013)","Regents of the University of California, San Diego",La Jolla,CA,92093-0013,USA,2/1/1985,1985,"Italian Theories of Dialogue, 1560-1650","Literature, General","Literature, General",3,Summer Stipends,6,Research Programs,0,0,3000,0,3000,0,3000,0,5/1/1985 &ndash; 9/30/1985,<p>No project description available</p>,
131392,FT-27450-85,2,0,0,0,0,0,0,,Alden,A.,Mosshammer,,,,,,Alden A. Mosshammer (Project Director: October 1984 to October 1990),"Alden A. Mosshammer<br/>Regents of the University of California, San Diego (La Jolla, CA 92093-0013)","Regents of the University of California, San Diego",La Jolla,CA,92093-0013,USA,2/1/1985,1985,Gregory of Nyssa and Christian Hellenism,Classics,Classics,3,Summer Stipends,6,Research Programs,0,0,3000,0,3000,0,3000,0,5/1/1985 &ndash; 9/30/1985,<p>No project description available</p>,
131394,FT-27452-85,2,0,0,0,0,0,0,,Jann,C.,Pasler,,,,,,Jann C. Pasler (Project Director: October 1984 to October 1990),"Jann C. Pasler<br/>Regents of the University of California, San Diego (La Jolla, CA 92093-0013)","Regents of the University of California, San Diego",La Jolla,CA,92093-0013,USA,2/1/1985,1985,"A Study of the French Avant-Garde: The Apaches from PELLEAS to THE RITE, 1902-1913",Music History and Criticism,Music History and Criticism,3,Summer Stipends,6,Research Programs,0,0,3000,0,3000,0,3000,0,5/1/1985 &ndash; 9/30/1985,<p>No project description available</p>,
126066,FA-23870-84,2,0,0,0,0,0,0,,Joseph,R.,Gusfield,,,,,,Joseph R. Gusfield (Project Director: June 1983 to October 1990),"Joseph R. Gusfield<br/>Regents of the University of California, San Diego (La Jolla, CA 92093-0013)","Regents of the University of California, San Diego",La Jolla,CA,92093-0013,USA,11/1/1983,1983,Discontent with Progress: The Myth and Symbolism of Regressin Social Movements of the 19th and 20th Centuries,Sociology,Sociology,1,Fellowships for University Teachers,6,Research Programs,0,0,25000,0,25000,0,25000,0,3/15/1985 &ndash; 3/14/1986,<p>No project description available</p>,
126130,FA-24394-84,2,0,0,0,0,0,0,,Robert,B.,Pippin,,,,,,Robert B. Pippin (Project Director: June 1983 to October 1990),"Robert B. Pippin<br/>Regents of the University of California, San Diego (La Jolla, CA 92093-0013)","Regents of the University of California, San Diego",La Jolla,CA,92093-0013,USA,11/1/1983,1983,Hegel's Idealism: A Reconstruction and Defense,"Philosophy, General","Philosophy, General",1,Fellowships for University Teachers,6,Research Programs,0,0,24033,0,24033,0,24033,0,7/1/1984 &ndash; 6/30/1985,<p>No project description available</p>,
126156,FA-24656-84,2,0,0,0,0,0,0,,Gerald,D.,Doppelt,,,,,,Gerald D. Doppelt (Project Director: June 1983 to October 1990),"Gerald D. Doppelt<br/>Regents of the University of California, San Diego (La Jolla, CA 92093-0013)","Regents of the University of California, San Diego",La Jolla,CA,92093-0013,USA,11/1/1983,1983,Has Thomas Kuhn Shown There is No Such Thing as Scientific Rationality?,"Philosophy, General","Philosophy, General",1,Fellowships for University Teachers,6,Research Programs,0,0,25000,0,25000,0,25000,0,8/1/1984 &ndash; 7/31/1985,<p>No project description available</p>,
160305,RO-20717-84,1,2,0,0,0,0,0,,David,R.,Ringrose,,,,,,David R. Ringrose (Project Director: November 1987 to January 1990),"Regents of the University of California, San Diego (La Jolla, CA 92093-0013)<br/>David R. Ringrose (Project Director: November 1987 to January 1990)</div>","Regents of the University of California, San Diego",La Jolla,CA,92093-0013,USA,11/1/1983,1984,Wealth and Politics in 19th-Century Spain,European History,European History,40,Basic Research,6,Research Programs,100000,14633,100000,14633,100000,10862,100000,14633,7/1/1984 &ndash; 1/31/1989,"<p>To support the final revised phases of a collaborative study of wealth and politics in 19th-century Spain, with emphasis on agricultural and urban economic interests in the region around Madrid.</p>",
161157,RT-20387-84,1,10,0,0,0,0,0,,Diego,,Catalan,,,,,,Diego Catalan (Project Director: March 1988 to April 1989),"Regents of the University of California, San Diego (La Jolla, CA 92093-0013)<br/>Diego Catalan (Project Director: March 1988 to April 1989)</div>","Regents of the University of California, San Diego",La Jolla,CA,92093-0013,USA,5/1/1984,1984,"Description, Editing, and Analysis of the Pan-Hispanic Romancero as a Model of Open-Structured Narratives [PHR]",Spanish Literature,Spanish Literature,58,Reference Materials - Tools,1,Preservation and Access,0,190111,90000,190111,90000,190006.12,90000,74726,10/1/1984 &ndash; 8/31/1988,<p>To support work on the General Catalogue of the Pan-Hispanic Romancero and the International Electronic Archive of the Romancero.</p>,
130735,FT-23018-83,2,0,0,0,0,0,0,,David,R.,Ringrose,,,,,,David R. Ringrose (Project Director: September 1982 to October 1990),"David R. Ringrose<br/>Regents of the University of California, San Diego (La Jolla, CA 92093-0013)","Regents of the University of California, San Diego",La Jolla,CA,92093-0013,USA,2/1/1983,1983,"Wealth and Politics in a Nineteenth-Century Capital: Madrid, 1834-1844",European History,European History,3,Summer Stipends,6,Research Programs,0,0,2700,0,2700,0,2700,0,5/1/1983 &ndash; 9/30/1983,<p>No project description available</p>,
130739,FT-23039-83,2,0,0,0,0,0,0,,Steven,D.,Cassedy,,,,,,Steven D. Cassedy (Project Director: September 1982 to October 1990),"Steven D. Cassedy<br/>Regents of the University of California, San Diego (La Jolla, CA 92093-0013)","Regents of the University of California, San Diego",La Jolla,CA,92093-0013,USA,2/1/1983,1983,Andrey Bely and the Rise of Modern Literary Aesthetics,Russian Literature,Russian Literature,3,Summer Stipends,6,Research Programs,0,0,2700,0,2700,0,2700,0,5/1/1983 &ndash; 9/30/1983,<p>No project description available</p>,
130827,FT-23492-83,2,0,0,0,0,0,0,,Ana Celia,,Zentella,,,,,,Ana Celia Zentella (Project Director: October 1982 to October 1990),"Ana Celia Zentella<br/>Regents of the University of California, San Diego (New York, NY 10065-5024)","Regents of the University of California, San Diego",New York,NY,10065-5024,USA,2/1/1983,1983,Spanish-English Code Switching by Migrant Adolescents Who Have Returned to Puerto Rico,Linguistics,Linguistics,3,Summer Stipends,6,Research Programs,0,0,2700,0,2700,0,2700,0,5/1/1983 &ndash; 9/30/1983,<p>No project description available</p>,
125353,ES-20792-83,1,0,0,0,0,0,0,,Ronald,S.,Berman,,,,,,Ronald S. Berman (Project Director: November 1983 to October 1990),"Regents of the University of California, San Diego (La Jolla, CA 92093-0013)<br/>Ronald S. Berman (Project Director: November 1983 to October 1990)</div>","Regents of the University of California, San Diego",La Jolla,CA,92093-0013,USA,11/1/1983,1983,UCSD Humanities Institute,"History, General","History, General; Languages, General; Literature, General",14,Institutes for K-12 Educators,7,Education Programs,654540,0,654540,0,634639,0,634639,0,1/1/1984 &ndash; 9/30/1987,<p>To support one six-week summer institute and follow-up activities over an eighteen-month period for high school teachers to study significant literary and historical texts from the Western tradition.</p>,
125935,FA-22708-83,2,0,1,0,0,0,0,,Germaine,A.,Hoston,,,,,,Germaine A. Hoston (Project Director: May 1982 to October 1990),"Germaine A. Hoston<br/>Regents of the University of California, San Diego (Baltimore, MD 21218-2625)","Regents of the University of California, San Diego",Baltimore,MD,21218-2625,USA,11/1/1982,1983,Comparative Perspectives on Marxism and Nationalism in China and Japan,"Political Science, General","Political Science, General",1,Fellowships for University Teachers,6,Research Programs,0,0,25000,0,25000,0,25000,0,1/1/1984 &ndash; 12/31/1984,<p>No project description available</p>,
125944,FA-22766-83,2,0,0,0,0,0,0,,Stephen,,Stich,,,,,,Stephen Stich (Project Director: June 1982 to October 1990),"Stephen Stich<br/>Regents of the University of California, San Diego (College Park, MD 20742-5141)","Regents of the University of California, San Diego",College Park,MD,20742-5141,USA,11/1/1982,1982,The Nature and Limits of Human Rationality,"Philosophy, General","Philosophy, General",1,Fellowships for University Teachers,6,Research Programs,0,0,21976,0,21976,0,21976,0,9/1/1983 &ndash; 6/30/1984,<p>No project description available</p>,
126032,FA-23525-83,2,0,0,0,0,0,0,,David,A.,Antin,,,,,,David A. Antin (Project Director: June 1982 to October 1990),"David A. Antin<br/>Regents of the University of California, San Diego (La Jolla, CA 92093-0013)","Regents of the University of California, San Diego",La Jolla,CA,92093-0013,USA,11/1/1982,1983,Social Interaction & Interpretation in the Construction of Value in Contemporary Art,Art History and Criticism,Art History and Criticism,1,Fellowships for University Teachers,6,Research Programs,0,0,25000,0,25000,0,25000,0,7/1/1983 &ndash; 6/30/1984,<p>No project description available</p>,
137386,RH-20521-83,1,0,0,0,0,0,0,,John,H.,McLeod,Jr,,,,,John H. McLeod (Project Director: April 1983 to October 1990),"Regents of the University of California, San Diego (La Jolla, CA 92093-0013)<br/>John H. McLeod (Project Director: April 1983 to October 1990)</div>","Regents of the University of California, San Diego",La Jolla,CA,92093-0013,USA,5/1/1983,1983,The Ethics of Decision-Making When Questionable Information is Involved,"Interdisciplinary Studies, Other","Interdisciplinary Studies, Other",65,"Humanities, Science, and Technology",6,Research Programs,0,0,8000,0,8000,0,8000,0,1/1/1983 &ndash; 1/31/1984,"<p>To support research on the use of questionable information (""soft data"") in computer models used as tools for decision-making.</p>",
137786,RL-20469-83,2,0,0,0,0,0,0,,John,A.,Marino,,,,,,John A. Marino (Project Director: July 1982 to October 1990),"John A. Marino<br/>Regents of the University of California, San Diego (La Jolla, CA 92093-0013)","Regents of the University of California, San Diego",La Jolla,CA,92093-0013,USA,2/1/1983,1983,Translation of a work on Government in Naples during the Italian Renaissance,European History,European History,36,Translations,6,Research Programs,0,0,15000,0,15000,0,15000,0,7/1/1983 &ndash; 7/31/1984,"<p>To support the compilation, edition, and translation of an anthology of scholarly articles on the social and economic foundations of Neapolitan culture.</p>",
130725,FT-22942-82,2,0,0,0,0,0,0,,Kathryn,,Norberg,,,,,,Kathryn Norberg (Project Director: October 1981 to October 1990),"Kathryn Norberg<br/>Regents of the University of California, San Diego (La Jolla, CA 92093-0013)","Regents of the University of California, San Diego",La Jolla,CA,92093-0013,USA,2/1/1982,1982,Seigneurial Justice in Eighteenth-Century France,European History,European History,3,Summer Stipends,6,Research Programs,0,0,2500,0,2500,0,2500,0,5/1/1982 &ndash; 9/30/1982,<p>No project description available</p>,
