ApplicationID,ApplicationNumber,ApplicantType,SuppCount,ProductCount,CoverageCount,PrizeCount,ParticipatingInstitutionCount,WhitePaper,WhitePaperPath,PDFirstname,PDMiddlename,PDLastname,PDNameSuffix,CoPDFirstname,CoPDMiddlename,CoPDLastname,CoPDNameSuffix,Participants,GranteeDisplay,Institution,InstCity,InstState,InstPostalCode,InstCountry,CouncilDate,YearAwarded,ProjectTitle,PrimaryDiscipline,AllDisciplines,ProgramID,ProgramName,DivisionID,DivisionName,OfferedOutright,OfferedMatching,ApprovedOutright,ApprovedMatching,AwardOutright,AwardMatching,OriginalAmount,SupplementAmount,GrantPeriod,ProjectDesc,ToSupport
140875,RY-21714-85,2,0,0,0,0,0,0,,James,O.,Steinke,,,,,,James O. Steinke (Project Director: January 1985 to October 1990),"James O. Steinke<br/>Regents of the University of California, Santa Barbara (Santa Barbara, CA 93106-0001)","Regents of the University of California, Santa Barbara",Santa Barbara,CA,93106-0001,USA,8/1/1985,1985,The Making of Hemingway's A Moveable Feast,American Literature,American Literature,52,"Travel to Collections, 11/83 - 5/85",6,Research Programs,0,0,500,0,500,0,500,0,6/1/1985 &ndash; 9/30/1985,<p>To support research on the making of Hemingway's A MOVEABLE FEAST.</p>,
129677,FS-21531-85,1,0,0,0,0,0,0,,Luis,,Leal,,,,,,Luis Leal (Project Director: March 1985 to October 1990),"Regents of the University of California, Santa Barbara (Santa Barbara, CA 93106-0001)<br/>Luis Leal (Project Director: March 1985 to October 1990)</div>","Regents of the University of California, Santa Barbara",Santa Barbara,CA,93106-0001,USA,8/1/1985,1985,Hispanic Literature of the Southwest: Tradition and Innovation,"Literature, General","Literature, General",23,Seminars for Higher Education Faculty,7,Education Programs,0,0,58135,0,58135,0,58135,0,10/1/1985 &ndash; 12/31/1986,<p>No project description available</p>,
131363,FT-27263-85,2,0,0,0,0,0,0,,Donald,B.,Johnson,,,,,,Donald B. Johnson (Project Director: October 1984 to October 1990),"Donald B. Johnson<br/>Regents of the University of California, Santa Barbara (Santa Barbara, CA 93106-0001)","Regents of the University of California, Santa Barbara",Santa Barbara,CA,93106-0001,USA,2/1/1985,1985,Sasha Sokolov's PALISANRIJA as a Syntagmatic Novel,Slavic Literature,Slavic Literature,3,Summer Stipends,6,Research Programs,0,0,3000,0,3000,0,3000,0,5/1/1985 &ndash; 9/30/1985,<p>No project description available</p>,
131162,FT-25794-84,2,0,0,0,0,0,0,,Ulrich,F.,Keller,,,,,,Ulrich F. Keller (Project Director: October 1983 to October 1990),"Ulrich F. Keller<br/>Regents of the University of California, Santa Barbara (Santa Barbara, CA 93106-0001)","Regents of the University of California, Santa Barbara",Santa Barbara,CA,93106-0001,USA,2/1/1984,1984,Reconstruction of Nadar's Authentic Portrait Oeuvre,Art History and Criticism,Art History and Criticism,3,Summer Stipends,6,Research Programs,0,0,3000,0,3000,0,3000,0,5/1/1984 &ndash; 9/30/1984,<p>No project description available</p>,
129521,FS-21032-84,1,0,0,0,0,0,0,,Luis,,Leal,,,,,,Luis Leal (Project Director: February 1983 to October 1990),"Regents of the University of California, Santa Barbara (Santa Barbara, CA 93106-0001)<br/>Luis Leal (Project Director: February 1983 to October 1990)</div>","Regents of the University of California, Santa Barbara",Santa Barbara,CA,93106-0001,USA,8/1/1983,1983,Chicano Literature and Cultural Identity,Spanish Literature,Spanish Literature,23,Seminars for Higher Education Faculty,7,Education Programs,0,0,57079,0,57079,0,57079,0,10/1/1983 &ndash; 12/31/1984,<p>No project description available</p>,
126113,FA-24246-84,2,0,0,0,0,0,0,,Eileen,Cynthia,Boris,,,,,,Eileen Cynthia Boris (Project Director: June 1983 to October 1990),"Eileen Cynthia Boris<br/>Regents of the University of California, Santa Barbara (College Park, MD 20742-5141)","Regents of the University of California, Santa Barbara",College Park,MD,20742-5141,USA,11/1/1983,1983,Industrial Homework and Women's Lives,U.S. History,U.S. History,1,Fellowships for University Teachers,6,Research Programs,0,0,25000,0,25000,0,25000,0,1/1/1985 &ndash; 12/31/1985,<p>No project description available</p>,
126132,FA-24403-84,2,0,0,0,0,0,0,,Carl,V.,Harris,,,,,,Carl V. Harris (Project Director: June 1983 to October 1990),"Carl V. Harris<br/>Regents of the University of California, Santa Barbara (Santa Barbara, CA 93106-0001)","Regents of the University of California, Santa Barbara",Santa Barbara,CA,93106-0001,USA,11/1/1983,1983,"The Black Community and Public Education in Birmingham, Alabama, 1871-1931",U.S. History,U.S. History,1,Fellowships for University Teachers,6,Research Programs,0,0,23433,0,23433,0,23433,0,6/15/1984 &ndash; 6/14/1985,<p>No project description available</p>,
139912,RX-20579-84,1,0,0,0,0,0,0,,Gerald,,Larson,,,,,,Gerald Larson (Project Director: June 1984 to October 1990),"Regents of the University of California, Santa Barbara (Santa Barbara, CA 93106-0001)<br/>Gerald Larson (Project Director: June 1984 to October 1990)</div>","Regents of the University of California, Santa Barbara",Santa Barbara,CA,93106-0001,USA,11/1/1984,1984,"Research Conference for Asian & Comparative Philosophy: Conf. Theme: ""Interpreting Across Boundaries""","Religion, General","Philosophy, General; Religion, General",68,Conferences,6,Research Programs,0,4000,4000,4000,0,4000,4000,0,7/1/1984 &ndash; 12/31/1984,<p>No project description available</p>,
137211,RE-20268-83,1,0,0,0,0,0,0,,Elizabeth,H.,Witherell,,,,,,Elizabeth H. Witherell (Project Director: October 1982 to October 1990),"Regents of the University of California, Santa Barbara (Santa Barbara, CA 93106-0001)<br/>Elizabeth H. Witherell (Project Director: October 1982 to October 1990)</div>","Regents of the University of California, Santa Barbara",Santa Barbara,CA,93106-0001,USA,5/1/1983,1983,The Writings of Henry D. Thoreau,American Literature,"American Literature; Political Science, General",47,Editions,6,Research Programs,0,42000,142827,75000,142827,42000,184827,0,7/1/1983 &ndash; 7/31/1985,<p>To support preparation of the edition of the writings of Henry D. Thoreau.</p>,
139834,RX-20352-83,1,0,0,0,0,0,0,,Birger,A.,Pearson,,,,,,Birger A. Pearson (Project Director: September 1982 to October 1990),"Regents of the University of California, Santa Barbara (Santa Barbara, CA 93106-0001)<br/>Birger A. Pearson (Project Director: September 1982 to October 1990)</div>","Regents of the University of California, Santa Barbara",Santa Barbara,CA,93106-0001,USA,2/1/1983,1983,Conference: The Roots of Egyptian Christianity,History of Religion,History of Religion,68,Conferences,6,Research Programs,0,1310,10000,10000,10000,1310,11310,0,4/1/1983 &ndash; 3/31/1984,<p>To support a conference as part of the groundwork for a collaborative research project on the history of Christianity in Egypt until the Arab conquest. Publication is planned.</p>,
137385,RH-20520-83,1,0,0,0,0,0,0,,Ernest DeAlton,,Partridge,,,,,,Ernest DeAlton Partridge (Project Director: April 1983 to October 1990),"Regents of the University of California, Santa Barbara (Santa Barbara, CA 93106-0001)<br/>Ernest DeAlton Partridge (Project Director: April 1983 to October 1990)</div>","Regents of the University of California, Santa Barbara",Santa Barbara,CA,93106-0001,USA,5/1/1983,1983,Ethical Issues in Earthquake Risk Assessment,"Interdisciplinary Studies, Other","Interdisciplinary Studies, Other",65,"Humanities, Science, and Technology",6,Research Programs,0,0,24000,0,24000,0,24000,0,7/1/1984 &ndash; 6/30/1986,<p>To support research on the moral inplications of earthquake prediction and long-range seismic risk analysis.</p>,
131880,FV-20091-83,1,0,0,0,0,0,0,,Walter,H.,Capps,,,,,,Walter H. Capps (Project Director: June 1983 to October 1990),"Regents of the University of California, Santa Barbara (Santa Barbara, CA 93106-0001)<br/>Walter H. Capps (Project Director: June 1983 to October 1990)</div>","Regents of the University of California, Santa Barbara",Santa Barbara,CA,93106-0001,USA,8/1/1983,1983,Tocqueville's DEMOCRACY IN AMERICA: Religion in a Democratic Society,"Religion, General","Philosophy, General; Religion, General",15,Seminars for K-12 Educators,7,Education Programs,0,0,54750,0,54750,0,54750,0,10/1/1983 &ndash; 9/30/1984,<p>No project description available</p>,
130872,FT-23759-83,2,0,0,0,0,0,0,,Peter,W.,Hylton,,,,,,Peter W. Hylton (Project Director: October 1982 to October 1990),"Peter W. Hylton<br/>Regents of the University of California, Santa Barbara (Santa Barbara, CA 93106-0001)","Regents of the University of California, Santa Barbara",Santa Barbara,CA,93106-0001,USA,2/1/1983,1983,Russell and the Origins of Analytic Philosophy,History of Philosophy,History of Philosophy,3,Summer Stipends,6,Research Programs,0,0,2700,0,2700,0,2700,0,5/1/1983 &ndash; 9/30/1983,<p>No project description available</p>,
129420,FS-20723-82,1,0,0,0,0,0,0,,Walter,H.,Capps,,,,,,Walter H. Capps (Project Director: July 1982 to October 1990),"Regents of the University of California, Santa Barbara (Santa Barbara, CA 93106-0001)<br/>Walter H. Capps (Project Director: July 1982 to October 1990)</div>","Regents of the University of California, Santa Barbara",Santa Barbara,CA,93106-0001,USA,7/1/1982,1982,Religion in a Democratic Society: Tocqueville's DEMOCRACY INAMERICA,"Religion, General","Religion, General",23,Seminars for Higher Education Faculty,7,Education Programs,0,0,50108,0,50108,0,50108,0,10/1/1982 &ndash; 10/31/1983,<p>No project description available</p>,
125291,ES-20558-82,1,0,0,0,0,0,0,,Willis,D.,Copeland,,,,,,Willis D. Copeland (Project Director: April 1982 to October 1990),"Regents of the University of California, Santa Barbara (Santa Barbara, CA 93106-0001)<br/>Willis D. Copeland (Project Director: April 1982 to October 1990)</div>","Regents of the University of California, Santa Barbara",Santa Barbara,CA,93106-0001,USA,7/1/1982,1982,Curriculum for Teaching Historical Processes and Skills,U.S. History,U.S. History,14,Institutes for K-12 Educators,7,Education Programs,80000,0,80000,0,73641,0,73641,0,9/1/1982 &ndash; 11/30/1984,<p>To support the development of a curriculum which utilizes work with computers to teach history and the skills of historical research.</p>,
125853,FA-21926-82,2,0,0,0,0,0,0,,Lester,P.,Monts,,,,,,Lester P. Monts (Project Director: June 1981 to October 1990),"Lester P. Monts<br/>Regents of the University of California, Santa Barbara (Santa Barbara, CA 93106-0001)","Regents of the University of California, Santa Barbara",Santa Barbara,CA,93106-0001,USA,11/1/1981,1981,Music Clusteral Relationships in a Liberian-Sierra Leonean Region,Music History and Criticism,Music History and Criticism,1,Fellowships for University Teachers,6,Research Programs,0,0,22000,0,22000,0,22000,0,7/1/1982 &ndash; 6/30/1983,<p>No project description available</p>,
125860,FA-21975-82,2,0,0,0,0,0,0,,Nelson,N.,Lichtenstein,,,,,,Nelson N. Lichtenstein (Project Director: June 1981 to October 1990),"Nelson N. Lichtenstein<br/>Regents of the University of California, Santa Barbara (Washington, DC 20064-0001)","Regents of the University of California, Santa Barbara",Washington,DC,20064-0001,USA,11/1/1981,1981,Life at the Ford Motor Company's River Rouge Plant,U.S. History,U.S. History,1,Fellowships for University Teachers,6,Research Programs,0,0,22000,0,22000,0,22000,0,7/1/1982 &ndash; 6/30/1983,<p>No project description available</p>,
139476,RT-20213-82,1,0,0,0,0,0,0,,C. Warren,,Hollister,,,,,,C. Warren Hollister (Project Director: June 1985 to October 1990),"Regents of the University of California, Santa Barbara (Santa Barbara, CA 93106-0001)<br/>C. Warren Hollister (Project Director: June 1985 to October 1990)</div>","Regents of the University of California, Santa Barbara",Santa Barbara,CA,93106-0001,USA,5/1/1982,1982,Domesday Book Database,"History, General","Geography; History, General",58,Reference Materials - Tools,1,Preservation and Access,0,14000,124858,14000,44858,14000,58858,0,7/1/1982 &ndash; 6/30/1987,"<p>To support the Greater Domesday Book Project, which is to put the entire corpus of this 1086 English land survey into machine-readable form.</p>",
135210,GP-20273-82,1,0,0,0,0,0,0,,William,R.,Reardon,,,,,,William R. Reardon (Project Director: December 1981 to October 1990),"Regents of the University of California, Santa Barbara (Santa Barbara, CA 93106-0001)<br/>William R. Reardon (Project Director: December 1981 to October 1990)</div>","Regents of the University of California, Santa Barbara",Santa Barbara,CA,93106-0001,USA,2/1/1982,1982,A Planning Grant for the Eugene O'Neill Centennial Observance of our Major Dramatists,American Literature,American Literature; Dance History and Criticism,9,Special Projects,2,Public Programs,0,0,10000,0,10000,0,10000,0,4/1/1982 &ndash; 6/30/1983,<p>To support planning for observance of the Eugene O'Neill Centennial.</p>,
138094,RO-*1247-81,1,0,0,0,0,0,0,,Peter,H.,Merkl,,,,,,Peter H. Merkl (Project Director: July 1981 to October 1990),"Regents of the University of California, Santa Barbara (Santa Barbara, CA 93106-0001)<br/>Peter H. Merkl (Project Director: July 1981 to October 1990)</div>","Regents of the University of California, Santa Barbara",Santa Barbara,CA,93106-0001,USA,11/1/1981,1981,Political Management of Economic Change in Postwar Japan andthe Federal Republic of Germany,European History,East Asian History; Economics; European History,40,Basic Research,6,Research Programs,0,30000,12000,30000,10918.03,30000,40918.03,0,8/1/1981 &ndash; 1/31/1983,"<p>To support a study of the role of government and politics in economic changes in Germany and Japan since World War II by an interdisciplinary team of 35 scholars from the U.S., Japan and Germany.</p>",
124043,ED-*1374-81,1,0,0,0,0,0,0,,G. Wesley,,Johnson,,,,,,G. Wesley Johnson (Project Director: June 1980 to October 1990),"Regents of the University of California, Santa Barbara (Santa Barbara, CA 93106-0001)<br/>G. Wesley Johnson (Project Director: June 1980 to October 1990)</div>","Regents of the University of California, Santa Barbara",Santa Barbara,CA,93106-0001,USA,11/1/1980,1980,Creating a New Curriculum in Public History,"History, General","Business; History, General; U.S. History",12,Education Development and Demonstration,7,Education Programs,0,0,259749,0,259749,0,259749,0,7/1/1981 &ndash; 12/31/1984,"<p>To support a proj. to strengthen grad. reading, lecture, and research course offerings in Public History (community and business history, hist. resources) and to create a new undergrad. emphasis with 11 faculty members develop. 14 newcourses. Funds also sponsored a conf. for 17 selected universities on practical</p>",
126893,FB-*1065-81,2,0,0,0,0,0,0,,Ellen,M.,McCracken,,,,,,Ellen M. McCracken (Project Director: June 1980 to October 1990),"Ellen M. McCracken<br/>Regents of the University of California, Santa Barbara (Amherst, MA 01003-9242)","Regents of the University of California, Santa Barbara",Amherst,MA,01003-9242,USA,11/1/1980,1980,Contemporary Women's Magazines: An Interdisciplinary Reading,Comparative Literature,Comparative Literature,2,Fellowships for College Teachers and Independent Scholars,6,Research Programs,0,0,22000,0,18835,0,18835,0,6/1/1981 &ndash; 5/31/1982,<p>No project description available</p>,
128620,FP-*0157-81,1,0,1,0,0,0,0,,Robert,L.,Kelley,,,,,,Robert L. Kelley (Project Director: November 1980 to October 1990),"Regents of the University of California, Santa Barbara (Santa Barbara, CA 93106-0001)<br/>Robert L. Kelley (Project Director: November 1980 to October 1990)</div>","Regents of the University of California, Santa Barbara",Santa Barbara,CA,93106-0001,USA,11/1/1980,1980,Conflicting Cultures in American Politics: An Historical Perspective,"History, General","History, General",158,Fellowships and Stipends for Professionals,9,Fellowships and Seminars,0,0,45000,0,38075.29,0,38075.29,0,12/1/1980 &ndash; 11/30/1981,<p>No project description available</p>,
128978,FS-*0041-81,1,0,0,0,0,0,0,,Walter,H.,Capps,,,,,,Walter H. Capps (Project Director: October 1980 to October 1990),"Regents of the University of California, Santa Barbara (Santa Barbara, CA 93106-0001)<br/>Walter H. Capps (Project Director: October 1980 to October 1990)</div>","Regents of the University of California, Santa Barbara",Santa Barbara,CA,93106-0001,USA,11/1/1980,1980,Religious Studies--Presuppositions of the Methodological In-quiry,"Religion, General","Religion, General",23,Seminars for Higher Education Faculty,7,Education Programs,0,0,70000,0,48608.87,0,48608.87,0,1/1/1981 &ndash; 12/31/1981,<p>No project description available</p>,
130279,FT-*1098-81,2,0,1,0,0,0,0,,Tsuyoshi,,Hasegawa,,,,,,Tsuyoshi Hasegawa (Project Director: October 1980 to October 1990),"Tsuyoshi Hasegawa<br/>Regents of the University of California, Santa Barbara (Oswego, NY 13126-3501)","Regents of the University of California, Santa Barbara",Oswego,NY,13126-3501,USA,2/1/1981,1981,"Crime and Society: Petrograd, 1917",Russian History,Russian History,3,Summer Stipends,6,Research Programs,0,0,2500,0,2500,0,2500,0,5/1/1981 &ndash; 9/30/1981,<p>No project description available</p>,
130352,FT-*1232-81,2,0,0,0,0,0,0,,Fikret,K.,Yegul,,,,,,Fikret K. Yegul (Project Director: October 1980 to October 1990),"Fikret K. Yegul<br/>Regents of the University of California, Santa Barbara (Santa Barbara, CA 93106-0001)","Regents of the University of California, Santa Barbara",Santa Barbara,CA,93106-0001,USA,2/1/1981,1981,Bathing and Baths in Classical Antiquity,Archaeology,"Archaeology; Architecture; Arts, General",3,Summer Stipends,6,Research Programs,0,0,2500,0,2500,0,2500,0,5/1/1981 &ndash; 9/30/1981,<p>No project description available</p>,
130390,FT-*1335-81,2,0,0,0,0,0,0,,Alfred,,Gollin,,,,,,Alfred Gollin (Project Director: October 1980 to October 1990),"Alfred Gollin<br/>Regents of the University of California, Santa Barbara (Santa Barbara, CA 93106-0001)","Regents of the University of California, Santa Barbara",Santa Barbara,CA,93106-0001,USA,2/1/1981,1981,The Battle of Britain,British History,British History,3,Summer Stipends,6,Research Programs,0,0,2500,0,2500,0,2500,0,5/1/1981 &ndash; 9/30/1981,<p>No project description available</p>,
129994,FT-*0673-80,2,0,0,0,0,0,0,,Cynthia,Jane,Brown,,,,,,Cynthia Jane Brown (Project Director: October 1979 to October 1990),"Cynthia Jane Brown<br/>Regents of the University of California, Santa Barbara (Santa Barbara, CA 93106-0001)","Regents of the University of California, Santa Barbara",Santa Barbara,CA,93106-0001,USA,2/1/1980,1980,Evolution and Merging of Political and Poetic Languages in the Work of the Rhetoriqueurs,French Literature,French Literature,3,Summer Stipends,6,Research Programs,0,0,2500,0,2500,0,2500,0,5/1/1980 &ndash; 9/30/1980,<p>No project description available</p>,
128656,FP-*0341-80,1,0,0,0,0,0,0,,Otis,L.,Graham,,,,,,Otis L. Graham (Project Director: November 1979 to October 1990),"Regents of the University of California, Santa Barbara (Santa Barbara, CA 93106-0001)<br/>Otis L. Graham (Project Director: November 1979 to October 1990)</div>","Regents of the University of California, Santa Barbara",Santa Barbara,CA,93106-0001,USA,11/1/1979,1979,The American Political Economy: Crisis and New Directions,"History, General","History, General; Political Science, General",158,Fellowships and Stipends for Professionals,9,Fellowships and Seminars,0,0,36818,0,35212.96,0,35212.96,0,1/1/1980 &ndash; 9/30/1980,<p>No project description available</p>,
125575,FA-*0084-80,2,0,0,0,0,0,0,,Patrick,J.,McCarthy,,,,,,Patrick J. McCarthy (Project Director: September 1979 to October 1990),"Patrick J. McCarthy<br/>Regents of the University of California, Santa Barbara (Santa Barbara, CA 93106-0001)","Regents of the University of California, Santa Barbara",Santa Barbara,CA,93106-0001,USA,2/1/1980,1979,The Transforming Language of Charles Dickens,British Literature,British Literature,1,Fellowships for University Teachers,6,Research Programs,0,0,20000,0,20000,0,20000,0,7/1/1980 &ndash; 6/30/1981,<p>No project description available</p>,
139618,RX-*0225-80,1,0,0,0,0,0,0,,Anne,G.,Cushing,,,,,,Anne G. Cushing (Project Director: August 1979 to October 1990),"Regents of the University of California, Santa Barbara (Santa Barbara, CA 93106-0001)<br/>Anne G. Cushing (Project Director: August 1979 to October 1990)</div>","Regents of the University of California, Santa Barbara",Santa Barbara,CA,93106-0001,USA,11/1/1979,1979,Apollinaire after 100 Years,"Literature, General","Literature, General",68,Conferences,6,Research Programs,0,0,10000,0,8894.21,0,8894.21,0,1/1/1980 &ndash; 12/31/1980,"<p>To support a 3-day colloquium to celebrate the centennial of the poet GuillaumeAppollinaire's birth in 1800, with participants from both the U.S. and Europe.</p>",
137622,RL-*1168-80,1,0,0,0,0,0,0,,Chi-yun,,Chen,,,,,,Chi-yun Chen (Project Director: November 1979 to October 1990),"Regents of the University of California, Santa Barbara (Santa Barbara, CA 93106-0001)<br/>Chi-yun Chen (Project Director: November 1979 to October 1990)</div>","Regents of the University of California, Santa Barbara",Santa Barbara,CA,93106-0001,USA,2/1/1980,1980,"Translation of the ""T'ai-p'ing ching""","Religion, General","Religion, General",36,Translations,6,Research Programs,0,0,40000,0,39918.82,0,39918.82,0,7/1/1980 &ndash; 9/30/1984,"<p>To support an annotated translation of the ""T'ai-p'ing ching, (Scripture of Great Equilibrium)"", one of the seven primary scriptures in the Taoist canon.</p>",
137631,RL-*1194-80,1,0,0,0,0,0,0,,John,P.,Sullivan,,,,,,John P. Sullivan (Project Director: February 1980 to October 1990),"Regents of the University of California, Santa Barbara (Santa Barbara, CA 93106-0001)<br/>John P. Sullivan (Project Director: February 1980 to October 1990)</div>","Regents of the University of California, Santa Barbara",Santa Barbara,CA,93106-0001,USA,2/1/1980,1980,Epigrams of Martial Trans by Diverse Hands,"Literature, General","Literature, General",36,Translations,6,Research Programs,0,0,6000,0,5477.58,0,5477.58,0,6/1/1980 &ndash; 5/31/1981,"<p>To support the first complete English verse translation of the classical Roman poet, Martial. The work will provide versions of the poems drawn from many partial translations from the 15th-20th century. An introduction and notes will be included.</p>",
135064,GP-*1018-80,1,0,0,0,0,0,0,,Homer,,Swander,,,,,,Homer Swander (Project Director: November 1979 to October 1990),"Regents of the University of California, Santa Barbara (Santa Barbara, CA 93106-0001)<br/>Homer Swander (Project Director: November 1979 to October 1990)</div>","Regents of the University of California, Santa Barbara",Santa Barbara,CA,93106-0001,USA,4/1/1980,1980,CREATING AUDIENCES: A Discipline for the Humanities,"Literature, General","Literature, General",9,Special Projects,2,Public Programs,0,0,123451,0,123445.32,0,123445.32,0,3/1/1980 &ndash; 7/31/1981,<p>To support one-week residencies of specially prepared classical actors on several college campuses. The actors will teach dramatic literature and perform in Shakespearean programs in conjunction with the Folger Shakespeare Library's traveling exhibition.</p>,
134955,GP-*0061-79,1,0,0,0,0,0,0,,Wesley,G.,Johnson,,,,,,Wesley G. Johnson (Project Director: August 1978 to October 1990),"Regents of the University of California, Santa Barbara (Santa Barbara, CA 93106-0001)<br/>Wesley G. Johnson (Project Director: August 1978 to October 1990)</div>","Regents of the University of California, Santa Barbara",Santa Barbara,CA,93106-0001,USA,11/1/1978,1978,Getting History into the Community for Cultural Enrichment &Problem Solving,"Interdisciplinary Studies, General",,9,Special Projects,2,Public Programs,0,0,68971,0,68891.2,0,68891.2,0,1/1/1979 &ndash; 1/31/1981,<p>To continue a program for involving historians in community cultural enrichment and problem solving.</p>,
128608,FP-*0053-79,1,0,0,0,0,0,0,,O. L.,,Graham,,,,,,O. L. Graham (Project Director: August 1978 to October 1990),"Regents of the University of California, Santa Barbara (Santa Barbara, CA 93106-0001)<br/>O. L. Graham (Project Director: August 1978 to October 1990)</div>","Regents of the University of California, Santa Barbara",Santa Barbara,CA,93106-0001,USA,11/1/1978,1978,"Seminar: ""Public Policy and the American Political Economy:Crisis & New Directions""","Interdisciplinary Studies, General",,158,Fellowships and Stipends for Professionals,9,Fellowships and Seminars,0,0,34120,0,34061.74,0,34061.74,0,12/1/1978 &ndash; 3/31/1980,<p>No project description available</p>,
129201,FS-*0148-79,1,0,0,0,0,0,0,,Gordon,E.,Baker,,,,,,Gordon E. Baker (Project Director: August 1978 to October 1990),"Regents of the University of California, Santa Barbara (Santa Barbara, CA 93106-0001)<br/>Gordon E. Baker (Project Director: August 1978 to October 1990)</div>","Regents of the University of California, Santa Barbara",Santa Barbara,CA,93106-0001,USA,11/1/1978,1978,"Seminar: ""The Challenge of Direct Democracy to Representa- tive Government""","Interdisciplinary Studies, General",,23,Seminars for Higher Education Faculty,7,Education Programs,0,0,44667.77,0,44667.77,0,44667.77,0,1/1/1979 &ndash; 12/31/1979,<p>No project description available</p>,
129291,FS-*1218-79,1,0,0,0,0,0,0,,Gordon,E.,Baker,,,,,,Gordon E. Baker (Project Director: May 1979 to October 1990),"Regents of the University of California, Santa Barbara (Santa Barbara, CA 93106-0001)<br/>Gordon E. Baker (Project Director: May 1979 to October 1990)</div>","Regents of the University of California, Santa Barbara",Santa Barbara,CA,93106-0001,USA,8/1/1979,1979,Reapportionment in the 1980s and the 1980's & Quest for FairRepresentation,"Social Sciences, General","Social Sciences, General",23,Seminars for Higher Education Faculty,7,Education Programs,0,0,45446,0,45446,0,45446,0,1/1/1980 &ndash; 1/30/1981,<p>No project description available</p>,
