ApplicationID,ApplicationNumber,ApplicantType,SuppCount,ProductCount,CoverageCount,PrizeCount,ParticipatingInstitutionCount,WhitePaper,WhitePaperPath,PDFirstname,PDMiddlename,PDLastname,PDNameSuffix,CoPDFirstname,CoPDMiddlename,CoPDLastname,CoPDNameSuffix,Participants,GranteeDisplay,Institution,InstCity,InstState,InstPostalCode,InstCountry,CouncilDate,YearAwarded,ProjectTitle,PrimaryDiscipline,AllDisciplines,ProgramID,ProgramName,DivisionID,DivisionName,OfferedOutright,OfferedMatching,ApprovedOutright,ApprovedMatching,AwardOutright,AwardMatching,OriginalAmount,SupplementAmount,GrantPeriod,ProjectDesc,ToSupport
161638,RZ-20133-97,1,0,0,0,0,0,0,,Elizabeth,H.,Witherell,,,,,,Elizabeth H. Witherell (Project Director: September 1996 to September 2000),"Regents of the University of California, Santa Barbara (Santa Barbara, CA 93106-0001)<br/>Elizabeth H. Witherell (Project Director: September 1996 to September 2000)</div>","Regents of the University of California, Santa Barbara",Santa Barbara,CA,93106-0001,USA,3/1/1997,1997,The Writings of Henry D. Thoreau,American Literature,American Literature,5,Collaborative Research,6,Research Programs,50000,36000,50000,36000,50000,32765.87,82765.87,0,7/1/1997 &ndash; 6/30/1999,"<p>To support the continuing preparation of an edition of the writings of Henry David Thoreau (1817-62), American writer, naturalist, and social commentator.</p>",
141837,ED-20822-97,1,0,0,0,0,0,0,,Alan,Y.,Liu,,,,,,Alan Y. Liu (Project Director: October 1997 to February 2003),"Regents of the University of California, Santa Barbara (Santa Barbara, CA 93106-0001)<br/>Alan Y. Liu (Project Director: October 1997 to February 2003)</div>","Regents of the University of California, Santa Barbara",Santa Barbara,CA,93106-0001,USA,3/1/1997,1997,TRANSCRIPTIONS: Literature and the Culture of Information Project,Literary Criticism,Literary Criticism,12,Education Development and Demonstration,7,Education Programs,30000,15000,30000,15000,30000,15000,45000,0,8/1/1998 &ndash; 6/30/2002,<p>To support a curricular development project that will exploit information technology as the conceptual and practical bridge between teaching the humanities and teaching about the culture of information.</p>,
144902,FA-34144-96,2,0,0,0,0,0,0,,Almeida,J.,Toribio,,,,,,Almeida J. Toribio (Project Director: May 1995 to December 1997),"Almeida J. Toribio<br/>Regents of the University of California, Santa Barbara (Santa Barbara, CA 93106-0001)","Regents of the University of California, Santa Barbara",Santa Barbara,CA,93106-0001,USA,11/1/1995,1996,Bilingual Code-Switching: The Rule-Governed Alternation of Languages,Linguistics,Linguistics,1,Fellowships for University Teachers,6,Research Programs,0,0,30000,0,30000,0,30000,0,7/1/1996 &ndash; 6/30/1997,<p>No project description available</p>,
144739,FA-33087-95,2,0,0,0,0,0,0,,Alan,Y.,Liu,,,,,,Alan Y. Liu (Project Director: May 1994 to October 1996),"Alan Y. Liu<br/>Regents of the University of California, Santa Barbara (Santa Barbara, CA 93106-0001)","Regents of the University of California, Santa Barbara",Santa Barbara,CA,93106-0001,USA,11/1/1994,1995,The New Literary History,Literary Criticism,Literary Criticism,1,Fellowships for University Teachers,6,Research Programs,0,0,30000,0,30000,0,30000,0,7/1/1995 &ndash; 6/30/1996,<p>No project description available</p>,
144769,FA-33298-95,2,0,0,0,0,0,0,,Suzanne,J.,Levine,,,,,,Suzanne J. Levine (Project Director: May 1994 to November 1996),"Suzanne J. Levine<br/>Regents of the University of California, Santa Barbara (Santa Barbara, CA 93106-0001)","Regents of the University of California, Santa Barbara",Santa Barbara,CA,93106-0001,USA,11/1/1994,1995,A Biography of Manuel Puig,Latin American Literature,Latin American Literature,1,Fellowships for University Teachers,6,Research Programs,0,0,30000,0,30000,0,30000,0,7/1/1995 &ndash; 6/30/1996,<p>No project description available</p>,
147201,FD-22822-95,2,0,0,0,0,0,0,,Elizabeth,,Digeser,,,,,,Elizabeth Digeser (Project Director: December 1994 to September 1996),"Elizabeth  Digeser<br/>Regents of the University of California, Santa Barbara (Santa Barbara, CA 93106-0001)","Regents of the University of California, Santa Barbara",Santa Barbara,CA,93106-0001,USA,5/1/1995,1995,The Influence of Lactantius' DIVINE INSTITUTES on the Political and Religious Policy of Constantine the Great,Ancient History,Ancient History,46,Dissertation Grants,9,Fellowships and Seminars,0,0,14000,0,14000,0,14000,0,7/1/1995 &ndash; 6/30/1996,<p>No project description available</p>,
159658,RE-21296-95,1,0,0,0,0,0,0,,Elizabeth,H.,Witherell,,,,,,Elizabeth H. Witherell (Project Director: June 1994 to April 1998),"Regents of the University of California, Santa Barbara (Santa Barbara, CA 93106-0001)<br/>Elizabeth H. Witherell (Project Director: June 1994 to April 1998)</div>","Regents of the University of California, Santa Barbara",Santa Barbara,CA,93106-0001,USA,2/1/1995,1995,The Writings of Henry D. Thoreau,American Literature,American Literature,47,Editions,6,Research Programs,0,30000,120000,30000,120000,6499.51,126499.51,0,7/1/1995 &ndash; 6/30/1997,<p>To support the preparation of an edition of the writings of Henry D. Thoreau.</p>,
153121,FT-40515-95,2,0,0,0,0,0,0,,Francis,,Dunn,,,,,,Francis Dunn (Project Director: October 1994 to February 1996),"Francis Dunn<br/>Regents of the University of California, Santa Barbara (Santa Barbara, CA 93106-0001)","Regents of the University of California, Santa Barbara",Santa Barbara,CA,93106-0001,USA,2/1/1995,1995,Temporal Narratives in Late Fifth-Century Athens,Classics,Classics,3,Summer Stipends,6,Research Programs,0,0,4000,0,4000,0,4000,0,5/1/1995 &ndash; 9/30/1995,<p>No project description available</p>,
153098,FT-40341-94,2,0,0,0,0,0,0,,Janet,,Afary,,,,,,Janet Afary (Project Director: October 1993 to September 1994),"Janet Afary<br/>Regents of the University of California, Santa Barbara (West Lafayette, IN 47907-2040)","Regents of the University of California, Santa Barbara",West Lafayette,IN,47907-2040,USA,2/1/1994,1994,"Political Culture and the Emergence of Democracy in Iran, 1906-11",Near and Middle Eastern History,Near and Middle Eastern History,3,Summer Stipends,6,Research Programs,0,0,4750,0,4750,0,4750,0,5/1/1994 &ndash; 9/30/1994,<p>No project description available</p>,
154538,FV-21819-94,1,0,0,0,0,0,0,,Walter,H.,Capps,,,,,,Walter H. Capps (Project Director: April 1994 to May 1996),"Regents of the University of California, Santa Barbara (Santa Barbara, CA 93106-0001)<br/>Walter H. Capps (Project Director: April 1994 to May 1996)</div>","Regents of the University of California, Santa Barbara",Santa Barbara,CA,93106-0001,USA,8/1/1994,1994,"Alexis de Tocqueville, DEMOCRACY IN AMERICA: Religion in a Democratic Society","Religion, General","Religion, General",15,Seminars for K-12 Educators,7,Education Programs,0,0,84353,0,82830.88,0,82830.88,0,10/1/1994 &ndash; 9/30/1995,<p>No project description available</p>,
160255,RL-22155-94,1,0,0,0,0,0,0,,Ronald,,Egan,,,,,,Ronald Egan (Project Director: June 1993 to April 1996),"Regents of the University of California, Santa Barbara (Santa Barbara, CA 93106-0001)<br/>Ronald Egan (Project Director: June 1993 to April 1996)</div>","Regents of the University of California, Santa Barbara",Santa Barbara,CA,93106-0001,USA,2/1/1994,1994,Chinese Thought and Aesthetics,Asian Studies,Asian Studies,36,Translations,6,Research Programs,45000,0,44995,0,44993.8,0,44993.8,0,7/1/1994 &ndash; 6/30/1995,"<p>To support a selective translation of Qian Zhongshu's TUNNEL VIEWS, a collection of contemporary essays on Chinese thought, literature, and the arts.</p>",
160259,RL-22167-94,1,0,0,0,0,0,0,,Dwight,F.,Reynolds,,,,,,Dwight F. Reynolds (Project Director: June 1993 to April 1996),"Regents of the University of California, Santa Barbara (Santa Barbara, CA 93106-0001)<br/>Dwight F. Reynolds (Project Director: June 1993 to April 1996)</div>","Regents of the University of California, Santa Barbara",Santa Barbara,CA,93106-0001,USA,2/1/1994,1994,An Arabic Oral Epic,Near and Middle Eastern Literature,Near and Middle Eastern Literature,36,Translations,6,Research Programs,45000,0,45000,0,44977.49,0,44977.49,0,7/1/1994 &ndash; 6/30/1995,"<p>To support the translation of a northern Egyptian version of an Arabic oral epic poem, the SIRAT BANI HILAL, which narrates the migration, conquest, and defeat of a Bedouin tribe in the Arabian peninsula and North Africa.</p>",
151502,FS-22836-94,1,0,0,0,0,0,0,,David,Peter,Rock,,,,,,David Peter Rock (Project Director: March 1994 to February 1996),"Regents of the University of California, Santa Barbara (Santa Barbara, CA 93106-0001)<br/>David Peter Rock (Project Director: March 1994 to February 1996)</div>","Regents of the University of California, Santa Barbara",Santa Barbara,CA,93106-0001,USA,8/1/1994,1994,"Economic Development and Democratization in Argentina and Latin America, 1890 to the Present",Latin American History,Latin American History,23,Seminars for Higher Education Faculty,7,Education Programs,0,0,79059,0,79032.05,0,79032.05,0,10/1/1994 &ndash; 9/30/1995,<p>No project description available</p>,
144669,FA-32549-94,2,0,0,0,0,0,0,,Carol,L.,Lansing,,,,,,Carol L. Lansing (Project Director: May 1993 to November 2011),"Carol L. Lansing<br/>Regents of the University of California, Santa Barbara (Gainesville, FL 32611-0001)","Regents of the University of California, Santa Barbara",Gainesville,FL,32611-0001,USA,11/1/1993,1994,The Popolo Minuto in 13th-Century Bologna,European History,European History,1,Fellowships for University Teachers,6,Research Programs,0,0,30000,0,30000,0,30000,0,9/1/1994 &ndash; 8/31/1995,<p>No project description available</p>,
151401,FS-22532-93,1,0,0,0,0,0,0,,Everett,L.,Zimmerman,,,,,,Everett L. Zimmerman (Project Director: March 1992 to March 1994),"Regents of the University of California, Santa Barbara (Santa Barbara, CA 93106-0001)<br/>Everett L. Zimmerman (Project Director: March 1992 to March 1994)</div>","Regents of the University of California, Santa Barbara",Santa Barbara,CA,93106-0001,USA,8/1/1992,1992,Eighteenth-Century Historiography and Fiction,British Literature,British Literature,23,Seminars for Higher Education Faculty,7,Education Programs,0,0,77919,0,77919,0,77919,0,10/1/1992 &ndash; 9/30/1993,<p>No project description available</p>,
151402,FS-22535-93,1,0,0,0,0,0,0,,Jeffrey Burton,,Russell,,,,,,Jeffrey Burton Russell (Project Director: March 1992 to March 1994),"Regents of the University of California, Santa Barbara (Santa Barbara, CA 93106-0001)<br/>Jeffrey Burton Russell (Project Director: March 1992 to March 1994)</div>","Regents of the University of California, Santa Barbara",Santa Barbara,CA,93106-0001,USA,8/1/1992,1992,Late Antique and Medieval Conceptions of Heaven,"Interdisciplinary Studies, General","Interdisciplinary Studies, General",23,Seminars for Higher Education Faculty,7,Education Programs,0,0,76803,0,75117.28,0,75117.28,0,10/1/1992 &ndash; 9/30/1993,<p>No project description available</p>,
151422,FS-22607-93,1,0,0,0,0,0,0,,Giles,B.,Gunn,,,,,,Giles B. Gunn (Project Director: March 1993 to March 1995),"Regents of the University of California, Santa Barbara (Santa Barbara, CA 93106-0001)<br/>Giles B. Gunn (Project Director: March 1993 to March 1995)</div>","Regents of the University of California, Santa Barbara",Santa Barbara,CA,93106-0001,USA,8/1/1993,1993,Pragmatism and Cultural Criticism,American Studies,American Studies,23,Seminars for Higher Education Faculty,7,Education Programs,0,0,86667,0,83767.1,0,83767.1,0,10/1/1993 &ndash; 9/30/1994,<p>No project description available</p>,
149287,FE-27764-93,2,0,0,0,0,0,0,,W. Davies,0.,King,,,,,,W. Davies 0. King (Project Director: July 1992 to September 1993),"W. Davies 0. King<br/>Regents of the University of California, Santa Barbara (Santa Barbara, CA 93106-0001)","Regents of the University of California, Santa Barbara",Santa Barbara,CA,93106-0001,USA,11/1/1992,1992,Literary Career of Agnes Boulton,American Literature,American Literature,70,"Travel to Collections, 11/85 - 2/95",9,Fellowships and Seminars,0,0,750,0,750,0,750,0,12/1/1992 &ndash; 11/30/1993,<p>No project description available</p>,
150905,FJ-21096-93,2,0,0,0,0,0,0,,Maria,O.,Marotti,,,,,,Maria O. Marotti (Project Director: August 1992 to December 1993),"Maria O. Marotti<br/>Regents of the University of California, Santa Barbara (Santa Barbara, CA 93106-0001)","Regents of the University of California, Santa Barbara",Santa Barbara,CA,93106-0001,USA,2/1/1993,1993,Italian Feminism,Italian Language,Italian Language,57,Study Grants for College Teachers,9,Fellowships and Seminars,0,0,3000,0,3000,0,3000,0,8/1/1993 &ndash; 9/30/1993,<p>No project description available</p>,
146172,FB-30257-93,2,0,0,0,0,0,0,,Paul,,Spickard,,,,,,Paul Spickard (Project Director: June 1992 to April 1994),"Paul Spickard<br/>Regents of the University of California, Santa Barbara (Laie, HI 96762)","Regents of the University of California, Santa Barbara",Laie,HI,96762,USA,11/1/1992,1993,"Black Los Angeles: The Worlds of African-American Migrants, 1930-55",African American Studies,African American Studies,2,Fellowships for College Teachers and Independent Scholars,6,Research Programs,0,0,30000,0,4750,0,4750,0,1/1/1993 &ndash; 8/31/1993,<p>No project description available</p>,
159949,RK-20030-93,1,0,0,0,0,0,0,,Frederick,J.,Bove,,,,,,Frederick J. Bove (Project Director: October 1992 to January 1995),"Regents of the University of California, Santa Barbara (Santa Barbara, CA 93106-0001)<br/>Frederick J. Bove (Project Director: October 1992 to January 1995)</div>","Regents of the University of California, Santa Barbara",Santa Barbara,CA,93106-0001,USA,2/1/1993,1993,State Evolution on the Pacific Coast of Guatemala,Archaeology,Archaeology,73,Archaeology Projects,6,Research Programs,15000,0,15000,0,15000,0,15000,0,5/1/1993 &ndash; 4/30/1994,"<p>To support analysis of materials from Mesoamerican sites on the Pacific Coast of Guatemala that will result in publications of the excavation and survey, an interpretive volume, and a new ceramic chronology for the region.</p>",
159566,RE-21096-93,1,0,0,0,0,0,0,,Elizabeth,H.,Witherell,,,,,,Elizabeth H. Witherell (Project Director: June 1992 to February 1996),"Regents of the University of California, Santa Barbara (Santa Barbara, CA 93106-0001)<br/>Elizabeth H. Witherell (Project Director: June 1992 to February 1996)</div>","Regents of the University of California, Santa Barbara",Santa Barbara,CA,93106-0001,USA,2/1/1993,1993,The Writings of Henry D. Thoreau,American Literature,American Literature,47,Editions,6,Research Programs,120000,23000,120000,23000,120000,7329.36,127329.36,0,7/1/1993 &ndash; 6/30/1995,<p>To support the preparation of an edition of the works of Henry David Thoreau.</p>,
152854,FT-38451-93,2,0,0,0,0,0,0,,Amy,K.,Stillman,,,,,,Amy K. Stillman (Project Director: October 1992 to September 1993),"Amy K. Stillman<br/>Regents of the University of California, Santa Barbara (Santa Barbara, CA 93106-0001)","Regents of the University of California, Santa Barbara",Santa Barbara,CA,93106-0001,USA,2/1/1993,1993,The HULA KU'I: A Tradition in Hawaiian Music and Dance,Music History and Criticism,Music History and Criticism,3,Summer Stipends,6,Research Programs,0,0,4750,0,4750,0,4750,0,5/1/1993 &ndash; 9/30/1993,<p>No project description available</p>,
154435,FV-21597-92,1,0,0,0,0,0,0,,Walter,H.,Capps,,,,,,Walter H. Capps (Project Director: April 1992 to April 1994),"Regents of the University of California, Santa Barbara (Santa Barbara, CA 93106-0001)<br/>Walter H. Capps (Project Director: April 1992 to April 1994)</div>","Regents of the University of California, Santa Barbara",Santa Barbara,CA,93106-0001,USA,8/1/1992,1992,"Alexis de Tocqueville, DEMOCRACY IN AMERICA: Religion in a Democratic Society","Religion, General","Religion, General",15,Seminars for K-12 Educators,7,Education Programs,0,0,86779,0,79894.04,0,79894.04,0,10/1/1992 &ndash; 9/30/1993,<p>No project description available</p>,
160601,RO-22490-92,1,0,0,0,0,0,0,,David,Peter,Rock,,,,,,David Peter Rock (Project Director: October 1991 to April 1998),"Regents of the University of California, Santa Barbara (Santa Barbara, CA 93106-0001)<br/>David Peter Rock (Project Director: October 1991 to April 1998)</div>","Regents of the University of California, Santa Barbara",Santa Barbara,CA,93106-0001,USA,5/1/1992,1992,"Government, Politics and Society in the Rio de la Plata Republics: Argentina and Uruguay 1870-1914",Latin American History,Latin American History,40,Basic Research,6,Research Programs,0,16705,122800,16705,122799.51,0,122799.51,0,8/1/1992 &ndash; 9/30/1997,"<p>To support a study of the emergence of democracy in two contrasting Latin American countries, Argentina and Uruguay, 1870-1914.</p>",
161355,RT-21433-92,1,0,0,0,0,0,0,,Sandra,A.,Thompson,,,,,,Sandra A. Thompson (Project Director: October 1991 to March 1997),"Regents of the University of California, Santa Barbara (Santa Barbara, CA 93106-0001)<br/>Sandra A. Thompson (Project Director: October 1991 to March 1997)</div>","Regents of the University of California, Santa Barbara",Santa Barbara,CA,93106-0001,USA,5/1/1992,1992,Corpus of Spoken American English,Linguistics,Linguistics,58,Reference Materials - Tools,1,Preservation and Access,0,10000,303734,10000,203734,7820.48,211554.48,0,7/1/1992 &ndash; 6/30/1996,"<p>To support preparation of a one-million-word computerized database of spoken American English that will include transcriptions and recordings of converstions, lectures, and sermons from across the country.</p>",
149088,FE-27143-92,2,0,0,0,0,0,0,,Mary,Isobel,O'Connor,,,,,,Mary Isobel O'Connor (Project Director: January 1992 to August 1993),"Mary Isobel O'Connor<br/>Regents of the University of California, Santa Barbara (Santa Barbara, CA 93106-0001)","Regents of the University of California, Santa Barbara",Santa Barbara,CA,93106-0001,USA,5/1/1992,1992,"The Pilgrimage to Magdalena, Sonora, Mexico",Anthropology,Anthropology,70,"Travel to Collections, 11/85 - 2/95",9,Fellowships and Seminars,0,0,750,0,750,0,750,0,6/1/1992 &ndash; 5/31/1993,<p>No project description available</p>,
144388,FA-30661-92,2,0,0,0,0,0,0,,Joshua,Andrew,Fogel,,,,,,Joshua Andrew Fogel (Project Director: June 1991 to October 1993),"Joshua Andrew Fogel<br/>Regents of the University of California, Santa Barbara (Santa Barbara, CA 93106-0001)","Regents of the University of California, Santa Barbara",Santa Barbara,CA,93106-0001,USA,11/1/1991,1992,"The Literature of Travel in the Japanese Rediscovery of China, 1862-1945",East Asian History,East Asian History,1,Fellowships for University Teachers,6,Research Programs,0,0,30000,0,30000,0,30000,0,7/1/1992 &ndash; 6/30/1993,<p>No project description available</p>,
144393,FA-30690-92,2,0,0,0,0,0,0,,Sucheng,,Chan,,,,,,Sucheng Chan (Project Director: June 1991 to September 1992),"Sucheng Chan<br/>Regents of the University of California, Santa Barbara (Santa Barbara, CA 93106-0001)","Regents of the University of California, Santa Barbara",Santa Barbara,CA,93106-0001,USA,11/1/1991,1991,The Anti-Chinese Movement after 1882,Asian American Studies,Asian American Studies,1,Fellowships for University Teachers,6,Research Programs,0,0,30000,0,30000,0,30000,0,1/1/1992 &ndash; 8/31/1992,<p>No project description available</p>,
144340,FA-30344-91,2,0,1,0,0,0,0,,Christopher,A.,McMahon,,,,,,Christopher A. McMahon (Project Director: June 1990 to October 1992),"Christopher A. McMahon<br/>Regents of the University of California, Santa Barbara (Santa Barbara, CA 93106-0001)","Regents of the University of California, Santa Barbara",Santa Barbara,CA,93106-0001,USA,11/1/1990,1991,The Nature and Justification of Managerial Authority,Ethics,Ethics,1,Fellowships for University Teachers,6,Research Programs,0,0,30000,0,30000,0,30000,0,7/1/1991 &ndash; 6/30/1992,<p>No project description available</p>,
148698,FE-25905-91,2,0,0,0,0,0,0,,Harvey,L.,Sharrer,,,,,,Harvey L. Sharrer (Project Director: January 1991 to April 1992),"Harvey L. Sharrer<br/>Regents of the University of California, Santa Barbara (Santa Barbara, CA 93106-0001)","Regents of the University of California, Santa Barbara",Santa Barbara,CA,93106-0001,USA,5/1/1991,1991,Bibliography of Old Portuguese Texts: Torre do Tombo Holdings,"Literature, General","Literature, General",70,"Travel to Collections, 11/85 - 2/95",9,Fellowships and Seminars,0,0,750,0,750,0,750,0,6/1/1991 &ndash; 5/31/1992,<p>No project description available</p>,
148844,FE-26344-91,2,0,0,0,0,0,0,,Paul,,Spickard,,,,,,Paul Spickard (Project Director: January 1991 to September 1991),"Paul Spickard<br/>Regents of the University of California, Santa Barbara (Santa Barbara, CA 93106-0001)","Regents of the University of California, Santa Barbara",Santa Barbara,CA,93106-0001,USA,5/1/1991,1991,"Black Los Angeles, 1930-1955",African American Studies,African American Studies,70,"Travel to Collections, 11/85 - 2/95",9,Fellowships and Seminars,0,0,750,0,750,0,750,0,6/1/1991 &ndash; 5/31/1992,<p>No project description available</p>,
151278,FS-22213-91,1,0,0,0,0,0,0,,Jeffrey Burton,,Russell,,,,,,Jeffrey Burton Russell (Project Director: March 1990 to February 1992),"Regents of the University of California, Santa Barbara (Santa Barbara, CA 93106-0001)<br/>Jeffrey Burton Russell (Project Director: March 1990 to February 1992)</div>","Regents of the University of California, Santa Barbara",Santa Barbara,CA,93106-0001,USA,8/1/1990,1990,Intellectual and Social Dimensions of Medieval Religious Dissent,Medieval Studies,Medieval Studies,23,Seminars for Higher Education Faculty,7,Education Programs,0,0,90330,0,90326.6,0,90326.6,0,10/1/1990 &ndash; 9/30/1991,<p>No project description available</p>,
151315,FS-22300-91,1,0,0,0,0,0,0,,David,Peter,Rock,,,,,,David Peter Rock (Project Director: March 1990 to February 1992),"Regents of the University of California, Santa Barbara (Santa Barbara, CA 93106-0001)<br/>David Peter Rock (Project Director: March 1990 to February 1992)</div>","Regents of the University of California, Santa Barbara",Santa Barbara,CA,93106-0001,USA,8/1/1990,1990,"Economic Development and Democratization in Argentina and Latin America, 1890 to the Present",Latin American History,Latin American History,23,Seminars for Higher Education Faculty,7,Education Programs,0,0,78890,0,75140,0,75140,0,10/1/1990 &ndash; 9/30/1991,<p>No project description available</p>,
152489,FT-35843-91,2,0,0,0,0,0,0,,Michael,W.,O'Connell,,,,,,Michael W. O'Connell (Project Director: October 1990 to November 1991),"Michael W. O'Connell<br/>Regents of the University of California, Santa Barbara (Santa Barbara, CA 93106-0001)","Regents of the University of California, Santa Barbara",Santa Barbara,CA,93106-0001,USA,2/1/1991,1991,Iconoclasm and Theater in the Renaissance,Theater History and Criticism,Theater History and Criticism,3,Summer Stipends,6,Research Programs,0,0,3750,0,3750,0,3750,0,5/1/1991 &ndash; 9/30/1991,<p>No project description available</p>,
152523,FT-36077-91,2,0,0,0,0,0,0,,Carol,L.,Lansing,,,,,,Carol L. Lansing (Project Director: October 1990 to October 1991),"Carol L. Lansing<br/>Regents of the University of California, Santa Barbara (Gainesville, FL 32611-0001)","Regents of the University of California, Santa Barbara",Gainesville,FL,32611-0001,USA,2/1/1991,1991,Heresy and the Flesh in Medieval Orvieto,Medieval Studies,Medieval Studies,3,Summer Stipends,6,Research Programs,0,0,3750,0,3750,0,3750,0,5/1/1991 &ndash; 9/30/1991,<p>No project description available</p>,
145978,FB-28460-91,2,0,1,0,0,0,0,,Ivan,A.,Strenski,,,,,,Ivan A. Strenski (Project Director: September 1991 to April 1992),"Ivan A. Strenski<br/>Regents of the University of California, Santa Barbara (Santa Barbara, CA 93106-0001)","Regents of the University of California, Santa Barbara",Santa Barbara,CA,93106-0001,USA,11/1/1990,1990,"Ritual Sacrifice, Civic Sacrifice: Hubert and Mauss's SACRIFICE in Context",History of Religion,History of Religion,2,Fellowships for College Teachers and Independent Scholars,6,Research Programs,0,0,30000,0,23200,0,23200,0,1/1/1991 &ndash; 12/31/1991,<p>No project description available</p>,
160187,RL-21764-91,1,0,0,0,0,0,0,,Suzanne,J.,Levine,,,,,,Suzanne J. Levine (Project Director: June 1990 to April 1994),"Regents of the University of California, Santa Barbara (Santa Barbara, CA 93106-0001)<br/>Suzanne J. Levine (Project Director: June 1990 to April 1994)</div>","Regents of the University of California, Santa Barbara",Santa Barbara,CA,93106-0001,USA,2/1/1991,1991,"The Selected Stories of Adolfo Bioy Casares, 1950-86",Latin American Literature,Latin American Literature,36,Translations,6,Research Programs,0,0,37765,0,37765,0,37765,0,7/1/1991 &ndash; 12/31/1992,<p>To support the translation of a collection of stories by Argentine writer Adolfo Bioy Casares.</p>,
159521,RE-20980-91,1,0,0,0,0,0,0,,Elizabeth,H.,Witherell,,,,,,Elizabeth H. Witherell (Project Director: June 1990 to September 1994),"Regents of the University of California, Santa Barbara (Santa Barbara, CA 93106-0001)<br/>Elizabeth H. Witherell (Project Director: June 1990 to September 1994)</div>","Regents of the University of California, Santa Barbara",Santa Barbara,CA,93106-0001,USA,2/1/1991,1991,The Writings of Henry D. Thoreau,American Literature,American Literature,47,Editions,6,Research Programs,0,20000,107800,20000,107800,14986.59,122786.59,0,7/1/1991 &ndash; 12/31/1993,<p>To support continuing preparation of a critical edition of the works of Henry David Thoreau.</p>,
