ApplicationID,ApplicationNumber,ApplicantType,SuppCount,ProductCount,CoverageCount,PrizeCount,ParticipatingInstitutionCount,WhitePaper,WhitePaperPath,PDFirstname,PDMiddlename,PDLastname,PDNameSuffix,CoPDFirstname,CoPDMiddlename,CoPDLastname,CoPDNameSuffix,Participants,GranteeDisplay,Institution,InstCity,InstState,InstPostalCode,InstCountry,CouncilDate,YearAwarded,ProjectTitle,PrimaryDiscipline,AllDisciplines,ProgramID,ProgramName,DivisionID,DivisionName,OfferedOutright,OfferedMatching,ApprovedOutright,ApprovedMatching,AwardOutright,AwardMatching,OriginalAmount,SupplementAmount,GrantPeriod,ProjectDesc,ToSupport
204699,FA-56294-11,2,0,0,0,0,0,0,,Cecilia,,Mendez,,,,,,Cecilia Mendez (Project Director: May 2010 to March 2014),"Cecilia Mendez<br/>Regents of the University of California, Santa Barbara (Santa Barbara, CA 93106-0001)","Regents of the University of California, Santa Barbara",Santa Barbara,CA,93106-0001,USA,11/1/2010,2010,"The Wars Within: Civil Strife, National Imaginings, and the Rural Bases of the Peruvian State","History, General","History, General",1,Fellowships for University Teachers,6,Research Programs,0,0,50400,0,50400,0,50400,0,7/1/2012 &ndash; 6/30/2013,"<p>This project examines Peru's nineteenth-century civil wars in light of this country's most recent civil conflagration. Concurrently, it constitutes an exploration of Charles Tilly's theoretical claim that war making and state making are interrelated process. The project brings together the historian's archival expertise and classic questions of political science to illuminate little explored angles of Peru's Andean history. Since much of the population that mobilized for war were indigenous peasants, anthropology is also central to my inquest. Yet, anthropologists studying the connection between indigenous communities and the state in the Andes have failed to notice the extent to which one of the defining features of the nineteenth-century state in Peru was its militarized character. By adding this crucial variable I seek to provide an enduring interdisciplinary contribution to the humanities, to the history of Latin America, and to the scholarship on war and state making at large.</p>",
206613,PW-50959-11,1,0,0,0,0,0,0,,David,,Seubert,,,,,,David Seubert (Project Director: July 2010 to December 2014),"Regents of the University of California, Santa Barbara (Santa Barbara, CA 93106-0001)<br/>David Seubert (Project Director: July 2010 to December 2014)</div>","Regents of the University of California, Santa Barbara",Santa Barbara,CA,93106-0001,USA,3/1/2011,2011,Encyclopedic Discography of Victor Recordings (EDVR),Music History and Criticism,Music History and Criticism,253,Humanities Collections and Reference Resources,1,Preservation and Access,300000,0,300000,0,298969.79,0,298969.79,0,5/1/2011 &ndash; 5/31/2014,"<p>Continuing work on the comprehensive Encyclopedic Discography of Victor Recordings (1900-1950) that would add 42,000 entries from 1930 to 1940 to the Internet database of gramaphone recordings made by the Victor Talking Machine Company.</p>
<p>The Encyclopedic Discography of Victor Recordings (EDVR) is a comprehensive online resource that documents both the daily recording activities and all 78-rpm disc releases of the largest record company in the U.S., Victor Records, from 1900 to 1950. The online database currently documents more than 48,000 recording events, and by April 2011, with funding provided by NEH, it will include edited data on 82,000 recording sessions through 1930. An audio player will be added in the fall of 2010 to stream digitized recordings. Further support from the Endowment will enable the editing of another ten years (1931-1940) of data as well as the addition to the online database of the recordings made by Victor's corporate predecessor, the Berliner Gramophone Co., between 1892 and 1900.</p>",
208874,RQ-50588-11,1,0,1,0,0,0,0,,Elizabeth,H.,Witherell,,,,,,Elizabeth H. Witherell (Project Director: November 2010 to November 2014),"Regents of the University of California, Santa Barbara (Santa Barbara, CA 93106-0001)<br/>Elizabeth H. Witherell (Project Director: November 2010 to November 2014)</div>","Regents of the University of California, Santa Barbara",Santa Barbara,CA,93106-0001,USA,7/1/2011,2011,The Writings of Henry D. Thoreau: Correspondence,American Literature,American Literature,193,Scholarly Editions and Translations,6,Research Programs,200000,45000,200000,45000,199002.53,45000,244002.53,0,9/1/2011 &ndash; 8/31/2014,"<p>Completion of editorial work and preparation for publication of Henry David Thoreau's Correspondence, comprising 3 volumes of letters from 1834 through 1861. (36 months)</p>
<p>The Writings of Henry D. Thoreau provides, for the first time, complete and accurate texts of Thoreau's Journal, correspondence, and writings for publication. This application requests support to complete and publish Correspondence 1: 1834-1848 (2012); bring Correspondence 2: 1849-1856 to within two months of publication (2014); and complete and submit to Princeton University Press the text and apparatus of Correspondence 3: 1856-1861 (2017). Letters are fully annotated and editorial work is documented in lists of alterations, emendations, and variants. Textual, historical, and general introductions contextualize the letters in each volume; indexes provide full access to texts and annotations. About half of the 648 letters included in Correspondence 1-3 either have not been published before, have not been collected before, or are newly based on manuscript sources, compared with the most recent edition, Walter Harding and Carl Bode's Correspondence of Henry David Thoreau (1958).</p>",
209672,HD-51433-11,1,0,0,0,0,0,1,20110223-HD\GRANT10806346\Reports\13-104546.pdf,Alan,Y.,Liu,,Rita,,Raley,,Alan Y. Liu (Project Director: March 2011 to August 2013)<br/>Rita Raley (Co Project Director: March 2011 to August 2013),"Regents of the University of California, Santa Barbara (Santa Barbara, CA 93106-0001)<br/>Alan Y. Liu (Project Director: March 2011 to August 2013)<br/>Rita Raley (Co Project Director: March 2011 to August 2013)</div>","Regents of the University of California, Santa Barbara",Santa Barbara,CA,93106-0001,USA,7/1/2011,2011,RoSE Research-oriented Social Environment: Bibliographical Knowledge as Social Knowledge,"Interdisciplinary Studies, General","Interdisciplinary Studies, General",247,Digital Humanities Start-Up Grants,12,Digital Humanities,0,0,50000,0,49856.95,0,49856.95,0,9/1/2011 &ndash; 9/30/2012,"<p>The further development of a digital environment that explores the use of social networking approaches to connect humanities bibliographical resources with humanities scholars and students.</p>
<p>RoSE is a Web-based system that shapes humanities bibliographical resources into a social-computing model presenting the past and present as one living ""social network."" In the largest terms, it is an experiment in how the humanities can engage with today's expansive knowledge society from both inside and outside the ""library,"" in the process connecting current social-networking practices to a full sense of the historical human record. Stocked with initial information gathered from knowledge bases, RoSE provides profile pages for persons and documents, other data, and visualizations showing the interrelated nature of knowledge. Uniquely, it allows users to add metadata on top of standard bibliographical data to facilitate a social-network-like sense of active relation to the objects of research. RoSE is in early prototype. We seek to improve several key areas so that we can make RoSE available as an ""open beta"" for humanities scholars and other digital humanities projects to explore.</p>",
198255,FA-55083-10,2,0,1,0,1,0,0,,Erika,Diane,Rappaport,,,,,,Erika Diane Rappaport (Project Director: May 2009 to September 2011),"Erika Diane Rappaport<br/>Regents of the University of California, Santa Barbara (Santa Barbara, CA 93106-0001)","Regents of the University of California, Santa Barbara",Santa Barbara,CA,93106-0001,USA,11/1/2009,2009,"Tea Parties: Britishness, Imperial Legacies and Global Consumer Cultures",British History,British History,1,Fellowships for University Teachers,6,Research Programs,0,0,50400,0,50400,0,50400,0,7/1/2010 &ndash; 6/30/2011,"<p>Tea Parties examines the creation and significance of global markets for Indian tea from its earliest history in the 1820s through the formal end of the British Empire in the 1960s. It does so to consider what role imperialism played in the development of global forms of mass consumption. Even as the Victorian economy divided the world into producing and consuming nations, it also created structures and ideologies that broke down those divisions and imagined much of the world as potential consumers. Though economic historians have long acknowledged the significance of non-western markets, recent scholarship has failed to consider how imperialism shaped the cultural, social and political history of global consumer cultures. A focus on how Indian teas were sold in markets as diverse as North America, Europe, Africa and South Asia, illuminates how imperial and racial ideologies were critical to creating and conceptualizing transnational economic relationships and cultures.</p>",
200174,PW-50602-10,1,0,7,3,0,0,0,,Patricia,,Fumerton,,,,,,Patricia Fumerton (Project Director: July 2009 to November 2013),"Regents of the University of California, Santa Barbara (Santa Barbara, CA 93106-0001)<br/>Patricia Fumerton (Project Director: July 2009 to November 2013)</div>","Regents of the University of California, Santa Barbara",Santa Barbara,CA,93106-0001,USA,2/1/2010,2010,English Broadside Ballad Archive,British Literature,British Literature,253,Humanities Collections and Reference Resources,1,Preservation and Access,0,0,315000,0,315000,0,315000,0,7/1/2010 &ndash; 6/30/2013,"<p>The digitization and incorporation into an electronic archive of images from 1,100 English broadside ballads, mostly from the 17th century, as well as illustrative woodcuts, facsimile transcriptions, contextual essays, and audio files of sung versions of the ballads.</p>
<p>The University of California-Santa Barbara requests critical funding to launch an important 3rd stage of its electronic English Broadside Ballad Archive (EBBA) and mount online the British Library's Bagford, Luttrell, Huth, and Osterley Park collections of mostly 17th century ballads, approx. 1,100 works. The BL has granted UCSB unprecedented permission to add its ballad holdings to EBBA. The expanded archive will provide high-quality digital facsimiles as well as facsimile transcriptions, which preserve the ballads' original look, with all their ornament, while transcribing the original font into easily readable roman type. In addition, we will offer deep cataloguing according to TEI/XML/MARC standards, song recordings, informative essays, flexible search functions, and an enhanced technological infrastructure. An expanded EBBA will open up new ways of understanding early modern popular culture, literature, art, and music as well as the great collectors of the time.</p>",
202662,RZ-51226-10,1,0,0,0,0,0,0,,Jocelyn,,Holland,,,,,,Jocelyn Holland (Project Director: November 2009 to June 2012),"Regents of the University of California, Santa Barbara (Santa Barbara, CA 93106-0001)<br/>Jocelyn Holland (Project Director: November 2009 to June 2012)</div>","Regents of the University of California, Santa Barbara",Santa Barbara,CA,93106-0001,USA,5/1/2010,2010,Keeping Time: Scientific Theory and Cultural Practice from Galileo's Pendulum to the Atomic Clock,"History, General","History, General",5,Collaborative Research,6,Research Programs,0,0,21000,0,21000,0,21000,0,9/1/2010 &ndash; 8/31/2011,"<p>Three workshops, one conference, and an edited volume (print and online) on the scientific theory and cultural practice of keeping time from Galileo to the atomic clock. (10 months)</p>
<p>Although the question of time is arguably relevant to every single academic field, interdisciplinary research on time has been slow to evolve. This is particularly the case with regard to technological developments in the history of time-keeping as they relate to theories of time in both the sciences and the humanities. We therefore propose a collaborative research project which will bridge the theory, technology and cultural practices of time-keeping and be conducted through workshops and a conference. The project has two main objectives: 1) to propose a new line of inquiry which understands the technological advances in time-keeping as an important link between scientific and historical research agendas, and 2) to understand the radical developments in 20th-century timekeeping in an informed historical context.</p>",
194540,PW-50447-09,1,0,0,0,0,0,0,,David,,Seubert,,,,,,David Seubert (Project Director: August 2008 to August 2011),"Regents of the University of California, Santa Barbara (Santa Barbara, CA 93106-0001)<br/>David Seubert (Project Director: August 2008 to August 2011)</div>","Regents of the University of California, Santa Barbara",Santa Barbara,CA,93106-0001,USA,2/1/2009,2009,Encyclopedic Discography of Victor Recordings,Music History and Criticism,Music History and Criticism,253,Humanities Collections and Reference Resources,1,Preservation and Access,350000,0,350000,0,350000,0,350000,0,5/1/2009 &ndash; 4/30/2011,"<p>This project will add 30,000 additional entries to the comprehensive Encyclopedic Discography of Victor Recordings (1900-1950), which is a searchable electronic database freely available on the Internet.</p>
<p>The Encyclopedic Discography of Victor Recordings (EDVR) is a comprehensive online resource that documents both the daily recording activities and all 78-rpm disc releases of the largest record company in the U.S., Victor Records, from 1900 to 1950. It details more than 165,000 recording sessions produced by the company, including information about more than 300,000 ""takes"" and over 90,000 works recorded with the participation of 29,000 performers. The EDVR database is the basis of the most comprehensive discographic resource yet available over the internet, with recording data on 40,000 sessions through 1920 to be available online at the completion of the 2007-09 grant cycle and an additional 30,000 sessions from the 1920s by mid-2011. The recorded content includes music of all types--classical, popular, and ethnic--as well as radio programs, motion picture soundtracks, drama, poetry, instruction, and other genres of recorded sound.</p>",
189707,PW-50005-08,1,0,63,0,0,0,0,,Patricia,,Fumerton,,,,,,Patricia Fumerton (Project Director: July 2007 to September 2011),"Regents of the University of California, Santa Barbara (Santa Barbara, CA 93106-0001)<br/>Patricia Fumerton (Project Director: July 2007 to September 2011)</div>","Regents of the University of California, Santa Barbara",Santa Barbara,CA,93106-0001,USA,2/1/2008,2008,Roxburghe Ballad Archive,British Literature,British Literature,253,Humanities Collections and Reference Resources,1,Preservation and Access,350000,0,350000,0,350000,0,350000,0,7/1/2008 &ndash; 6/30/2011,"<p>Digitizing images of 1,500 17th-century English ballads held by the British Library, as well as illustrative woodcuts, facsimile transcriptions, contextual essays, and audio files of sung versions of the ballads, and incorporating them into an electronic archive.</p>
<p>The University of California-Santa Barbara is requesting critical NEH funding to launch an important second stage of its electronic English Broadside Ballad Archive (EBBA) and mount online the Roxburghe collection of mostly 17th century ballads?all 1,500 of them. The British Library has granted UCSB unprecedented permission to add its ballad collection to EBBA. The Roxburghe Ballad Archive (RBA) will provide high-quality digital facsimiles of the ballads as well as ?facsimile transcriptions,? which preserve the ballads? original ?look,? with all their ornament, while transcribing the black-letter font into easily readable roman type. In addition, we offer deep cataloguing according to strict TEI/XML standards, song recordings, informative essays, and flexible search functions. The RBA will come close to doubling the size and value of EBBA and will open up new ways of understanding early modern popular culture, literature, art, and music as well as the great collectors of the time.</p>",
190877,FT-56132-08,2,0,0,0,0,0,0,,Elizabeth,Heckendorn,Cook,,,,,,Elizabeth Heckendorn Cook (Project Director: October 2007 to February 2009),"Elizabeth Heckendorn Cook<br/>Regents of the University of California, Santa Barbara (Santa Barbara, CA 93106-0001)","Regents of the University of California, Santa Barbara",Santa Barbara,CA,93106-0001,USA,2/1/2008,2008,British Silva Culture: Trees and Forests in Long Eighteenth-Century Literature,British Literature,British Literature,3,Summer Stipends,6,Research Programs,0,0,6000,0,6000,0,6000,0,6/1/2008 &ndash; 8/31/2008,"<p>""British Silva Culture"" is the first booklength study of trees in the cultural media of the long eighteenth century (roughly 1650-1820). Chapters examine how trees and forests were represented in poetry, novels, travel narratives, natural-history writing, silvicultural manuals, and the visual arts, in the context of the material history of government and private woodland management and timber production. At the same time that Britain's Crown and private forests at home and abroad were being managed for increased timber production, ""pet"" trees and forests became repositories for new kinds of affect and new models of literary authority. Representations of trees and forests underwrote the construction of national and personal identities in British and colonial literature and culture; grounded ethical, philosophical, and political debates about utilitarianism and other modes of value; and framed dramas about personal and public character.</p>",
184839,PM-50058-07,1,0,0,0,0,0,0,,David,,Seubert,,,,,,David Seubert (Project Director: July 2006 to March 2010),"Regents of the University of California, Santa Barbara (Santa Barbara, CA 93106-0001)<br/>David Seubert (Project Director: July 2006 to March 2010)</div>","Regents of the University of California, Santa Barbara",Santa Barbara,CA,93106-0001,USA,2/1/2007,2007,Encyclopedic Discography of Victor Recordings (EDVR),Music History and Criticism,Music History and Criticism,235,Reference Materials,1,Preservation and Access,0,0,323040,0,323040,0,323040,0,5/1/2007 &ndash; 4/30/2009,"<p>The editing of a comprehensive database for the period 1913-1928 that documents the daily recording activities of Victor Talking Machine Company and Victor Records, the largest American record company in business from 1900 to 1950.</p>
<p>The Encyclopedic Discography of Victor Recordings is a comprehensive database which documents the daily recording activities from 1900 to 1950 of the largest record company in the U.S., Victor Records. It details every recording session produced by the company?over 150,000?including information about more than 400,000 ""takes"" and over 80,000 works recorded with the participation of 25,000 performers. The database will be the basis of the most comprehensive discographic resource yet available over the internet. The content recorded includes music of all types?classical, popular, and ethnic?and radio programs, motion picture soundtracks, drama, poetry, instruction, and other genres of recorded sound.</p>",
186350,RZ-50718-07,1,0,0,0,0,0,0,,Anthony,Jerome,Barbieri,,,,,,Anthony Jerome Barbieri (Project Director: November 2006 to June 2010),"Regents of the University of California, Santa Barbara (Santa Barbara, CA 93106-0001)<br/>Anthony Jerome Barbieri (Project Director: November 2006 to June 2010)</div>","Regents of the University of California, Santa Barbara",Santa Barbara,CA,93106-0001,USA,5/1/2007,2007,"Law, State, and Society in Early Imperial China: Translation and Study of the Zhangjiashan Legal Texts",East Asian History,East Asian History,5,Collaborative Research,6,Research Programs,0,0,120000,0,120000,0,120000,0,7/1/2007 &ndash; 6/30/2009,"<p>The translation, annotation, analysis, and interpretation of a group of Chinese legal and administrative texts from the late 3rd to early 2nd centuries BCE, which were recently excavated from a tomb in Hubei Province, China. (24 months)</p>
<p>This project will translate and study a group of Chinese legal and administrative texts dating from the Qin and Han empires (late 3rd-early 2nd centuries BCE), recently excavated from a tomb at Zhangjiashan (Hubei Province, China). The importance of these texts for understanding the development of the early imperial legal and administrative system, social organization, and cultural values cannot be overemphasized. These extraordinarily detailed legal texts show how the Han rulers adopted and adapted Qin legal, bureaucratic, social, and economic precedents and how they and their Qin predecessors used the law to dominate and exploit local populations, including minorities, eventually forging a Chinese people. Our translation will be of value not only to historians of China and comparative historians, but also to those studying the importation of Western law into modern China.</p>",
179614,PA-52089-06,1,0,4,4,0,0,0,,Patricia,,Fumerton,,,,,,Patricia Fumerton (Project Director: July 2005 to November 2009),"Regents of the University of California, Santa Barbara (Santa Barbara, CA 93106-0001)<br/>Patricia Fumerton (Project Director: July 2005 to November 2009)</div>","Regents of the University of California, Santa Barbara",Santa Barbara,CA,93106-0001,USA,2/1/2006,2006,Creating the Pepys Ballad Archive,British Literature,British Literature,19,Preservation/Access Projects,1,Preservation and Access,325000,0,325000,0,325000,0,325000,0,7/1/2006 &ndash; 6/30/2009,"<p>The completion of an online archive of all 1,857 broadside ballads collected by the English diarist Samuel Pepys (1633-1703), accompanied by transcriptions, sung versions of the ballads, and background essays.</p>",
180428,FT-54278-06,2,0,0,0,0,0,0,,Cynthia,Jane,Brown,,,,,,Cynthia Jane Brown (Project Director: October 2005 to January 2007),"Cynthia Jane Brown<br/>Regents of the University of California, Santa Barbara (Santa Barbara, CA 93106-0001)","Regents of the University of California, Santa Barbara",Santa Barbara,CA,93106-0001,USA,2/1/2006,2006,Ambiguous Images: Women of Power in Late Medieval and Early Modern Europe,"Interdisciplinary Studies, General","Interdisciplinary Studies, General",3,Summer Stipends,6,Research Programs,0,0,5000,0,5000,0,5000,0,7/1/2006 &ndash; 6/30/2007,"<p>AMBIGUOUS IMAGES examines the cultural issues surrounding female modes of empowerment and book production in late medieval and early modern Europe. Centered on Anne of Brittany (1477-1514), twice queen of France, the study advances new ways of understanding famous women in politics by analyzing what they read, and by investigating the literary, artistic – and ultimately political -- means deployed by the makers of the books they owned. I argue that the complex verbal and visual imagery of women of influence in late medieval Europe -- complex because of its inherently conflicting portrayal of power and subordination -- can only be understood fully by drawing on the intersection of pertinent literary, historical, and art historical sources.</p>",
181672,RQ-50241-06,1,0,0,0,0,0,0,,Elizabeth,H.,Witherell,,,,,,Elizabeth H. Witherell (Project Director: November 2005 to June 2010),"Regents of the University of California, Santa Barbara (Santa Barbara, CA 93106-0001)<br/>Elizabeth H. Witherell (Project Director: November 2005 to June 2010)</div>","Regents of the University of California, Santa Barbara",Santa Barbara,CA,93106-0001,USA,5/1/2006,2006,The Writings of Henry D. Thoreau,American Literature,American Literature,193,Scholarly Editions and Translations,6,Research Programs,0,60000,100000,60000,100000,60000,160000,0,7/1/2006 &ndash; 6/30/2009,"<p>Publication of Henry David Thoreau's Excursions, Journals, and Correspondence. (36 months)</p>
<p>In the 2006-2009 grant period, staff members at the Thoreau edition will work with volume editors located at other institutions to publish EXCURSIONS (2006), JOURNAL 7: 1853-1854 (2007), and CORRESPONDENCE I: 1836-1848 (2009); bring CORRESPONDENCE 2: 1849-1856 to within a year of publication (2010); submit the text of JOURNAL 9: 1854-1855 to the press (2011); begin a review of the text and apparatus of JOURNAL 10: 1855-1856 (2012); and complete transcriptions of Thoreau's manuscript JOURNAL and make available on the web about 4,800 pages of transcript. University of California, Santa Barbara, and other sources will provide cost sharing at the level of 76 percent of total project costs.</p>",
